Lark_ID,firstInterval,firstDet,Field_ID,unique_ID,Survey_Event_ID,Observer,surveyEvent,Survey_Date,Visit,Survey_Time,Temp,Sky_Code,Site_Comments,Number_Detected,Individual_ID,Sex,Age,Distance_1,Min_1,Min_2,Min_3,Min_4,Min_5,Min_6,Min_7,Min_8,Min_9,Min_10,Min_11,Min_12,Notes,LatUTM,LongUTM,UTM_X,UTM_Y,Count_Date,Start_Time,Site_ID,Interval_1,Interval_2,Interval_3,Interval_4,Interval_5,Interval_6,Interval_7,Interval_8,Interval_9,Interval_10,Interval_11,Interval_12,dayOfYear,surveyYear,sunrise,mas
913,2,Singing,25_4272-1,4272,745,GRH,2025,5/15/2025,2,05:52:00,47,Mostly cloudy,I think bird was beyond hedgerow in green field (with beans?),1,1,Male,Adult,165,X,S,S,S,X,S,S,S,S,S,S,S,NA,NA,NA,481904.68,4968342.5,2025-05-15,5H 52M 0S,4272,NA,Singing,Singing,Singing,NA,Singing,Singing,Singing,Singing,Singing,Singing,Singing,135,2025,2025-05-15T12:46:36Z,6.000000000000032
914,2,Singing,25_3699-1,3699,731,GRH,2025,5/15/2025,1,06:58:00,48,Mostly cloudy,NA,3,1,Male,Adult,148,X,S,V,V,V,V,V,S,S,S,V,V,NA,NA,NA,481439.37,4971737.5,2025-05-15,6H 58M 0S,3699,NA,Singing,Visual,Visual,Visual,Visual,Visual,Singing,Singing,Singing,Visual,Visual,135,2025,2025-05-15T12:46:36Z,72.00000000000001
915,8,Singing,25_3699-1,3699,731,GRH,2025,5/15/2025,1,06:58:00,48,Mostly cloudy,NA,3,2,Male,Adult,41,X,X,X,X,X,X,X,S,S,X,X,X,NA,NA,NA,481439.37,4971737.5,2025-05-15,6H 58M 0S,3699,NA,NA,NA,NA,NA,NA,NA,Singing,Singing,NA,NA,NA,135,2025,2025-05-15T12:46:36Z,72.00000000000001
916,11,Visual,25_3699-1,3699,731,GRH,2025,5/15/2025,1,06:58:00,48,Mostly cloudy,NA,3,3,Female,Adult,58,X,X,X,X,X,X,X,X,X,X,V,V,NA,NA,NA,481439.37,4971737.5,2025-05-15,6H 58M 0S,3699,NA,NA,NA,NA,NA,NA,NA,NA,NA,NA,Visual,Visual,135,2025,2025-05-15T12:46:36Z,72.00000000000001
917,3,Singing,25_3467-1,3467,729,GRH,2025,5/15/2025,1,07:53:00,49,Mostly cloudy,NA,1,1,Male,Adult,541,X,X,S,X,X,X,X,X,X,S,S,S,NA,NA,NA,481957.37,4972381.5,2025-05-15,7H 53M 0S,3467,NA,NA,Singing,NA,NA,NA,NA,NA,NA,Singing,Singing,Singing,135,2025,2025-05-15T12:46:36Z,126.99999999999997
918,5,Singing,25_3197-1,3197,710,GRH,2025,5/20/2025,1,08:16:00,52,Partly cloudy,NA,1,1,Male,Adult,168,X,X,X,X,S,S,S,S,S,S,X,X,NA,NA,NA,478789.96,4953782,2025-05-20,8H 16M 0S,3197,NA,NA,NA,NA,Singing,Singing,Singing,Singing,Singing,Singing,NA,NA,140,2025,2025-05-20T12:41:35Z,155.00000000000003
919,1,Singing,25_960-1,960,706,GRH,2025,5/20/2025,1,10:11:00,55,Partly cloudy,"RTHA perched immediately above. Can only be sure of 1 singing male with noise present, may be 2.",1,1,Male,Adult,76,S,S,S,S,S,S,S,S,X,X,S,X,NA,NA,NA,476853.34,4954326.5,2025-05-20,10H 11M 0S,960,Singing,Singing,Singing,Singing,Singing,Singing,Singing,Singing,NA,NA,Singing,NA,140,2025,2025-05-20T12:41:35Z,270
920,1,Singing,25_4140-1,4140,764,GRH,2025,5/21/2025,1,06:05:00,42,Partly cloudy,NA,2,1,Male,Adult,116,S,S,S,S,X,C,X,X,X,X,C,X,NA,NA,NA,470684.06,4984992,2025-05-21,6H 5M 0S,4140,Singing,Singing,Singing,Singing,NA,Calling,NA,NA,NA,NA,Calling,NA,141,2025,2025-05-21T12:40:40Z,24.999999999999964
921,11,Visual,25_4140-1,4140,764,GRH,2025,5/21/2025,1,06:05:00,42,Partly cloudy,NA,2,2,Unknown,Adult,130,X,X,X,X,X,X,X,X,X,X,V,X,NA,NA,NA,470684.06,4984992,2025-05-21,6H 5M 0S,4140,NA,NA,NA,NA,NA,NA,NA,NA,NA,NA,Visual,NA,141,2025,2025-05-21T12:40:40Z,24.999999999999964
922,7,Singing,25_9-1,9,762,GRH,2025,5/21/2025,1,07:10:00,45,Clear,NA,1,1,Male,Adult,415,X,X,X,X,X,X,S,S,S,X,X,S,NA,NA,NA,478280.12,4996115.5,2025-05-21,7H 10M 0S,9,NA,NA,NA,NA,NA,NA,Singing,Singing,Singing,NA,NA,Singing,141,2025,2025-05-21T12:40:40Z,90
923,1,Singing,25_1397-1,1397,760,GRH,2025,5/21/2025,1,07:56:00,49,Clear,Heard M from last point skylarking behind me,2,1,Male,Adult,484,S,S,S,V,X,X,X,X,X,S,X,X,NA,NA,NA,475327.5,4987807.5,2025-05-21,7H 56M 0S,1397,Singing,Singing,Singing,Visual,NA,NA,NA,NA,NA,Singing,NA,NA,141,2025,2025-05-21T12:40:40Z,136
924,1,Singing,25_1397-1,1397,760,GRH,2025,5/21/2025,1,07:56:00,49,Clear,Heard M from last point skylarking behind me,2,2,Male,Adult,393,S,S,S,X,X,X,X,S,S,X,X,X,NA,NA,NA,475327.5,4987807.5,2025-05-21,7H 56M 0S,1397,Singing,Singing,Singing,NA,NA,NA,NA,Singing,Singing,NA,NA,NA,141,2025,2025-05-21T12:40:40Z,136
925,4,Singing,25_1577-1,1577,761,GRH,2025,5/21/2025,1,07:39:00,46,Clear,NOHA fly-through,1,1,Male,Adult,298,X,X,X,S,S,S,S,S,X,X,X,X,NA,NA,NA,474015.37,4988462.5,2025-05-21,7H 39M 0S,1577,NA,NA,NA,Singing,Singing,Singing,Singing,Singing,NA,NA,NA,NA,141,2025,2025-05-21T12:40:40Z,119
926,6,Singing,25_3815-1,3815,758,GRH,2025,5/21/2025,1,08:39:00,51,Clear,NA,1,1,Male,Adult,361,X,X,X,X,X,S,S,X,S,X,X,X,NA,NA,NA,478448.56,4987703.5,2025-05-21,8H 39M 0S,3815,NA,NA,NA,NA,NA,Singing,Singing,NA,Singing,NA,NA,NA,141,2025,2025-05-21T12:40:40Z,179
927,4,Singing,25_3915-1,3915,759,GRH,2025,5/21/2025,1,08:16:00,50,Clear,NA,3,1,Male,Adult,178,X,X,X,S,V,V,X,X,X,X,X,X,NA,NA,NA,475972,4987670.5,2025-05-21,8H 16M 0S,3915,NA,NA,NA,Singing,Visual,Visual,NA,NA,NA,NA,NA,NA,141,2025,2025-05-21T12:40:40Z,156.00000000000003
928,5,Visual,25_3915-1,3915,759,GRH,2025,5/21/2025,1,08:16:00,50,Clear,NA,3,2,Male,Adult,178,X,X,X,X,V,V,X,X,X,X,X,X,NA,NA,NA,475972,4987670.5,2025-05-21,8H 16M 0S,3915,NA,NA,NA,NA,Visual,Visual,NA,NA,NA,NA,NA,NA,141,2025,2025-05-21T12:40:40Z,156.00000000000003
929,4,Visual,25_3915-1,3915,759,GRH,2025,5/21/2025,1,08:16:00,50,Clear,NA,3,3,Unknown,Adult,169,X,X,X,V,X,X,X,X,X,X,X,X,NA,NA,NA,475972,4987670.5,2025-05-21,8H 16M 0S,3915,NA,NA,NA,Visual,NA,NA,NA,NA,NA,NA,NA,NA,141,2025,2025-05-21T12:40:40Z,156.00000000000003
930,8,Singing,25_2686-1,2686,756,GRH,2025,5/21/2025,1,09:25:00,54,Clear,NA,1,1,Male,Adult,181,X,X,X,X,X,X,X,S,S,S,S,S,NA,NA,NA,483579.4,4990291,2025-05-21,9H 25M 0S,2686,NA,NA,NA,NA,NA,NA,NA,Singing,Singing,Singing,Singing,Singing,141,2025,2025-05-21T12:40:40Z,224.99999999999994
931,1,Visual,25_1382-1,1382,770,CWW,2025,5/22/2025,1,09:08:00,47,Drizzle,Harrier hunting area. Young pea field,2,1,Male,Adult,31,V,V,V,V,V,V,V,V,V,V,V,X,NA,NA,NA,496755.62,4929558.5,2025-05-22,9H 8M 0S,1382,Visual,Visual,Visual,Visual,Visual,Visual,Visual,Visual,Visual,Visual,Visual,NA,142,2025,2025-05-22T12:39:47Z,208.99999999999994
932,8,Singing,25_1382-1,1382,770,CWW,2025,5/22/2025,1,09:08:00,47,Drizzle,Harrier hunting area. Young pea field,2,2,Male,Adult,240,X,X,X,X,X,X,X,S,S,S,V,V,NA,NA,NA,496755.62,4929558.5,2025-05-22,9H 8M 0S,1382,NA,NA,NA,NA,NA,NA,NA,Singing,Singing,Singing,Visual,Visual,142,2025,2025-05-22T12:39:47Z,208.99999999999994
936,2,Singing,25_5804-1,5804,771,CWW,2025,5/22/2025,1,09:44:00,48,Mostly cloudy,"Young peas, same field as previous detection. Possibly individual 2 from that survey (unlikely - 1.5km away)",1,1,Male,Adult,250,X,S,X,X,X,X,X,X,X,X,X,X,NA,NA,NA,497399.37,4927954,2025-05-22,9H 44M 0S,5804,NA,Singing,NA,NA,NA,NA,NA,NA,NA,NA,NA,NA,142,2025,2025-05-22T12:39:47Z,244.99999999999994
937,1,Singing,25_3004-1,3004,784,CWW,2025,6/10/2025,1,08:10:00,58,Clear,"Peas and radishes. Individual 2 was visually detected while skylarking, very distant, too far to hear",2,1,Male,Adult,41,S,X,X,X,X,X,X,X,X,X,S,X,NA,NA,NA,496111.21,4930863,2025-06-10,8H 10M 0S,3004,Singing,NA,NA,NA,NA,NA,NA,NA,NA,NA,Singing,NA,161,2025,2025-06-10T12:29:34Z,160.99999999999997
938,8,Visual,25_3004-1,3004,784,CWW,2025,6/10/2025,1,08:10:00,58,Clear,"Peas and radishes. Individual 2 was visually detected while skylarking, very distant, too far to hear",2,2,Male,Adult,700,X,X,X,X,X,X,X,V,X,X,X,X,NA,NA,NA,496111.21,4930863,2025-06-10,8H 10M 0S,3004,NA,NA,NA,NA,NA,NA,NA,Visual,NA,NA,NA,NA,161,2025,2025-06-10T12:29:34Z,160.99999999999997
939,2,Singing,25_2759-1,2759,811,GRH,2025,6/6/2025,1,07:00:00,57,Clear,only heard once in gap in traffic,1,1,Male,Adult,188,X,S,X,X,X,X,X,X,X,X,X,X,NA,NA,NA,517700.84,5009230,2025-06-06,7H 0M 0S,2759,NA,Singing,NA,NA,NA,NA,NA,NA,NA,NA,NA,NA,157,2025,2025-06-06T12:30:38Z,90
940,1,Singing,25_1992-1,1992,812,GRH,2025,6/6/2025,1,06:39:00,56,Clear,"Lark was over hill, out of view/rangefinder LOS",1,1,Male,Adult,160,S,S,S,S,X,X,X,X,X,X,X,S,NA,NA,NA,500298.28,4928541.5,2025-06-06,6H 39M 0S,1992,Singing,Singing,Singing,Singing,NA,NA,NA,NA,NA,NA,NA,Singing,157,2025,2025-06-06T12:30:38Z,69.00000000000003
941,6,Singing,25_1356-1,1356,814,GRH,2025,6/6/2025,1,05:49:00,54,Partly cloudy,"Realizing that corn is just a very large, mutated grass. Male skylarking, watched climb, didn't see takeoff pt, rest seen aerially as well",4,1,Male,Adult,268,X,X,X,X,X,S,X,S,S,X,S,S,NA,NA,NA,492043.46,4923810,2025-06-06,5H 49M 0S,1356,NA,NA,NA,NA,NA,Singing,NA,Singing,Singing,NA,Singing,Singing,157,2025,2025-06-06T12:30:38Z,18.999999999999986
942,10,Visual,25_1356-1,1356,814,GRH,2025,6/6/2025,1,05:49:00,54,Partly cloudy,"Realizing that corn is just a very large, mutated grass. Male skylarking, watched climb, didn't see takeoff pt, rest seen aerially as well",4,2,Unknown,Adult,540,X,X,X,X,X,X,X,X,X,V,V,X,NA,NA,NA,492043.46,4923810,2025-06-06,5H 49M 0S,1356,NA,NA,NA,NA,NA,NA,NA,NA,NA,Visual,Visual,NA,157,2025,2025-06-06T12:30:38Z,18.999999999999986
943,10,Visual,25_1356-1,1356,814,GRH,2025,6/6/2025,1,05:49:00,54,Partly cloudy,"Realizing that corn is just a very large, mutated grass. Male skylarking, watched climb, didn't see takeoff pt, rest seen aerially as well",4,3,Unknown,Adult,540,X,X,X,X,X,X,X,X,X,V,X,X,NA,NA,NA,492043.46,4923810,2025-06-06,5H 49M 0S,1356,NA,NA,NA,NA,NA,NA,NA,NA,NA,Visual,NA,NA,157,2025,2025-06-06T12:30:38Z,18.999999999999986
944,10,Visual,25_1356-1,1356,814,GRH,2025,6/6/2025,1,05:49:00,54,Partly cloudy,"Realizing that corn is just a very large, mutated grass. Male skylarking, watched climb, didn't see takeoff pt, rest seen aerially as well",4,4,Unknown,Adult,540,X,X,X,X,X,X,X,X,X,V,X,X,NA,NA,NA,492043.46,4923810,2025-06-06,5H 49M 0S,1356,NA,NA,NA,NA,NA,NA,NA,NA,NA,Visual,NA,NA,157,2025,2025-06-06T12:30:38Z,18.999999999999986
945,1,Singing,25_671-1,671,815,GRH,2025,6/6/2025,1,05:29:00,54,Partly cloudy,NA,3,1,Male,Adult,323,S,S,S,S,S,S,S,S,S,S,S,S,NA,NA,NA,493670.65,4927303.5,2025-06-06,5H 29M 0S,671,Singing,Singing,Singing,Singing,Singing,Singing,Singing,Singing,Singing,Singing,Singing,Singing,157,2025,2025-06-06T12:30:38Z,-0.9999999999999964
946,2,Singing,25_671-1,671,815,GRH,2025,6/6/2025,1,05:29:00,54,Partly cloudy,NA,3,2,Male,Adult,154,X,S,S,S,S,S,S,S,X,S,X,X,NA,NA,NA,493670.65,4927303.5,2025-06-06,5H 29M 0S,671,NA,Singing,Singing,Singing,Singing,Singing,Singing,Singing,NA,Singing,NA,NA,157,2025,2025-06-06T12:30:38Z,-0.9999999999999964
947,7,Singing,25_671-1,671,815,GRH,2025,6/6/2025,1,05:29:00,54,Partly cloudy,NA,3,3,Male,Adult,303,X,X,X,X,X,X,S,S,S,S,S,X,NA,NA,NA,493670.65,4927303.5,2025-06-06,5H 29M 0S,671,NA,NA,NA,NA,NA,NA,Singing,Singing,Singing,Singing,Singing,NA,157,2025,2025-06-06T12:30:38Z,-0.9999999999999964
948,5,Singing,25_4981-1,4981,820,GRH,2025,6/5/2025,1,08:23:00,55,Mostly cloudy,NA,1,1,Male,Adult,NA,X,X,X,X,S,X,X,X,X,X,X,X,NA,NA,NA,504400.46,4913563,2025-06-05,8H 23M 0S,4981,NA,NA,NA,NA,Singing,NA,NA,NA,NA,NA,NA,NA,156,2025,2025-06-05T12:30:59Z,172.99999999999997
949,9,Singing,25_5774-1,5774,822,GRH,2025,6/5/2025,1,07:24:00,54,Mostly cloudy,NA,1,1,Male,Adult,131,X,X,X,X,X,X,X,X,S,X,X,X,NA,NA,NA,494534.65,4896995.5,2025-06-05,7H 24M 0S,5774,NA,NA,NA,NA,NA,NA,NA,NA,Singing,NA,NA,NA,156,2025,2025-06-05T12:30:59Z,114.00000000000003
950,1,Singing,25_1074-1,1074,826,GRH,2025,6/5/2025,1,05:40:00,51,Mostly cloudy,NA,2,1,Male,Adult,186,S,S,S,X,X,X,X,X,X,X,X,X,NA,NA,NA,487118.46,4900696.5,2025-06-05,5H 40M 0S,1074,Singing,Singing,Singing,NA,NA,NA,NA,NA,NA,NA,NA,NA,156,2025,2025-06-05T12:30:59Z,10.000000000000018
951,1,Singing,25_1074-1,1074,826,GRH,2025,6/5/2025,1,05:40:00,51,Mostly cloudy,NA,2,2,Male,Adult,161,S,S,X,X,X,X,X,X,X,X,X,S,NA,NA,NA,487118.46,4900696.5,2025-06-05,5H 40M 0S,1074,Singing,Singing,NA,NA,NA,NA,NA,NA,NA,NA,NA,Singing,156,2025,2025-06-05T12:30:59Z,10.000000000000018
952,1,Visual,25_1102-1,1102,831,GRH,2025,6/4/2025,1,08:15:00,57,Mostly cloudy,"F nest material carry, I think into clover field to W of point",2,1,Male,Adult,55,V,V,V,V,V,V,V,X,X,X,X,X,NA,NA,NA,490349.4,4916223,2025-06-04,8H 15M 0S,1102,Visual,Visual,Visual,Visual,Visual,Visual,Visual,NA,NA,NA,NA,NA,155,2025,2025-06-04T12:31:23Z,164
953,1,Visual,25_1102-1,1102,831,GRH,2025,6/4/2025,1,08:15:00,57,Mostly cloudy,"F nest material carry, I think into clover field to W of point",2,2,Female,Adult,53,V,V,V,V,V,V,V,V,X,X,X,X,NA,NA,NA,490349.4,4916223,2025-06-04,8H 15M 0S,1102,Visual,Visual,Visual,Visual,Visual,Visual,Visual,Visual,NA,NA,NA,NA,155,2025,2025-06-04T12:31:23Z,164
954,1,Singing,25_1673-1,1673,832,GRH,2025,6/4/2025,1,07:55:00,57,Mostly cloudy,"Both detections in very different directions, seperating individuals",2,1,Male,Adult,263,S,X,X,X,X,X,X,X,X,X,X,X,NA,NA,NA,489787.21,4916503,2025-06-04,7H 55M 0S,1673,Singing,NA,NA,NA,NA,NA,NA,NA,NA,NA,NA,NA,155,2025,2025-06-04T12:31:23Z,144.00000000000003
955,6,Singing,25_1673-1,1673,832,GRH,2025,6/4/2025,1,07:55:00,57,Mostly cloudy,"Both detections in very different directions, seperating individuals",2,2,Male,Adult,278,X,X,X,X,X,S,X,X,X,X,X,X,NA,NA,NA,489787.21,4916503,2025-06-04,7H 55M 0S,1673,NA,NA,NA,NA,NA,Singing,NA,NA,NA,NA,NA,NA,155,2025,2025-06-04T12:31:23Z,144.00000000000003
956,4,Singing,25_1725-1,1725,837,GRH,2025,6/4/2025,1,06:09:00,55,Mostly cloudy,"Incessant dog, stopped at minute 5. Excellent WV lark habitat",1,1,Male,Adult,356,X,X,X,S,X,S,X,X,X,X,X,X,NA,NA,NA,485853.87,4921965.5,2025-06-04,6H 9M 0S,1725,NA,NA,NA,Singing,NA,Singing,NA,NA,NA,NA,NA,NA,155,2025,2025-06-04T12:31:23Z,38.00000000000003
957,1,Singing,25_3719-1,3719,840,CWW,2025,6/12/2025,1,05:50:00,45,Clear,pulloff on loud highway,2,1,Male,Adult,70,S,S,S,S,X,X,X,X,X,S,S,S,NA,NA,NA,479172.68,4977249,2025-06-12,5H 50M 0S,3719,Singing,Singing,Singing,Singing,NA,NA,NA,NA,NA,Singing,Singing,Singing,163,2025,2025-06-12T12:29:15Z,20.99999999999998
958,4,Singing,25_3719-1,3719,840,CWW,2025,6/12/2025,1,05:50:00,45,Clear,pulloff on loud highway,2,2,Male,Adult,110,X,X,X,S,S,S,X,X,X,X,X,X,NA,NA,NA,479172.68,4977249,2025-06-12,5H 50M 0S,3719,NA,NA,NA,Singing,Singing,Singing,NA,NA,NA,NA,NA,NA,163,2025,2025-06-12T12:29:15Z,20.99999999999998
959,1,Calling,25_2181-1,2181,842,CWW,2025,6/12/2025,1,07:07:00,50,Clear,kestrel hunting very close to foraging larks,3,1,Male,Adult,65,C,X,V,V,V,V,V,V,V,X,X,X,NA,NA,NA,479804.71,4981153,2025-06-12,7H 7M 0S,2181,Calling,NA,Visual,Visual,Visual,Visual,Visual,Visual,Visual,NA,NA,NA,163,2025,2025-06-12T12:29:15Z,97.99999999999997
960,3,Visual,25_2181-1,2181,842,CWW,2025,6/12/2025,1,07:07:00,50,Clear,kestrel hunting very close to foraging larks,3,2,Male,Adult,74,X,X,V,V,V,V,X,V,X,X,X,X,NA,NA,NA,479804.71,4981153,2025-06-12,7H 7M 0S,2181,NA,NA,Visual,Visual,Visual,Visual,NA,Visual,NA,NA,NA,NA,163,2025,2025-06-12T12:29:15Z,97.99999999999997
961,6,Visual,25_2181-1,2181,842,CWW,2025,6/12/2025,1,07:07:00,50,Clear,kestrel hunting very close to foraging larks,3,3,Female,Adult,72,X,X,X,X,X,V,X,X,X,X,X,X,NA,NA,NA,479804.71,4981153,2025-06-12,7H 7M 0S,2181,NA,NA,NA,NA,NA,Visual,NA,NA,NA,NA,NA,NA,163,2025,2025-06-12T12:29:15Z,97.99999999999997
962,12,Singing,25_5503-1,5503,845,CWW,2025,6/12/2025,1,08:02:00,50,Clear,"SHLA was heard singing in min 1 and 2 of pre-survey period, then not again until min 12",1,1,Male,Adult,35,X,X,X,X,X,X,X,X,X,X,X,S,NA,NA,NA,485891.43,4978709,2025-06-12,8H 2M 0S,5503,NA,NA,NA,NA,NA,NA,NA,NA,NA,NA,NA,Singing,163,2025,2025-06-12T12:29:15Z,153
963,1,Singing,25_5385-1,5385,785,CWW,2025,6/10/2025,1,08:43:00,64,Clear,"Honeybee hives one side, weedy clover other side",1,1,Male,Adult,60,S,S,C,V,X,X,X,X,X,X,X,C,NA,NA,NA,498536.28,4931503,2025-06-10,8H 43M 0S,5385,Singing,Singing,Calling,Visual,NA,NA,NA,NA,NA,NA,NA,Calling,161,2025,2025-06-10T12:29:34Z,194
NA,NA,NA,25_4816-1,4816,707,GRH,2025,5/20/2025,1,09:45:00,55,Mostly cloudy,NA,0,NA,NA,NA,NA,NA,NA,NA,NA,NA,NA,NA,NA,NA,NA,NA,NA,NA,NA,NA,476719.31,4957260.5,2025-05-20,9H 45M 0S,4816,NA,NA,NA,NA,NA,NA,NA,NA,NA,NA,NA,NA,140,2025,2025-05-20T12:41:35Z,244
NA,NA,NA,25_4329-1,4329,708,GRH,2025,5/20/2025,1,09:12:00,52,Partly cloudy,NA,0,NA,NA,NA,NA,NA,NA,NA,NA,NA,NA,NA,NA,NA,NA,NA,NA,NA,NA,NA,470894.9,4964766,2025-05-20,9H 12M 0S,4329,NA,NA,NA,NA,NA,NA,NA,NA,NA,NA,NA,NA,140,2025,2025-05-20T12:41:35Z,210.99999999999994
NA,NA,NA,25_4330-1,4330,709,GRH,2025,5/20/2025,1,08:53:00,51,Partly cloudy,"ravens, killdeer, and vultures sorta vibing together",0,NA,NA,NA,NA,NA,NA,NA,NA,NA,NA,NA,NA,NA,NA,NA,NA,NA,NA,NA,470448.28,4964294,2025-05-20,8H 53M 0S,4330,NA,NA,NA,NA,NA,NA,NA,NA,NA,NA,NA,NA,140,2025,2025-05-20T12:41:35Z,191.99999999999994
NA,NA,NA,25_5391-1,5391,711,GRH,2025,5/20/2025,1,07:50:00,51,Mostly cloudy,NA,0,NA,NA,NA,NA,NA,NA,NA,NA,NA,NA,NA,NA,NA,NA,NA,NA,NA,NA,NA,482335.68,4953897,2025-05-20,7H 50M 0S,5391,NA,NA,NA,NA,NA,NA,NA,NA,NA,NA,NA,NA,140,2025,2025-05-20T12:41:35Z,128.99999999999997
NA,NA,NA,25_5111-1,5111,712,GRH,2025,5/20/2025,1,06:42:00,49,Drizzle,NA,0,NA,NA,NA,NA,NA,NA,NA,NA,NA,NA,NA,NA,NA,NA,NA,NA,NA,NA,NA,503789.28,4943507.5,2025-05-20,6H 42M 0S,5111,NA,NA,NA,NA,NA,NA,NA,NA,NA,NA,NA,NA,140,2025,2025-05-20T12:41:35Z,61
NA,NA,NA,25_1896-1,1896,713,GRH,2025,5/20/2025,1,06:12:00,48,Drizzle,NA,0,NA,NA,NA,NA,NA,NA,NA,NA,NA,NA,NA,NA,NA,NA,NA,NA,NA,NA,NA,508042.53,4938612.5,2025-05-20,6H 12M 0S,1896,NA,NA,NA,NA,NA,NA,NA,NA,NA,NA,NA,NA,140,2025,2025-05-20T12:41:35Z,30.999999999999996
NA,NA,NA,25_4942-1,4942,714,GRH,2025,5/20/2025,1,05:53:00,49,Mostly cloudy,RTHA hunting in field,0,NA,NA,NA,NA,NA,NA,NA,NA,NA,NA,NA,NA,NA,NA,NA,NA,NA,NA,NA,508731.56,4937159,2025-05-20,5H 53M 0S,4942,NA,NA,NA,NA,NA,NA,NA,NA,NA,NA,NA,NA,140,2025,2025-05-20T12:41:35Z,11.999999999999957
NA,NA,NA,25_4684-1,4684,715,GRH,2025,5/16/2025,1,06:07:00,44,Fog or smoke,NA,0,NA,NA,NA,NA,NA,NA,NA,NA,NA,NA,NA,NA,NA,NA,NA,NA,NA,NA,NA,477767.34,4918245.5,2025-05-16,6H 7M 0S,4684,NA,NA,NA,NA,NA,NA,NA,NA,NA,NA,NA,NA,136,2025,2025-05-16T12:45:32Z,21.999999999999975
NA,NA,NA,25_3708-1,3708,716,GRH,2025,5/16/2025,1,06:33:00,45,Fog or smoke,NA,0,NA,NA,NA,NA,NA,NA,NA,NA,NA,NA,NA,NA,NA,NA,NA,NA,NA,NA,NA,477640.59,4917255.5,2025-05-16,6H 33M 0S,3708,NA,NA,NA,NA,NA,NA,NA,NA,NA,NA,NA,NA,136,2025,2025-05-16T12:45:32Z,47.999999999999986
NA,NA,NA,25_3709-1,3709,717,GRH,2025,5/16/2025,1,06:56:00,46,Mostly cloudy,NA,0,NA,NA,NA,NA,NA,NA,NA,NA,NA,NA,NA,NA,NA,NA,NA,NA,NA,NA,NA,477527.68,4916615.5,2025-05-16,6H 56M 0S,3709,NA,NA,NA,NA,NA,NA,NA,NA,NA,NA,NA,NA,136,2025,2025-05-16T12:45:32Z,71.00000000000001
NA,NA,NA,25_4316-1,4316,718,GRH,2025,5/16/2025,1,07:16:00,48,Mostly cloudy,NA,0,NA,NA,NA,NA,NA,NA,NA,NA,NA,NA,NA,NA,NA,NA,NA,NA,NA,NA,NA,479063.71,4915276,2025-05-16,7H 16M 0S,4316,NA,NA,NA,NA,NA,NA,NA,NA,NA,NA,NA,NA,136,2025,2025-05-16T12:45:32Z,91
NA,NA,NA,25_3863-1,3863,719,GRH,2025,5/16/2025,1,07:35:00,50,Partly cloudy,NA,0,NA,NA,NA,NA,NA,NA,NA,NA,NA,NA,NA,NA,NA,NA,NA,NA,NA,NA,NA,480085.21,4913802.5,2025-05-16,7H 35M 0S,3863,NA,NA,NA,NA,NA,NA,NA,NA,NA,NA,NA,NA,136,2025,2025-05-16T12:45:32Z,109.99999999999999
NA,NA,NA,25_5091-1,5091,720,GRH,2025,5/16/2025,1,07:55:00,51,Mostly cloudy,NA,0,NA,NA,NA,NA,NA,NA,NA,NA,NA,NA,NA,NA,NA,NA,NA,NA,NA,NA,NA,480542.93,4912756,2025-05-16,7H 55M 0S,5091,NA,NA,NA,NA,NA,NA,NA,NA,NA,NA,NA,NA,136,2025,2025-05-16T12:45:32Z,130.00000000000003
NA,NA,NA,25_1417-1,1417,721,GRH,2025,5/16/2025,1,08:35:00,53,Partly cloudy,NA,0,NA,NA,NA,NA,NA,NA,NA,NA,NA,NA,NA,NA,NA,NA,NA,NA,NA,NA,NA,473271.4,4912312.5,2025-05-16,8H 35M 0S,1417,NA,NA,NA,NA,NA,NA,NA,NA,NA,NA,NA,NA,136,2025,2025-05-16T12:45:32Z,170.00000000000003
NA,NA,NA,25_3515-1,3515,722,GRH,2025,5/16/2025,1,08:55:00,53,Partly cloudy,NA,0,NA,NA,NA,NA,NA,NA,NA,NA,NA,NA,NA,NA,NA,NA,NA,NA,NA,NA,NA,473481.53,4910073.5,2025-05-16,8H 55M 0S,3515,NA,NA,NA,NA,NA,NA,NA,NA,NA,NA,NA,NA,136,2025,2025-05-16T12:45:32Z,189.99999999999997
NA,NA,NA,25_4070-1,4070,723,GRH,2025,5/16/2025,1,09:19:00,54,Partly cloudy,NA,0,NA,NA,NA,NA,NA,NA,NA,NA,NA,NA,NA,NA,NA,NA,NA,NA,NA,NA,NA,474917.37,4905673,2025-05-16,9H 19M 0S,4070,NA,NA,NA,NA,NA,NA,NA,NA,NA,NA,NA,NA,136,2025,2025-05-16T12:45:32Z,214
NA,NA,NA,25_621-1,621,724,GRH,2025,5/16/2025,1,09:47:00,55,Partly cloudy,NA,0,NA,NA,NA,NA,NA,NA,NA,NA,NA,NA,NA,NA,NA,NA,NA,NA,NA,NA,NA,479546.62,4899850.5,2025-05-16,9H 47M 0S,621,NA,NA,NA,NA,NA,NA,NA,NA,NA,NA,NA,NA,136,2025,2025-05-16T12:45:32Z,242
NA,NA,NA,25_4199-1,4199,725,GRH,2025,5/15/2025,1,09:54:00,54,Partly cloudy,NA,0,NA,NA,NA,NA,NA,NA,NA,NA,NA,NA,NA,NA,NA,NA,NA,NA,NA,NA,NA,486400.18,4968303,2025-05-15,9H 54M 0S,4199,NA,NA,NA,NA,NA,NA,NA,NA,NA,NA,NA,NA,135,2025,2025-05-15T12:46:36Z,248.00000000000003
NA,NA,NA,25_4200-1,4200,726,GRH,2025,5/15/2025,1,09:37:00,54,Partly cloudy,NA,0,NA,NA,NA,NA,NA,NA,NA,NA,NA,NA,NA,NA,NA,NA,NA,NA,NA,NA,NA,485750.28,4968313.5,2025-05-15,9H 37M 0S,4200,NA,NA,NA,NA,NA,NA,NA,NA,NA,NA,NA,NA,135,2025,2025-05-15T12:46:36Z,231.00000000000003
NA,NA,NA,25_4320-1,4320,727,GRH,2025,5/15/2025,1,09:18:00,52,Mostly cloudy,NA,0,NA,NA,NA,NA,NA,NA,NA,NA,NA,NA,NA,NA,NA,NA,NA,NA,NA,NA,NA,487249.96,4970420.5,2025-05-15,9H 18M 0S,4320,NA,NA,NA,NA,NA,NA,NA,NA,NA,NA,NA,NA,135,2025,2025-05-15T12:46:36Z,212.00000000000006
NA,NA,NA,25_3468-1,3468,728,GRH,2025,5/15/2025,1,08:12:00,50,Mostly cloudy,"S male heard behind, already counted previously",0,NA,NA,NA,NA,NA,NA,NA,NA,NA,NA,NA,NA,NA,NA,NA,NA,NA,NA,NA,481954.03,4971731.5,2025-05-15,8H 12M 0S,3468,NA,NA,NA,NA,NA,NA,NA,NA,NA,NA,NA,NA,135,2025,2025-05-15T12:46:36Z,145.99999999999997
NA,NA,NA,25_3573-1,3573,730,GRH,2025,5/15/2025,1,07:29:00,48,Mostly cloudy,NA,0,NA,NA,NA,NA,NA,NA,NA,NA,NA,NA,NA,NA,NA,NA,NA,NA,NA,NA,NA,481963.25,4973376,2025-05-15,7H 29M 0S,3573,NA,NA,NA,NA,NA,NA,NA,NA,NA,NA,NA,NA,135,2025,2025-05-15T12:46:36Z,103
NA,NA,NA,25_2795-1,2795,732,GRH,2025,5/15/2025,1,06:40:00,47,Mostly cloudy,NA,0,NA,NA,NA,NA,NA,NA,NA,NA,NA,NA,NA,NA,NA,NA,NA,NA,NA,NA,NA,480789.15,4971601,2025-05-15,6H 40M 0S,2795,NA,NA,NA,NA,NA,NA,NA,NA,NA,NA,NA,NA,135,2025,2025-05-15T12:46:36Z,54.00000000000002
NA,NA,NA,25_5321-1,5321,733,GRH,2025,5/15/2025,1,06:18:00,47,Mostly cloudy,NA,0,NA,NA,NA,NA,NA,NA,NA,NA,NA,NA,NA,NA,NA,NA,NA,NA,NA,NA,NA,478642.46,4971547.5,2025-05-15,6H 18M 0S,5321,NA,NA,NA,NA,NA,NA,NA,NA,NA,NA,NA,NA,135,2025,2025-05-15T12:46:36Z,31.999999999999993
NA,NA,NA,25_2950-1,2950,735,GRH,2025,5/14/2025,1,09:29:00,52,Partly cloudy,Peas! Or other beans I don't know,0,NA,NA,NA,NA,NA,NA,NA,NA,NA,NA,NA,NA,NA,NA,NA,NA,NA,NA,NA,489827.37,4957683.5,2025-05-14,9H 29M 0S,2950,NA,NA,NA,NA,NA,NA,NA,NA,NA,NA,NA,NA,134,2025,2025-05-14T12:47:42Z,221.99999999999994
NA,NA,NA,25_1963-1,1963,736,GRH,2025,5/14/2025,1,09:45:00,54,Partly cloudy,NA,0,NA,NA,NA,NA,NA,NA,NA,NA,NA,NA,NA,NA,NA,NA,NA,NA,NA,NA,NA,490277.31,4956527,2025-05-14,9H 45M 0S,1963,NA,NA,NA,NA,NA,NA,NA,NA,NA,NA,NA,NA,134,2025,2025-05-14T12:47:42Z,238
NA,NA,NA,25_4887-1,4887,737,GRH,2025,5/14/2025,1,09:05:00,52,Mostly cloudy,NA,0,NA,NA,NA,NA,NA,NA,NA,NA,NA,NA,NA,NA,NA,NA,NA,NA,NA,NA,NA,492415.9,4958257,2025-05-14,9H 5M 0S,4887,NA,NA,NA,NA,NA,NA,NA,NA,NA,NA,NA,NA,134,2025,2025-05-14T12:47:42Z,198.00000000000006
NA,NA,NA,25_3548-1,3548,738,GRH,2025,5/14/2025,1,08:27:00,50,Drizzle,NA,0,NA,NA,NA,NA,NA,NA,NA,NA,NA,NA,NA,NA,NA,NA,NA,NA,NA,NA,NA,499675.06,4957010,2025-05-14,8H 27M 0S,3548,NA,NA,NA,NA,NA,NA,NA,NA,NA,NA,NA,NA,134,2025,2025-05-14T12:47:42Z,159.99999999999997
NA,NA,NA,25_2227-1,222,739,GRH,2025,5/14/2025,1,07:37:00,51,Drizzle,NA,0,NA,NA,NA,NA,NA,NA,NA,NA,NA,NA,NA,NA,NA,NA,NA,NA,NA,NA,NA,488508,5017071.5,2025-05-14,7H 37M 0S,222,NA,NA,NA,NA,NA,NA,NA,NA,NA,NA,NA,NA,134,2025,2025-05-14T12:47:42Z,110.00000000000003
NA,NA,NA,25_4030-1,4030,740,GRH,2025,5/14/2025,1,08:06:00,49,Drizzle,NA,0,NA,NA,NA,NA,NA,NA,NA,NA,NA,NA,NA,NA,NA,NA,NA,NA,NA,NA,NA,501230.78,4954164.5,2025-05-14,8H 6M 0S,4030,NA,NA,NA,NA,NA,NA,NA,NA,NA,NA,NA,NA,134,2025,2025-05-14T12:47:42Z,139
NA,NA,NA,25_5380-1,5380,757,GRH,2025,5/21/2025,1,09:03:00,53,Clear,NA,0,NA,NA,NA,NA,NA,NA,NA,NA,NA,NA,NA,NA,NA,NA,NA,NA,NA,NA,NA,481323.21,4990304,2025-05-21,9H 3M 0S,5380,NA,NA,NA,NA,NA,NA,NA,NA,NA,NA,NA,NA,141,2025,2025-05-21T12:40:40Z,203.00000000000003
NA,NA,NA,25_3367-1,3367,763,GRH,2025,5/21/2025,1,06:40:00,44,Partly cloudy,NA,0,NA,NA,NA,NA,NA,NA,NA,NA,NA,NA,NA,NA,NA,NA,NA,NA,NA,NA,NA,468050.65,4987719,2025-05-21,6H 40M 0S,3367,NA,NA,NA,NA,NA,NA,NA,NA,NA,NA,NA,NA,141,2025,2025-05-21T12:40:40Z,60
NA,NA,NA,25_3278-1,3278,766,CWW,2025,5/21/2025,1,09:10:00,49,Partly cloudy,NA,0,NA,NA,NA,NA,NA,NA,NA,NA,NA,NA,NA,NA,NA,NA,NA,NA,NA,NA,NA,494201.81,4886266,2025-05-21,9H 10M 0S,3278,NA,NA,NA,NA,NA,NA,NA,NA,NA,NA,NA,NA,141,2025,2025-05-21T12:40:40Z,209.99999999999994
NA,NA,NA,25_5195-1,5195,767,CWW,2025,5/21/2025,1,09:40:00,51,Partly cloudy,NA,0,NA,NA,NA,NA,NA,NA,NA,NA,NA,NA,NA,NA,NA,NA,NA,NA,NA,NA,NA,492974.46,4886178.5,2025-05-21,9H 40M 0S,5195,NA,NA,NA,NA,NA,NA,NA,NA,NA,NA,NA,NA,141,2025,2025-05-21T12:40:40Z,239.99999999999994
NA,NA,NA,25_711-1,711,768,CWW,2025,5/22/2025,1,05:48:00,49,Mostly cloudy,NA,0,NA,NA,NA,NA,NA,NA,NA,NA,NA,NA,NA,NA,NA,NA,NA,NA,NA,NA,NA,483583.25,4930184,2025-05-22,5H 48M 0S,711,NA,NA,NA,NA,NA,NA,NA,NA,NA,NA,NA,NA,142,2025,2025-05-22T12:39:47Z,8.999999999999968
NA,NA,NA,25_5808-1,5808,769,CWW,2025,5/22/2025,1,06:17:00,49,Mostly cloudy,"male + female pair NOHA very active, calling, harassing RTHA",0,NA,NA,NA,NA,NA,NA,NA,NA,NA,NA,NA,NA,NA,NA,NA,NA,NA,NA,NA,486647.62,4928790,2025-05-22,6H 17M 0S,5808,NA,NA,NA,NA,NA,NA,NA,NA,NA,NA,NA,NA,142,2025,2025-05-22T12:39:47Z,37.99999999999997
NA,NA,NA,25_2490-1,2490,772,CWW,2025,5/22/2025,1,08:22:00,47,Drizzle,NA,0,NA,NA,NA,NA,NA,NA,NA,NA,NA,NA,NA,NA,NA,NA,NA,NA,NA,NA,NA,492517.12,4929887.5,2025-05-22,8H 22M 0S,2490,NA,NA,NA,NA,NA,NA,NA,NA,NA,NA,NA,NA,142,2025,2025-05-22T12:39:47Z,163
NA,NA,NA,25_2036-1,2036,773,CWW,2025,5/22/2025,1,08:39:00,47,Drizzle,NA,0,NA,NA,NA,NA,NA,NA,NA,NA,NA,NA,NA,NA,NA,NA,NA,NA,NA,NA,NA,493530.71,4929567.5,2025-05-22,8H 39M 0S,2036,NA,NA,NA,NA,NA,NA,NA,NA,NA,NA,NA,NA,142,2025,2025-05-22T12:39:47Z,180
NA,NA,NA,25_5328-1,5328,774,CWW,2025,5/22/2025,1,07:45:00,47,Drizzle,NA,0,NA,NA,NA,NA,NA,NA,NA,NA,NA,NA,NA,NA,NA,NA,NA,NA,NA,NA,NA,490548.06,4931099.5,2025-05-22,7H 45M 0S,5328,NA,NA,NA,NA,NA,NA,NA,NA,NA,NA,NA,NA,142,2025,2025-05-22T12:39:47Z,125.99999999999997
NA,NA,NA,25_1050-1,1050,775,CWW,2025,5/22/2025,1,08:02:00,47,Drizzle,NA,0,NA,NA,NA,NA,NA,NA,NA,NA,NA,NA,NA,NA,NA,NA,NA,NA,NA,NA,NA,490879.56,4931490,2025-05-22,8H 2M 0S,1050,NA,NA,NA,NA,NA,NA,NA,NA,NA,NA,NA,NA,142,2025,2025-05-22T12:39:47Z,142.99999999999997
NA,NA,NA,25_5691-1,5691,776,CWW,2025,5/22/2025,1,07:17:00,47,Mostly cloudy,AMKE hunting area,0,NA,NA,NA,NA,NA,NA,NA,NA,NA,NA,NA,NA,NA,NA,NA,NA,NA,NA,NA,488676.75,4928599,2025-05-22,7H 17M 0S,5691,NA,NA,NA,NA,NA,NA,NA,NA,NA,NA,NA,NA,142,2025,2025-05-22T12:39:47Z,97.99999999999997
NA,NA,NA,25_5692-1,5692,777,CWW,2025,5/22/2025,1,07:00:00,47,Mostly cloudy,NA,0,NA,NA,NA,NA,NA,NA,NA,NA,NA,NA,NA,NA,NA,NA,NA,NA,NA,NA,NA,488679.12,4929249,2025-05-22,7H 0M 0S,5692,NA,NA,NA,NA,NA,NA,NA,NA,NA,NA,NA,NA,142,2025,2025-05-22T12:39:47Z,80.99999999999997
NA,NA,NA,25_5315-1,5315,778,CWW,2025,5/22/2025,1,06:41:00,49,Mostly cloudy,NA,0,NA,NA,NA,NA,NA,NA,NA,NA,NA,NA,NA,NA,NA,NA,NA,NA,NA,NA,NA,487070.59,4930393.5,2025-05-22,6H 41M 0S,5315,NA,NA,NA,NA,NA,NA,NA,NA,NA,NA,NA,NA,142,2025,2025-05-22T12:39:47Z,61.99999999999999
NA,NA,NA,25_1967-1,1967,779,CWW,2025,6/10/2025,1,05:49:00,54,Clear,NA,0,NA,NA,NA,NA,NA,NA,NA,NA,NA,NA,NA,NA,NA,NA,NA,NA,NA,NA,NA,481465.78,4935236.5,2025-06-10,5H 49M 0S,1967,NA,NA,NA,NA,NA,NA,NA,NA,NA,NA,NA,NA,161,2025,2025-06-10T12:29:34Z,19.999999999999982
NA,NA,NA,25_2601-1,2601,780,CWW,2025,6/10/2025,1,06:21:00,54,Clear,NOHA hunting fields,0,NA,NA,NA,NA,NA,NA,NA,NA,NA,NA,NA,NA,NA,NA,NA,NA,NA,NA,NA,486506.9,4932409,2025-06-10,6H 21M 0S,2601,NA,NA,NA,NA,NA,NA,NA,NA,NA,NA,NA,NA,161,2025,2025-06-10T12:29:34Z,51.99999999999997
NA,NA,NA,25_2600-1,2600,781,CWW,2025,6/10/2025,1,06:42:00,54,Clear,No larks,0,NA,NA,NA,NA,NA,NA,NA,NA,NA,NA,NA,NA,NA,NA,NA,NA,NA,NA,NA,486435.62,4931772,2025-06-10,6H 42M 0S,2600,NA,NA,NA,NA,NA,NA,NA,NA,NA,NA,NA,NA,161,2025,2025-06-10T12:29:34Z,73
NA,NA,NA,25_801-1,801,782,CWW,2025,6/10/2025,1,07:12:00,55,Clear,BAEA perched prominently outside transect,0,NA,NA,NA,NA,NA,NA,NA,NA,NA,NA,NA,NA,NA,NA,NA,NA,NA,NA,NA,492404.84,4927905,2025-06-10,7H 12M 0S,801,NA,NA,NA,NA,NA,NA,NA,NA,NA,NA,NA,NA,161,2025,2025-06-10T12:29:34Z,103
NA,NA,NA,25_2489-1,2489,783,CWW,2025,6/10/2025,1,07:39:00,56,Clear,No larks,0,NA,NA,NA,NA,NA,NA,NA,NA,NA,NA,NA,NA,NA,NA,NA,NA,NA,NA,NA,492522.25,4930537.5,2025-06-10,7H 39M 0S,2489,NA,NA,NA,NA,NA,NA,NA,NA,NA,NA,NA,NA,161,2025,2025-06-10T12:29:34Z,130.00000000000003
NA,NA,NA,25_1666-1,1666,786,CWW,2025,6/10/2025,1,09:18:00,68,Clear,No larks,0,NA,NA,NA,NA,NA,NA,NA,NA,NA,NA,NA,NA,NA,NA,NA,NA,NA,NA,NA,504257.68,4931451,2025-06-10,9H 18M 0S,1666,NA,NA,NA,NA,NA,NA,NA,NA,NA,NA,NA,NA,161,2025,2025-06-10T12:29:34Z,229.00000000000003
NA,NA,NA,25_3923-1,3923,787,CWW,2025,6/11/2025,1,05:37:00,49,Clear,11 elk - all bulls in velvet. Young hazelnut,0,NA,NA,NA,NA,NA,NA,NA,NA,NA,NA,NA,NA,NA,NA,NA,NA,NA,NA,NA,473055.68,4925130.5,2025-06-11,5H 37M 0S,3923,NA,NA,NA,NA,NA,NA,NA,NA,NA,NA,NA,NA,162,2025,2025-06-11T12:29:23Z,8.000000000000025
NA,NA,NA,25_2710-1,2710,788,CWW,2025,6/11/2025,1,06:01:00,49,Clear,Mature hazels,0,NA,NA,NA,NA,NA,NA,NA,NA,NA,NA,NA,NA,NA,NA,NA,NA,NA,NA,NA,471099.65,4925077,2025-06-11,6H 1M 0S,2710,NA,NA,NA,NA,NA,NA,NA,NA,NA,NA,NA,NA,162,2025,2025-06-11T12:29:23Z,31.999999999999993
NA,NA,NA,25_4704-1,4704,789,CWW,2025,6/11/2025,1,06:34:00,49,Clear,Xmas tree farm,0,NA,NA,NA,NA,NA,NA,NA,NA,NA,NA,NA,NA,NA,NA,NA,NA,NA,NA,NA,473560.28,4920463.5,2025-06-11,6H 34M 0S,4704,NA,NA,NA,NA,NA,NA,NA,NA,NA,NA,NA,NA,162,2025,2025-06-11T12:29:23Z,64.99999999999999
NA,NA,NA,25_3254-1,3254,790,CWW,2025,6/11/2025,1,07:03:00,50,Clear,"RTHA pair very active, hunting",0,NA,NA,NA,NA,NA,NA,NA,NA,NA,NA,NA,NA,NA,NA,NA,NA,NA,NA,NA,477220.21,4919544,2025-06-11,7H 3M 0S,3254,NA,NA,NA,NA,NA,NA,NA,NA,NA,NA,NA,NA,162,2025,2025-06-11T12:29:23Z,93.99999999999999
NA,NA,NA,25_4607-1,4607,791,CWW,2025,6/11/2025,1,08:06:00,50,Mostly cloudy,NA,0,NA,NA,NA,NA,NA,NA,NA,NA,NA,NA,NA,NA,NA,NA,NA,NA,NA,NA,NA,471145.53,4907859.5,2025-06-11,8H 6M 0S,4607,NA,NA,NA,NA,NA,NA,NA,NA,NA,NA,NA,NA,162,2025,2025-06-11T12:29:23Z,156.99999999999997
NA,NA,NA,25_1414-1,1414,792,CWW,2025,6/11/2025,1,07:34:00,50,Clear,NA,0,NA,NA,NA,NA,NA,NA,NA,NA,NA,NA,NA,NA,NA,NA,NA,NA,NA,NA,NA,474528.9,4913383,2025-06-11,7H 34M 0S,1414,NA,NA,NA,NA,NA,NA,NA,NA,NA,NA,NA,NA,162,2025,2025-06-11T12:29:23Z,124.99999999999999
NA,NA,NA,25_4450-1,4450,793,CWW,2025,6/11/2025,1,09:00:00,55,Mostly cloudy,lots of traffic,0,NA,NA,NA,NA,NA,NA,NA,NA,NA,NA,NA,NA,NA,NA,NA,NA,NA,NA,NA,478267.21,4905387.5,2025-06-11,9H 0M 0S,4450,NA,NA,NA,NA,NA,NA,NA,NA,NA,NA,NA,NA,162,2025,2025-06-11T12:29:23Z,211
NA,NA,NA,25_4071-1,4071,794,CWW,2025,6/11/2025,1,08:34:00,55,Mostly cloudy,NA,0,NA,NA,NA,NA,NA,NA,NA,NA,NA,NA,NA,NA,NA,NA,NA,NA,NA,NA,NA,474603.21,4905176.5,2025-06-11,8H 34M 0S,4071,NA,NA,NA,NA,NA,NA,NA,NA,NA,NA,NA,NA,162,2025,2025-06-11T12:29:23Z,184.99999999999997
NA,NA,NA,25_3987-1,3987,795,CWW,2025,6/11/2025,1,09:23:00,55,Mostly cloudy,Medium size hazelnuts. Loud mowing.,0,NA,NA,NA,NA,NA,NA,NA,NA,NA,NA,NA,NA,NA,NA,NA,NA,NA,NA,NA,480321.21,4905761.5,2025-06-11,9H 23M 0S,3987,NA,NA,NA,NA,NA,NA,NA,NA,NA,NA,NA,NA,162,2025,2025-06-11T12:29:23Z,233.99999999999997
NA,NA,NA,25_1778-1,1778,796,GRH,2025,5/22/2025,1,07:55:00,53,Drizzle,NA,0,NA,NA,NA,NA,NA,NA,NA,NA,NA,NA,NA,NA,NA,NA,NA,NA,NA,NA,NA,504191.43,4995579.5,2025-05-22,7H 55M 0S,1778,NA,NA,NA,NA,NA,NA,NA,NA,NA,NA,NA,NA,142,2025,2025-05-22T12:39:47Z,136
NA,NA,NA,25_4224-1,4224,797,GRH,2025,5/22/2025,1,08:20:00,53,Drizzle,Field being actively watered by pivot,0,NA,NA,NA,NA,NA,NA,NA,NA,NA,NA,NA,NA,NA,NA,NA,NA,NA,NA,NA,499761.93,4961842,2025-05-22,8H 20M 0S,4224,NA,NA,NA,NA,NA,NA,NA,NA,NA,NA,NA,NA,142,2025,2025-05-22T12:39:47Z,161
NA,NA,NA,25_1240-1,1240,798,GRH,2025,5/22/2025,1,08:41:00,54,Mostly cloudy,"Really frustrating noise, thought I heard something but never quiet for long enough to confrm",0,NA,NA,NA,NA,NA,NA,NA,NA,NA,NA,NA,NA,NA,NA,NA,NA,NA,NA,NA,505220.71,5009886,2025-05-22,8H 41M 0S,1240,NA,NA,NA,NA,NA,NA,NA,NA,NA,NA,NA,NA,142,2025,2025-05-22T12:39:47Z,182
NA,NA,NA,25_1461-1,1461,799,GRH,2025,5/22/2025,1,09:00:00,54,Mostly cloudy,NA,0,NA,NA,NA,NA,NA,NA,NA,NA,NA,NA,NA,NA,NA,NA,NA,NA,NA,NA,NA,504110.06,5012159.5,2025-05-22,9H 0M 0S,1461,NA,NA,NA,NA,NA,NA,NA,NA,NA,NA,NA,NA,142,2025,2025-05-22T12:39:47Z,200.99999999999997
NA,NA,NA,25_5364-1,5364,800,GRH,2025,5/21/2025,1,10:01:00,56,Clear,NA,0,NA,NA,NA,NA,NA,NA,NA,NA,NA,NA,NA,NA,NA,NA,NA,NA,NA,NA,NA,483622.71,4985007.5,2025-05-21,10H 1M 0S,5364,NA,NA,NA,NA,NA,NA,NA,NA,NA,NA,NA,NA,141,2025,2025-05-21T12:40:40Z,261.00000000000006
NA,NA,NA,25_978-1,978,801,GRH,2025,5/22/2025,1,05:58:00,50,Drizzle,Dog noticed me at min 4,0,NA,NA,NA,NA,NA,NA,NA,NA,NA,NA,NA,NA,NA,NA,NA,NA,NA,NA,NA,521855.87,4987202,2025-05-22,5H 58M 0S,978,NA,NA,NA,NA,NA,NA,NA,NA,NA,NA,NA,NA,142,2025,2025-05-22T12:39:47Z,18.999999999999986
NA,NA,NA,25_4258-1,4258,802,GRH,2025,5/22/2025,1,06:39:00,51,Drizzle,NA,0,NA,NA,NA,NA,NA,NA,NA,NA,NA,NA,NA,NA,NA,NA,NA,NA,NA,NA,NA,503484.5,4986924.5,2025-05-22,6H 39M 0S,4258,NA,NA,NA,NA,NA,NA,NA,NA,NA,NA,NA,NA,142,2025,2025-05-22T12:39:47Z,60
NA,NA,NA,25_4497-1,4497,803,GRH,2025,5/22/2025,1,07:06:00,51,Mostly cloudy,NA,0,NA,NA,NA,NA,NA,NA,NA,NA,NA,NA,NA,NA,NA,NA,NA,NA,NA,NA,NA,495995.06,4986737.5,2025-05-22,7H 6M 0S,4497,NA,NA,NA,NA,NA,NA,NA,NA,NA,NA,NA,NA,142,2025,2025-05-22T12:39:47Z,86.99999999999996
NA,NA,NA,25_342-1,342,804,GRH,2025,5/22/2025,1,09:34:00,54,Mostly cloudy,"Pile burns taking place nearby, not too smokey",0,NA,NA,NA,NA,NA,NA,NA,NA,NA,NA,NA,NA,NA,NA,NA,NA,NA,NA,NA,494029.56,5003083,2025-05-22,9H 34M 0S,342,NA,NA,NA,NA,NA,NA,NA,NA,NA,NA,NA,NA,142,2025,2025-05-22T12:39:47Z,234.99999999999997
NA,NA,NA,25_482-1,482,805,GRH,2025,5/22/2025,1,10:03:00,55,Mostly cloudy,NA,0,NA,NA,NA,NA,NA,NA,NA,NA,NA,NA,NA,NA,NA,NA,NA,NA,NA,NA,NA,496524.56,5000404.5,2025-05-22,10H 3M 0S,482,NA,NA,NA,NA,NA,NA,NA,NA,NA,NA,NA,NA,142,2025,2025-05-22T12:39:47Z,264
NA,NA,NA,25_3171-1,3171,806,GRH,2025,6/6/2025,1,09:59:00,71,Clear,NA,0,NA,NA,NA,NA,NA,NA,NA,NA,NA,NA,NA,NA,NA,NA,NA,NA,NA,NA,NA,501686.71,5046632,2025-06-06,9H 59M 0S,3171,NA,NA,NA,NA,NA,NA,NA,NA,NA,NA,NA,NA,157,2025,2025-06-06T12:30:38Z,268.99999999999994
NA,NA,NA,25_1358-1,1358,807,GRH,2025,6/6/2025,1,09:09:00,67,Partly cloudy,NOHA perched ~300m away,0,NA,NA,NA,NA,NA,NA,NA,NA,NA,NA,NA,NA,NA,NA,NA,NA,NA,NA,NA,518495.75,5011216.5,2025-06-06,9H 9M 0S,1358,NA,NA,NA,NA,NA,NA,NA,NA,NA,NA,NA,NA,157,2025,2025-06-06T12:30:38Z,219.00000000000003
NA,NA,NA,25_5588-1,5588,808,GRH,2025,6/6/2025,1,07:56:00,60,Clear,NA,0,NA,NA,NA,NA,NA,NA,NA,NA,NA,NA,NA,NA,NA,NA,NA,NA,NA,NA,NA,495959.25,4935854,2025-06-06,7H 56M 0S,5588,NA,NA,NA,NA,NA,NA,NA,NA,NA,NA,NA,NA,157,2025,2025-06-06T12:30:38Z,146
NA,NA,NA,25_4963-1,4963,809,GRH,2025,6/6/2025,1,07:37:00,59,Clear,Loud again!,0,NA,NA,NA,NA,NA,NA,NA,NA,NA,NA,NA,NA,NA,NA,NA,NA,NA,NA,NA,497402.96,4933567.5,2025-06-06,7H 37M 0S,4963,NA,NA,NA,NA,NA,NA,NA,NA,NA,NA,NA,NA,157,2025,2025-06-06T12:30:38Z,127.00000000000003
NA,NA,NA,25_4965-1,4965,810,GRH,2025,6/6/2025,1,07:19:00,58,Clear,Loud!,0,NA,NA,NA,NA,NA,NA,NA,NA,NA,NA,NA,NA,NA,NA,NA,NA,NA,NA,NA,498702.59,4933580,2025-06-06,7H 19M 0S,4965,NA,NA,NA,NA,NA,NA,NA,NA,NA,NA,NA,NA,157,2025,2025-06-06T12:30:38Z,108.99999999999999
NA,NA,NA,25_4346-1,4346,813,GRH,2025,6/6/2025,1,06:09:00,55,Partly cloudy,NA,0,NA,NA,NA,NA,NA,NA,NA,NA,NA,NA,NA,NA,NA,NA,NA,NA,NA,NA,NA,491222.53,4925250.5,2025-06-06,6H 9M 0S,4346,NA,NA,NA,NA,NA,NA,NA,NA,NA,NA,NA,NA,157,2025,2025-06-06T12:30:38Z,39.00000000000002
NA,NA,NA,25_1117-1,1117,816,GRH,2025,6/5/2025,1,09:51:00,58,Mostly cloudy,Quite a bit of CLSW noise,0,NA,NA,NA,NA,NA,NA,NA,NA,NA,NA,NA,NA,NA,NA,NA,NA,NA,NA,NA,497822.43,4919906.5,2025-06-05,9H 51M 0S,1117,NA,NA,NA,NA,NA,NA,NA,NA,NA,NA,NA,NA,156,2025,2025-06-05T12:30:59Z,261
NA,NA,NA,25_1740-1,1740,817,GRH,2025,6/5/2025,1,09:30:00,57,Mostly cloudy,NA,0,NA,NA,NA,NA,NA,NA,NA,NA,NA,NA,NA,NA,NA,NA,NA,NA,NA,NA,NA,500653.12,4916221,2025-06-05,9H 30M 0S,1740,NA,NA,NA,NA,NA,NA,NA,NA,NA,NA,NA,NA,156,2025,2025-06-05T12:30:59Z,240
NA,NA,NA,25_948-1,948,818,GRH,2025,6/5/2025,1,09:09:00,57,Mostly cloudy,NA,0,NA,NA,NA,NA,NA,NA,NA,NA,NA,NA,NA,NA,NA,NA,NA,NA,NA,NA,NA,503178.93,4915070,2025-06-05,9H 9M 0S,948,NA,NA,NA,NA,NA,NA,NA,NA,NA,NA,NA,NA,156,2025,2025-06-05T12:30:59Z,219.00000000000003
NA,NA,NA,25_5276-1,5276,819,GRH,2025,6/5/2025,1,08:42:00,55,Mostly cloudy,No visually surveyable habitat,0,NA,NA,NA,NA,NA,NA,NA,NA,NA,NA,NA,NA,NA,NA,NA,NA,NA,NA,NA,507735.18,4913309,2025-06-05,8H 42M 0S,5276,NA,NA,NA,NA,NA,NA,NA,NA,NA,NA,NA,NA,156,2025,2025-06-05T12:30:59Z,191.99999999999994
NA,NA,NA,25_2792-1,2792,821,GRH,2025,6/5/2025,1,07:56:00,56,Mostly cloudy,Large MAKE hunting in field,0,NA,NA,NA,NA,NA,NA,NA,NA,NA,NA,NA,NA,NA,NA,NA,NA,NA,NA,NA,498971.71,4910991,2025-06-05,7H 56M 0S,2792,NA,NA,NA,NA,NA,NA,NA,NA,NA,NA,NA,NA,156,2025,2025-06-05T12:30:59Z,146
NA,NA,NA,25_923-1,923,823,GRH,2025,6/5/2025,1,07:01:00,54,Mostly cloudy,NA,0,NA,NA,NA,NA,NA,NA,NA,NA,NA,NA,NA,NA,NA,NA,NA,NA,NA,NA,NA,488845.62,4895910.5,2025-06-05,7H 1M 0S,923,NA,NA,NA,NA,NA,NA,NA,NA,NA,NA,NA,NA,156,2025,2025-06-05T12:30:59Z,91
NA,NA,NA,25_3707-1,3707,824,GRH,2025,6/5/2025,1,06:24:00,52,Mostly cloudy,NA,0,NA,NA,NA,NA,NA,NA,NA,NA,NA,NA,NA,NA,NA,NA,NA,NA,NA,NA,NA,486198.84,4897600.5,2025-06-05,6H 24M 0S,3707,NA,NA,NA,NA,NA,NA,NA,NA,NA,NA,NA,NA,156,2025,2025-06-05T12:30:59Z,54.00000000000002
NA,NA,NA,25_4732-1,4732,825,GRH,2025,6/5/2025,1,06:03:00,51,Mostly cloudy,NA,0,NA,NA,NA,NA,NA,NA,NA,NA,NA,NA,NA,NA,NA,NA,NA,NA,NA,NA,NA,484101.93,4899027.5,2025-06-05,6H 3M 0S,4732,NA,NA,NA,NA,NA,NA,NA,NA,NA,NA,NA,NA,156,2025,2025-06-05T12:30:59Z,32.999999999999986
NA,NA,NA,25_1861-1,1861,827,GRH,2025,6/4/2025,1,09:51:00,61,Partly cloudy,Heat shimmer difficult beyong 250m. Otherwise seems like an excellent lark field,0,NA,NA,NA,NA,NA,NA,NA,NA,NA,NA,NA,NA,NA,NA,NA,NA,NA,NA,NA,502904.9,4867169.5,2025-06-04,9H 51M 0S,1861,NA,NA,NA,NA,NA,NA,NA,NA,NA,NA,NA,NA,155,2025,2025-06-04T12:31:23Z,260
NA,NA,NA,25_1325-1,1325,828,GRH,2025,6/4/2025,1,09:08:00,59,Mostly cloudy,NA,0,NA,NA,NA,NA,NA,NA,NA,NA,NA,NA,NA,NA,NA,NA,NA,NA,NA,NA,NA,489745.28,4909919.5,2025-06-04,9H 8M 0S,1325,NA,NA,NA,NA,NA,NA,NA,NA,NA,NA,NA,NA,155,2025,2025-06-04T12:31:23Z,216.99999999999997
NA,NA,NA,25_5464-1,5464,829,GRH,2025,6/4/2025,1,08:50:00,58,Mostly cloudy,NA,0,NA,NA,NA,NA,NA,NA,NA,NA,NA,NA,NA,NA,NA,NA,NA,NA,NA,NA,NA,489746.15,4912498.5,2025-06-04,8H 50M 0S,5464,NA,NA,NA,NA,NA,NA,NA,NA,NA,NA,NA,NA,155,2025,2025-06-04T12:31:23Z,199.00000000000003
NA,NA,NA,25_1101-1,1101,830,GRH,2025,6/4/2025,1,08:33:00,57,Mostly cloudy,NA,0,NA,NA,NA,NA,NA,NA,NA,NA,NA,NA,NA,NA,NA,NA,NA,NA,NA,NA,NA,490153.9,4915603,2025-06-04,8H 33M 0S,1101,NA,NA,NA,NA,NA,NA,NA,NA,NA,NA,NA,NA,155,2025,2025-06-04T12:31:23Z,182.00000000000006
NA,NA,NA,25_1213-1,1213,833,GRH,2025,6/4/2025,1,07:30:00,56,Mostly cloudy,NA,0,NA,NA,NA,NA,NA,NA,NA,NA,NA,NA,NA,NA,NA,NA,NA,NA,NA,NA,NA,482845.93,4916704,2025-06-04,7H 30M 0S,1213,NA,NA,NA,NA,NA,NA,NA,NA,NA,NA,NA,NA,155,2025,2025-06-04T12:31:23Z,119
NA,NA,NA,25_2669-1,2669,834,GRH,2025,6/4/2025,1,07:07:00,56,Mostly cloudy,Tractor watering (herbiciding?) field during survey,0,NA,NA,NA,NA,NA,NA,NA,NA,NA,NA,NA,NA,NA,NA,NA,NA,NA,NA,NA,485219.37,4919432.5,2025-06-04,7H 7M 0S,2669,NA,NA,NA,NA,NA,NA,NA,NA,NA,NA,NA,NA,155,2025,2025-06-04T12:31:23Z,95.99999999999997
NA,NA,NA,25_1769-1,1769,835,GRH,2025,6/4/2025,1,06:28:00,55,Mostly cloudy,NA,0,NA,NA,NA,NA,NA,NA,NA,NA,NA,NA,NA,NA,NA,NA,NA,NA,NA,NA,NA,486359.15,4921073,2025-06-04,6H 28M 0S,1769,NA,NA,NA,NA,NA,NA,NA,NA,NA,NA,NA,NA,155,2025,2025-06-04T12:31:23Z,57.000000000000014
NA,NA,NA,25_1428-1,1428,836,GRH,2025,6/4/2025,1,06:47:00,56,Mostly cloudy,NA,0,NA,NA,NA,NA,NA,NA,NA,NA,NA,NA,NA,NA,NA,NA,NA,NA,NA,NA,NA,486968.62,4919671.5,2025-06-04,6H 47M 0S,1428,NA,NA,NA,NA,NA,NA,NA,NA,NA,NA,NA,NA,155,2025,2025-06-04T12:31:23Z,76
NA,NA,NA,25_550-1,550,838,GRH,2025,6/4/2025,1,05:39:00,54,Mostly cloudy,"cornfield, ~12in high",0,NA,NA,NA,NA,NA,NA,NA,NA,NA,NA,NA,NA,NA,NA,NA,NA,NA,NA,NA,483193.87,4926119.5,2025-06-04,5H 39M 0S,550,NA,NA,NA,NA,NA,NA,NA,NA,NA,NA,NA,NA,155,2025,2025-06-04T12:31:23Z,8.000000000000025
NA,NA,NA,25_5452-1,5452,841,CWW,2025,6/12/2025,1,06:22:00,45,Clear,NA,0,NA,NA,NA,NA,NA,NA,NA,NA,NA,NA,NA,NA,NA,NA,NA,NA,NA,NA,NA,478372.12,4978463.5,2025-06-12,6H 22M 0S,5452,NA,NA,NA,NA,NA,NA,NA,NA,NA,NA,NA,NA,163,2025,2025-06-12T12:29:15Z,52.99999999999997
NA,NA,NA,25_984-1,984,843,CWW,2025,6/12/2025,1,06:47:00,50,Clear,"Young hazels one side, cut hay other - pre-bale",0,NA,NA,NA,NA,NA,NA,NA,NA,NA,NA,NA,NA,NA,NA,NA,NA,NA,NA,NA,478237.96,4980342,2025-06-12,6H 47M 0S,984,NA,NA,NA,NA,NA,NA,NA,NA,NA,NA,NA,NA,163,2025,2025-06-12T12:29:15Z,77.99999999999999
NA,NA,NA,25_4867-1,4867,844,CWW,2025,6/12/2025,1,07:44:00,50,Clear,no larks,0,NA,NA,NA,NA,NA,NA,NA,NA,NA,NA,NA,NA,NA,NA,NA,NA,NA,NA,NA,485246.56,4979698,2025-06-12,7H 44M 0S,4867,NA,NA,NA,NA,NA,NA,NA,NA,NA,NA,NA,NA,163,2025,2025-06-12T12:29:15Z,135
NA,NA,NA,25_5500-1,5500,846,CWW,2025,6/12/2025,1,08:25:00,51,Clear,NA,0,NA,NA,NA,NA,NA,NA,NA,NA,NA,NA,NA,NA,NA,NA,NA,NA,NA,NA,NA,485685.43,4976816.5,2025-06-12,8H 25M 0S,5500,NA,NA,NA,NA,NA,NA,NA,NA,NA,NA,NA,NA,163,2025,2025-06-12T12:29:15Z,175.99999999999997
NA,NA,NA,25_2837-1,2837,847,CWW,2025,6/12/2025,1,09:03:00,55,Clear,NA,0,NA,NA,NA,NA,NA,NA,NA,NA,NA,NA,NA,NA,NA,NA,NA,NA,NA,NA,NA,506932.25,4979605,2025-06-12,9H 3M 0S,2837,NA,NA,NA,NA,NA,NA,NA,NA,NA,NA,NA,NA,163,2025,2025-06-12T12:29:15Z,214.00000000000003
NA,NA,NA,25_700-1,700,848,CWW,2025,6/12/2025,1,09:27:00,59,Clear,NA,0,NA,NA,NA,NA,NA,NA,NA,NA,NA,NA,NA,NA,NA,NA,NA,NA,NA,NA,NA,506523.18,4982424,2025-06-12,9H 27M 0S,700,NA,NA,NA,NA,NA,NA,NA,NA,NA,NA,NA,NA,163,2025,2025-06-12T12:29:15Z,237.99999999999994
NA,NA,NA,25_3232-1,3232,741,GRH,2025,5/14/2025,1,06:52:00,50,Drizzle,NA,0,NA,NA,NA,NA,NA,NA,NA,NA,NA,NA,NA,NA,NA,NA,NA,NA,NA,NA,NA,491194.15,4951493,2025-05-14,6H 52M 0S,3232,NA,NA,NA,NA,NA,NA,NA,NA,NA,NA,NA,NA,134,2025,2025-05-14T12:47:42Z,65.00000000000003
NA,NA,NA,25_2584-1,2584,742,GRH,2025,5/14/2025,1,07:17:00,50,Drizzle,Beets!,0,NA,NA,NA,NA,NA,NA,NA,NA,NA,NA,NA,NA,NA,NA,NA,NA,NA,NA,NA,492223.87,4952903,2025-05-14,7H 17M 0S,2584,NA,NA,NA,NA,NA,NA,NA,NA,NA,NA,NA,NA,134,2025,2025-05-14T12:47:42Z,90
NA,NA,NA,25_2580-1,2580,743,GRH,2025,5/14/2025,1,06:33:00,50,Drizzle,NA,0,NA,NA,NA,NA,NA,NA,NA,NA,NA,NA,NA,NA,NA,NA,NA,NA,NA,NA,NA,490528.5,4952145.5,2025-05-14,6H 33M 0S,2580,NA,NA,NA,NA,NA,NA,NA,NA,NA,NA,NA,NA,134,2025,2025-05-14T12:47:42Z,46
NA,NA,NA,25_3213-1,3213,744,GRH,2025,5/14/2025,1,06:04:00,49,Drizzle,NA,0,NA,NA,NA,NA,NA,NA,NA,NA,NA,NA,NA,NA,NA,NA,NA,NA,NA,NA,NA,493102.81,4947722.5,2025-05-14,6H 4M 0S,3213,NA,NA,NA,NA,NA,NA,NA,NA,NA,NA,NA,NA,134,2025,2025-05-14T12:47:42Z,16.999999999999993
NA,NA,NA,25_4492-1,4492,746,CWW,2025,5/20/2025,1,07:58:00,47,Mostly cloudy,NA,0,NA,NA,NA,NA,NA,NA,NA,NA,NA,NA,NA,NA,NA,NA,NA,NA,NA,NA,NA,479301.03,4921614,2025-05-20,7H 58M 0S,4492,NA,NA,NA,NA,NA,NA,NA,NA,NA,NA,NA,NA,140,2025,2025-05-20T12:41:35Z,137
NA,NA,NA,25_3086-1,3086,747,CWW,2025,5/20/2025,1,08:58:00,52,Mostly cloudy,NA,0,NA,NA,NA,NA,NA,NA,NA,NA,NA,NA,NA,NA,NA,NA,NA,NA,NA,NA,NA,481786.28,4907906,2025-05-20,8H 58M 0S,3086,NA,NA,NA,NA,NA,NA,NA,NA,NA,NA,NA,NA,140,2025,2025-05-20T12:41:35Z,197
NA,NA,NA,25_4197-1,4197,748,CWW,2025,5/20/2025,1,07:12:00,44,Mostly cloudy,NA,0,NA,NA,NA,NA,NA,NA,NA,NA,NA,NA,NA,NA,NA,NA,NA,NA,NA,NA,NA,478122.78,4922842,2025-05-20,7H 12M 0S,4197,NA,NA,NA,NA,NA,NA,NA,NA,NA,NA,NA,NA,140,2025,2025-05-20T12:41:35Z,91
NA,NA,NA,25_4493-1,4493,749,CWW,2025,5/20/2025,1,07:34:00,46,Mostly cloudy,NA,0,NA,NA,NA,NA,NA,NA,NA,NA,NA,NA,NA,NA,NA,NA,NA,NA,NA,NA,NA,478651.03,4921619,2025-05-20,7H 34M 0S,4493,NA,NA,NA,NA,NA,NA,NA,NA,NA,NA,NA,NA,140,2025,2025-05-20T12:41:35Z,112.99999999999997
NA,NA,NA,25_4195-1,4195,750,CWW,2025,5/20/2025,1,06:34:00,45,Mostly cloudy,NA,0,NA,NA,NA,NA,NA,NA,NA,NA,NA,NA,NA,NA,NA,NA,NA,NA,NA,NA,NA,478222.46,4924138,2025-05-20,6H 34M 0S,4195,NA,NA,NA,NA,NA,NA,NA,NA,NA,NA,NA,NA,140,2025,2025-05-20T12:41:35Z,52.99999999999997
NA,NA,NA,25_4196-1,4196,751,CWW,2025,5/20/2025,1,06:51:00,44,Mostly cloudy,NA,0,NA,NA,NA,NA,NA,NA,NA,NA,NA,NA,NA,NA,NA,NA,NA,NA,NA,NA,NA,478172.46,4923490,2025-05-20,6H 51M 0S,4196,NA,NA,NA,NA,NA,NA,NA,NA,NA,NA,NA,NA,140,2025,2025-05-20T12:41:35Z,69.99999999999997
NA,NA,NA,25_4273-1,4273,752,CWW,2025,5/20/2025,1,06:13:00,45,Mostly cloudy,NA,0,NA,NA,NA,NA,NA,NA,NA,NA,NA,NA,NA,NA,NA,NA,NA,NA,NA,NA,NA,478920.21,4924745.5,2025-05-20,6H 13M 0S,4273,NA,NA,NA,NA,NA,NA,NA,NA,NA,NA,NA,NA,140,2025,2025-05-20T12:41:35Z,31.999999999999993
NA,NA,NA,25_3791-1,3791,753,CWW,2025,5/20/2025,1,05:37:00,44,Mostly cloudy,Dog barking @ minute 10,0,NA,NA,NA,NA,NA,NA,NA,NA,NA,NA,NA,NA,NA,NA,NA,NA,NA,NA,NA,480982.65,4929629.5,2025-05-20,5H 37M 0S,3791,NA,NA,NA,NA,NA,NA,NA,NA,NA,NA,NA,NA,140,2025,2025-05-20T12:41:35Z,-3.999999999999986
NA,NA,NA,25_3988-1,3988,754,CWW,2025,5/20/2025,1,09:23:00,51,Mostly cloudy,NA,0,NA,NA,NA,NA,NA,NA,NA,NA,NA,NA,NA,NA,NA,NA,NA,NA,NA,NA,NA,480839.65,4905471,2025-05-20,9H 23M 0S,3988,NA,NA,NA,NA,NA,NA,NA,NA,NA,NA,NA,NA,140,2025,2025-05-20T12:41:35Z,221.99999999999994
NA,NA,NA,25_2989-1,2989,755,CWW,2025,5/20/2025,1,09:46:00,52,Mostly cloudy,"extremely marginal habitat, older hazelnuts",0,NA,NA,NA,NA,NA,NA,NA,NA,NA,NA,NA,NA,NA,NA,NA,NA,NA,NA,NA,482360.25,4903365.5,2025-05-20,9H 46M 0S,2989,NA,NA,NA,NA,NA,NA,NA,NA,NA,NA,NA,NA,140,2025,2025-05-20T12:41:35Z,245.00000000000003
NA,NA,NA,NA,NA,NA,NA,NA,NA,NA,NA,NA,NA,NA,NA,NA,NA,NA,NA,NA,NA,NA,NA,NA,NA,NA,NA,NA,NA,NA,NA,NA,NA,NA,NA,NA,NA,NA,NA,NA,NA,NA,NA,NA,NA,NA,NA,NA,NA,NA,NA,NA,NA,NA,NA
NA,NA,NA,NA,NA,NA,NA,NA,NA,NA,NA,NA,NA,NA,NA,NA,NA,NA,NA,NA,NA,NA,NA,NA,NA,NA,NA,NA,NA,NA,NA,NA,NA,NA,NA,NA,NA,NA,NA,NA,NA,NA,NA,NA,NA,NA,NA,NA,NA,NA,NA,NA,NA,NA,NA
NA,NA,NA,NA,NA,NA,NA,NA,NA,NA,NA,NA,NA,NA,NA,NA,NA,NA,NA,NA,NA,NA,NA,NA,NA,NA,NA,NA,NA,NA,NA,NA,NA,NA,NA,NA,NA,NA,NA,NA,NA,NA,NA,NA,NA,NA,NA,NA,NA,NA,NA,NA,NA,NA,NA
NA,NA,NA,NA,NA,NA,NA,NA,NA,NA,NA,NA,NA,NA,NA,NA,NA,NA,NA,NA,NA,NA,NA,NA,NA,NA,NA,NA,NA,NA,NA,NA,NA,NA,NA,NA,NA,NA,NA,NA,NA,NA,NA,NA,NA,NA,NA,NA,NA,NA,NA,NA,NA,NA,NA
NA,NA,NA,NA,NA,NA,NA,NA,NA,NA,NA,NA,NA,NA,NA,NA,NA,NA,NA,NA,NA,NA,NA,NA,NA,NA,NA,NA,NA,NA,NA,NA,NA,NA,NA,NA,NA,NA,NA,NA,NA,NA,NA,NA,NA,NA,NA,NA,NA,NA,NA,NA,NA,NA,NA
NA,NA,NA,NA,NA,NA,NA,NA,NA,NA,NA,NA,NA,NA,NA,NA,NA,NA,NA,NA,NA,NA,NA,NA,NA,NA,NA,NA,NA,NA,NA,NA,NA,NA,NA,NA,NA,NA,NA,NA,NA,NA,NA,NA,NA,NA,NA,NA,NA,NA,NA,NA,NA,NA,NA
NA,NA,NA,NA,NA,NA,NA,NA,NA,NA,NA,NA,NA,NA,NA,NA,NA,NA,NA,NA,NA,NA,NA,NA,NA,NA,NA,NA,NA,NA,NA,NA,NA,NA,NA,NA,NA,NA,NA,NA,NA,NA,NA,NA,NA,NA,NA,NA,NA,NA,NA,NA,NA,NA,NA
NA,NA,NA,NA,NA,NA,NA,NA,NA,NA,NA,NA,NA,NA,NA,NA,NA,NA,NA,NA,NA,NA,NA,NA,NA,NA,NA,NA,NA,NA,NA,NA,NA,NA,NA,NA,NA,NA,NA,NA,NA,NA,NA,NA,NA,NA,NA,NA,NA,NA,NA,NA,NA,NA,NA
NA,NA,NA,NA,NA,NA,NA,NA,NA,NA,NA,NA,NA,NA,NA,NA,NA,NA,NA,NA,NA,NA,NA,NA,NA,NA,NA,NA,NA,NA,NA,NA,NA,NA,NA,NA,NA,NA,NA,NA,NA,NA,NA,NA,NA,NA,NA,NA,NA,NA,NA,NA,NA,NA,NA
NA,NA,NA,NA,NA,NA,NA,NA,NA,NA,NA,NA,NA,NA,NA,NA,NA,NA,NA,NA,NA,NA,NA,NA,NA,NA,NA,NA,NA,NA,NA,NA,NA,NA,NA,NA,NA,NA,NA,NA,NA,NA,NA,NA,NA,NA,NA,NA,NA,NA,NA,NA,NA,NA,NA
NA,NA,NA,NA,NA,NA,NA,NA,NA,NA,NA,NA,NA,NA,NA,NA,NA,NA,NA,NA,NA,NA,NA,NA,NA,NA,NA,NA,NA,NA,NA,NA,NA,NA,NA,NA,NA,NA,NA,NA,NA,NA,NA,NA,NA,NA,NA,NA,NA,NA,NA,NA,NA,NA,NA
NA,NA,NA,NA,NA,NA,NA,NA,NA,NA,NA,NA,NA,NA,NA,NA,NA,NA,NA,NA,NA,NA,NA,NA,NA,NA,NA,NA,NA,NA,NA,NA,NA,NA,NA,NA,NA,NA,NA,NA,NA,NA,NA,NA,NA,NA,NA,NA,NA,NA,NA,NA,NA,NA,NA
NA,NA,NA,NA,NA,NA,NA,NA,NA,NA,NA,NA,NA,NA,NA,NA,NA,NA,NA,NA,NA,NA,NA,NA,NA,NA,NA,NA,NA,NA,NA,NA,NA,NA,NA,NA,NA,NA,NA,NA,NA,NA,NA,NA,NA,NA,NA,NA,NA,NA,NA,NA,NA,NA,NA
NA,NA,NA,NA,NA,NA,NA,NA,NA,NA,NA,NA,NA,NA,NA,NA,NA,NA,NA,NA,NA,NA,NA,NA,NA,NA,NA,NA,NA,NA,NA,NA,NA,NA,NA,NA,NA,NA,NA,NA,NA,NA,NA,NA,NA,NA,NA,NA,NA,NA,NA,NA,NA,NA,NA
NA,NA,NA,NA,NA,NA,NA,NA,NA,NA,NA,NA,NA,NA,NA,NA,NA,NA,NA,NA,NA,NA,NA,NA,NA,NA,NA,NA,NA,NA,NA,NA,NA,NA,NA,NA,NA,NA,NA,NA,NA,NA,NA,NA,NA,NA,NA,NA,NA,NA,NA,NA,NA,NA,NA
NA,NA,NA,NA,NA,NA,NA,NA,NA,NA,NA,NA,NA,NA,NA,NA,NA,NA,NA,NA,NA,NA,NA,NA,NA,NA,NA,NA,NA,NA,NA,NA,NA,NA,NA,NA,NA,NA,NA,NA,NA,NA,NA,NA,NA,NA,NA,NA,NA,NA,NA,NA,NA,NA,NA
NA,NA,NA,NA,NA,NA,NA,NA,NA,NA,NA,NA,NA,NA,NA,NA,NA,NA,NA,NA,NA,NA,NA,NA,NA,NA,NA,NA,NA,NA,NA,NA,NA,NA,NA,NA,NA,NA,NA,NA,NA,NA,NA,NA,NA,NA,NA,NA,NA,NA,NA,NA,NA,NA,NA
NA,NA,NA,NA,NA,NA,NA,NA,NA,NA,NA,NA,NA,NA,NA,NA,NA,NA,NA,NA,NA,NA,NA,NA,NA,NA,NA,NA,NA,NA,NA,NA,NA,NA,NA,NA,NA,NA,NA,NA,NA,NA,NA,NA,NA,NA,NA,NA,NA,NA,NA,NA,NA,NA,NA
NA,NA,NA,NA,NA,NA,NA,NA,NA,NA,NA,NA,NA,NA,NA,NA,NA,NA,NA,NA,NA,NA,NA,NA,NA,NA,NA,NA,NA,NA,NA,NA,NA,NA,NA,NA,NA,NA,NA,NA,NA,NA,NA,NA,NA,NA,NA,NA,NA,NA,NA,NA,NA,NA,NA
NA,NA,NA,NA,NA,NA,NA,NA,NA,NA,NA,NA,NA,NA,NA,NA,NA,NA,NA,NA,NA,NA,NA,NA,NA,NA,NA,NA,NA,NA,NA,NA,NA,NA,NA,NA,NA,NA,NA,NA,NA,NA,NA,NA,NA,NA,NA,NA,NA,NA,NA,NA,NA,NA,NA
NA,NA,NA,NA,NA,NA,NA,NA,NA,NA,NA,NA,NA,NA,NA,NA,NA,NA,NA,NA,NA,NA,NA,NA,NA,NA,NA,NA,NA,NA,NA,NA,NA,NA,NA,NA,NA,NA,NA,NA,NA,NA,NA,NA,NA,NA,NA,NA,NA,NA,NA,NA,NA,NA,NA
NA,NA,NA,NA,NA,NA,NA,NA,NA,NA,NA,NA,NA,NA,NA,NA,NA,NA,NA,NA,NA,NA,NA,NA,NA,NA,NA,NA,NA,NA,NA,NA,NA,NA,NA,NA,NA,NA,NA,NA,NA,NA,NA,NA,NA,NA,NA,NA,NA,NA,NA,NA,NA,NA,NA
NA,NA,NA,NA,NA,NA,NA,NA,NA,NA,NA,NA,NA,NA,NA,NA,NA,NA,NA,NA,NA,NA,NA,NA,NA,NA,NA,NA,NA,NA,NA,NA,NA,NA,NA,NA,NA,NA,NA,NA,NA,NA,NA,NA,NA,NA,NA,NA,NA,NA,NA,NA,NA,NA,NA
NA,NA,NA,NA,NA,NA,NA,NA,NA,NA,NA,NA,NA,NA,NA,NA,NA,NA,NA,NA,NA,NA,NA,NA,NA,NA,NA,NA,NA,NA,NA,NA,NA,NA,NA,NA,NA,NA,NA,NA,NA,NA,NA,NA,NA,NA,NA,NA,NA,NA,NA,NA,NA,NA,NA
NA,NA,NA,NA,NA,NA,NA,NA,NA,NA,NA,NA,NA,NA,NA,NA,NA,NA,NA,NA,NA,NA,NA,NA,NA,NA,NA,NA,NA,NA,NA,NA,NA,NA,NA,NA,NA,NA,NA,NA,NA,NA,NA,NA,NA,NA,NA,NA,NA,NA,NA,NA,NA,NA,NA
NA,NA,NA,NA,NA,NA,NA,NA,NA,NA,NA,NA,NA,NA,NA,NA,NA,NA,NA,NA,NA,NA,NA,NA,NA,NA,NA,NA,NA,NA,NA,NA,NA,NA,NA,NA,NA,NA,NA,NA,NA,NA,NA,NA,NA,NA,NA,NA,NA,NA,NA,NA,NA,NA,NA
NA,NA,NA,NA,NA,NA,NA,NA,NA,NA,NA,NA,NA,NA,NA,NA,NA,NA,NA,NA,NA,NA,NA,NA,NA,NA,NA,NA,NA,NA,NA,NA,NA,NA,NA,NA,NA,NA,NA,NA,NA,NA,NA,NA,NA,NA,NA,NA,NA,NA,NA,NA,NA,NA,NA
NA,NA,NA,NA,NA,NA,NA,NA,NA,NA,NA,NA,NA,NA,NA,NA,NA,NA,NA,NA,NA,NA,NA,NA,NA,NA,NA,NA,NA,NA,NA,NA,NA,NA,NA,NA,NA,NA,NA,NA,NA,NA,NA,NA,NA,NA,NA,NA,NA,NA,NA,NA,NA,NA,NA
NA,NA,NA,NA,NA,NA,NA,NA,NA,NA,NA,NA,NA,NA,NA,NA,NA,NA,NA,NA,NA,NA,NA,NA,NA,NA,NA,NA,NA,NA,NA,NA,NA,NA,NA,NA,NA,NA,NA,NA,NA,NA,NA,NA,NA,NA,NA,NA,NA,NA,NA,NA,NA,NA,NA
NA,NA,NA,NA,NA,NA,NA,NA,NA,NA,NA,NA,NA,NA,NA,NA,NA,NA,NA,NA,NA,NA,NA,NA,NA,NA,NA,NA,NA,NA,NA,NA,NA,NA,NA,NA,NA,NA,NA,NA,NA,NA,NA,NA,NA,NA,NA,NA,NA,NA,NA,NA,NA,NA,NA
NA,NA,NA,NA,NA,NA,NA,NA,NA,NA,NA,NA,NA,NA,NA,NA,NA,NA,NA,NA,NA,NA,NA,NA,NA,NA,NA,NA,NA,NA,NA,NA,NA,NA,NA,NA,NA,NA,NA,NA,NA,NA,NA,NA,NA,NA,NA,NA,NA,NA,NA,NA,NA,NA,NA
NA,NA,NA,NA,NA,NA,NA,NA,NA,NA,NA,NA,NA,NA,NA,NA,NA,NA,NA,NA,NA,NA,NA,NA,NA,NA,NA,NA,NA,NA,NA,NA,NA,NA,NA,NA,NA,NA,NA,NA,NA,NA,NA,NA,NA,NA,NA,NA,NA,NA,NA,NA,NA,NA,NA
NA,NA,NA,NA,NA,NA,NA,NA,NA,NA,NA,NA,NA,NA,NA,NA,NA,NA,NA,NA,NA,NA,NA,NA,NA,NA,NA,NA,NA,NA,NA,NA,NA,NA,NA,NA,NA,NA,NA,NA,NA,NA,NA,NA,NA,NA,NA,NA,NA,NA,NA,NA,NA,NA,NA
NA,NA,NA,NA,NA,NA,NA,NA,NA,NA,NA,NA,NA,NA,NA,NA,NA,NA,NA,NA,NA,NA,NA,NA,NA,NA,NA,NA,NA,NA,NA,NA,NA,NA,NA,NA,NA,NA,NA,NA,NA,NA,NA,NA,NA,NA,NA,NA,NA,NA,NA,NA,NA,NA,NA
NA,NA,NA,NA,NA,NA,NA,NA,NA,NA,NA,NA,NA,NA,NA,NA,NA,NA,NA,NA,NA,NA,NA,NA,NA,NA,NA,NA,NA,NA,NA,NA,NA,NA,NA,NA,NA,NA,NA,NA,NA,NA,NA,NA,NA,NA,NA,NA,NA,NA,NA,NA,NA,NA,NA
NA,NA,NA,NA,NA,NA,NA,NA,NA,NA,NA,NA,NA,NA,NA,NA,NA,NA,NA,NA,NA,NA,NA,NA,NA,NA,NA,NA,NA,NA,NA,NA,NA,NA,NA,NA,NA,NA,NA,NA,NA,NA,NA,NA,NA,NA,NA,NA,NA,NA,NA,NA,NA,NA,NA
NA,NA,NA,NA,NA,NA,NA,NA,NA,NA,NA,NA,NA,NA,NA,NA,NA,NA,NA,NA,NA,NA,NA,NA,NA,NA,NA,NA,NA,NA,NA,NA,NA,NA,NA,NA,NA,NA,NA,NA,NA,NA,NA,NA,NA,NA,NA,NA,NA,NA,NA,NA,NA,NA,NA
NA,NA,NA,NA,NA,NA,NA,NA,NA,NA,NA,NA,NA,NA,NA,NA,NA,NA,NA,NA,NA,NA,NA,NA,NA,NA,NA,NA,NA,NA,NA,NA,NA,NA,NA,NA,NA,NA,NA,NA,NA,NA,NA,NA,NA,NA,NA,NA,NA,NA,NA,NA,NA,NA,NA
NA,NA,NA,NA,NA,NA,NA,NA,NA,NA,NA,NA,NA,NA,NA,NA,NA,NA,NA,NA,NA,NA,NA,NA,NA,NA,NA,NA,NA,NA,NA,NA,NA,NA,NA,NA,NA,NA,NA,NA,NA,NA,NA,NA,NA,NA,NA,NA,NA,NA,NA,NA,NA,NA,NA
NA,NA,NA,NA,NA,NA,NA,NA,NA,NA,NA,NA,NA,NA,NA,NA,NA,NA,NA,NA,NA,NA,NA,NA,NA,NA,NA,NA,NA,NA,NA,NA,NA,NA,NA,NA,NA,NA,NA,NA,NA,NA,NA,NA,NA,NA,NA,NA,NA,NA,NA,NA,NA,NA,NA
NA,NA,NA,NA,NA,NA,NA,NA,NA,NA,NA,NA,NA,NA,NA,NA,NA,NA,NA,NA,NA,NA,NA,NA,NA,NA,NA,NA,NA,NA,NA,NA,NA,NA,NA,NA,NA,NA,NA,NA,NA,NA,NA,NA,NA,NA,NA,NA,NA,NA,NA,NA,NA,NA,NA
NA,NA,NA,NA,NA,NA,NA,NA,NA,NA,NA,NA,NA,NA,NA,NA,NA,NA,NA,NA,NA,NA,NA,NA,NA,NA,NA,NA,NA,NA,NA,NA,NA,NA,NA,NA,NA,NA,NA,NA,NA,NA,NA,NA,NA,NA,NA,NA,NA,NA,NA,NA,NA,NA,NA
NA,NA,NA,NA,NA,NA,NA,NA,NA,NA,NA,NA,NA,NA,NA,NA,NA,NA,NA,NA,NA,NA,NA,NA,NA,NA,NA,NA,NA,NA,NA,NA,NA,NA,NA,NA,NA,NA,NA,NA,NA,NA,NA,NA,NA,NA,NA,NA,NA,NA,NA,NA,NA,NA,NA
NA,NA,NA,NA,NA,NA,NA,NA,NA,NA,NA,NA,NA,NA,NA,NA,NA,NA,NA,NA,NA,NA,NA,NA,NA,NA,NA,NA,NA,NA,NA,NA,NA,NA,NA,NA,NA,NA,NA,NA,NA,NA,NA,NA,NA,NA,NA,NA,NA,NA,NA,NA,NA,NA,NA
NA,NA,NA,NA,NA,NA,NA,NA,NA,NA,NA,NA,NA,NA,NA,NA,NA,NA,NA,NA,NA,NA,NA,NA,NA,NA,NA,NA,NA,NA,NA,NA,NA,NA,NA,NA,NA,NA,NA,NA,NA,NA,NA,NA,NA,NA,NA,NA,NA,NA,NA,NA,NA,NA,NA
NA,NA,NA,NA,NA,NA,NA,NA,NA,NA,NA,NA,NA,NA,NA,NA,NA,NA,NA,NA,NA,NA,NA,NA,NA,NA,NA,NA,NA,NA,NA,NA,NA,NA,NA,NA,NA,NA,NA,NA,NA,NA,NA,NA,NA,NA,NA,NA,NA,NA,NA,NA,NA,NA,NA
NA,NA,NA,NA,NA,NA,NA,NA,NA,NA,NA,NA,NA,NA,NA,NA,NA,NA,NA,NA,NA,NA,NA,NA,NA,NA,NA,NA,NA,NA,NA,NA,NA,NA,NA,NA,NA,NA,NA,NA,NA,NA,NA,NA,NA,NA,NA,NA,NA,NA,NA,NA,NA,NA,NA
NA,NA,NA,NA,NA,NA,NA,NA,NA,NA,NA,NA,NA,NA,NA,NA,NA,NA,NA,NA,NA,NA,NA,NA,NA,NA,NA,NA,NA,NA,NA,NA,NA,NA,NA,NA,NA,NA,NA,NA,NA,NA,NA,NA,NA,NA,NA,NA,NA,NA,NA,NA,NA,NA,NA
NA,NA,NA,NA,NA,NA,NA,NA,NA,NA,NA,NA,NA,NA,NA,NA,NA,NA,NA,NA,NA,NA,NA,NA,NA,NA,NA,NA,NA,NA,NA,NA,NA,NA,NA,NA,NA,NA,NA,NA,NA,NA,NA,NA,NA,NA,NA,NA,NA,NA,NA,NA,NA,NA,NA
NA,NA,NA,NA,NA,NA,NA,NA,NA,NA,NA,NA,NA,NA,NA,NA,NA,NA,NA,NA,NA,NA,NA,NA,NA,NA,NA,NA,NA,NA,NA,NA,NA,NA,NA,NA,NA,NA,NA,NA,NA,NA,NA,NA,NA,NA,NA,NA,NA,NA,NA,NA,NA,NA,NA
NA,NA,NA,NA,NA,NA,NA,NA,NA,NA,NA,NA,NA,NA,NA,NA,NA,NA,NA,NA,NA,NA,NA,NA,NA,NA,NA,NA,NA,NA,NA,NA,NA,NA,NA,NA,NA,NA,NA,NA,NA,NA,NA,NA,NA,NA,NA,NA,NA,NA,NA,NA,NA,NA,NA
NA,NA,NA,NA,NA,NA,NA,NA,NA,NA,NA,NA,NA,NA,NA,NA,NA,NA,NA,NA,NA,NA,NA,NA,NA,NA,NA,NA,NA,NA,NA,NA,NA,NA,NA,NA,NA,NA,NA,NA,NA,NA,NA,NA,NA,NA,NA,NA,NA,NA,NA,NA,NA,NA,NA
NA,NA,NA,NA,NA,NA,NA,NA,NA,NA,NA,NA,NA,NA,NA,NA,NA,NA,NA,NA,NA,NA,NA,NA,NA,NA,NA,NA,NA,NA,NA,NA,NA,NA,NA,NA,NA,NA,NA,NA,NA,NA,NA,NA,NA,NA,NA,NA,NA,NA,NA,NA,NA,NA,NA
NA,NA,NA,NA,NA,NA,NA,NA,NA,NA,NA,NA,NA,NA,NA,NA,NA,NA,NA,NA,NA,NA,NA,NA,NA,NA,NA,NA,NA,NA,NA,NA,NA,NA,NA,NA,NA,NA,NA,NA,NA,NA,NA,NA,NA,NA,NA,NA,NA,NA,NA,NA,NA,NA,NA
NA,NA,NA,NA,NA,NA,NA,NA,NA,NA,NA,NA,NA,NA,NA,NA,NA,NA,NA,NA,NA,NA,NA,NA,NA,NA,NA,NA,NA,NA,NA,NA,NA,NA,NA,NA,NA,NA,NA,NA,NA,NA,NA,NA,NA,NA,NA,NA,NA,NA,NA,NA,NA,NA,NA
NA,NA,NA,NA,NA,NA,NA,NA,NA,NA,NA,NA,NA,NA,NA,NA,NA,NA,NA,NA,NA,NA,NA,NA,NA,NA,NA,NA,NA,NA,NA,NA,NA,NA,NA,NA,NA,NA,NA,NA,NA,NA,NA,NA,NA,NA,NA,NA,NA,NA,NA,NA,NA,NA,NA
NA,NA,NA,NA,NA,NA,NA,NA,NA,NA,NA,NA,NA,NA,NA,NA,NA,NA,NA,NA,NA,NA,NA,NA,NA,NA,NA,NA,NA,NA,NA,NA,NA,NA,NA,NA,NA,NA,NA,NA,NA,NA,NA,NA,NA,NA,NA,NA,NA,NA,NA,NA,NA,NA,NA
NA,NA,NA,NA,NA,NA,NA,NA,NA,NA,NA,NA,NA,NA,NA,NA,NA,NA,NA,NA,NA,NA,NA,NA,NA,NA,NA,NA,NA,NA,NA,NA,NA,NA,NA,NA,NA,NA,NA,NA,NA,NA,NA,NA,NA,NA,NA,NA,NA,NA,NA,NA,NA,NA,NA
NA,NA,NA,NA,NA,NA,NA,NA,NA,NA,NA,NA,NA,NA,NA,NA,NA,NA,NA,NA,NA,NA,NA,NA,NA,NA,NA,NA,NA,NA,NA,NA,NA,NA,NA,NA,NA,NA,NA,NA,NA,NA,NA,NA,NA,NA,NA,NA,NA,NA,NA,NA,NA,NA,NA
NA,NA,NA,NA,NA,NA,NA,NA,NA,NA,NA,NA,NA,NA,NA,NA,NA,NA,NA,NA,NA,NA,NA,NA,NA,NA,NA,NA,NA,NA,NA,NA,NA,NA,NA,NA,NA,NA,NA,NA,NA,NA,NA,NA,NA,NA,NA,NA,NA,NA,NA,NA,NA,NA,NA
NA,NA,NA,NA,NA,NA,NA,NA,NA,NA,NA,NA,NA,NA,NA,NA,NA,NA,NA,NA,NA,NA,NA,NA,NA,NA,NA,NA,NA,NA,NA,NA,NA,NA,NA,NA,NA,NA,NA,NA,NA,NA,NA,NA,NA,NA,NA,NA,NA,NA,NA,NA,NA,NA,NA
NA,NA,NA,NA,NA,NA,NA,NA,NA,NA,NA,NA,NA,NA,NA,NA,NA,NA,NA,NA,NA,NA,NA,NA,NA,NA,NA,NA,NA,NA,NA,NA,NA,NA,NA,NA,NA,NA,NA,NA,NA,NA,NA,NA,NA,NA,NA,NA,NA,NA,NA,NA,NA,NA,NA
NA,NA,NA,NA,NA,NA,NA,NA,NA,NA,NA,NA,NA,NA,NA,NA,NA,NA,NA,NA,NA,NA,NA,NA,NA,NA,NA,NA,NA,NA,NA,NA,NA,NA,NA,NA,NA,NA,NA,NA,NA,NA,NA,NA,NA,NA,NA,NA,NA,NA,NA,NA,NA,NA,NA
NA,NA,NA,NA,NA,NA,NA,NA,NA,NA,NA,NA,NA,NA,NA,NA,NA,NA,NA,NA,NA,NA,NA,NA,NA,NA,NA,NA,NA,NA,NA,NA,NA,NA,NA,NA,NA,NA,NA,NA,NA,NA,NA,NA,NA,NA,NA,NA,NA,NA,NA,NA,NA,NA,NA
NA,NA,NA,NA,NA,NA,NA,NA,NA,NA,NA,NA,NA,NA,NA,NA,NA,NA,NA,NA,NA,NA,NA,NA,NA,NA,NA,NA,NA,NA,NA,NA,NA,NA,NA,NA,NA,NA,NA,NA,NA,NA,NA,NA,NA,NA,NA,NA,NA,NA,NA,NA,NA,NA,NA
NA,NA,NA,NA,NA,NA,NA,NA,NA,NA,NA,NA,NA,NA,NA,NA,NA,NA,NA,NA,NA,NA,NA,NA,NA,NA,NA,NA,NA,NA,NA,NA,NA,NA,NA,NA,NA,NA,NA,NA,NA,NA,NA,NA,NA,NA,NA,NA,NA,NA,NA,NA,NA,NA,NA
NA,NA,NA,NA,NA,NA,NA,NA,NA,NA,NA,NA,NA,NA,NA,NA,NA,NA,NA,NA,NA,NA,NA,NA,NA,NA,NA,NA,NA,NA,NA,NA,NA,NA,NA,NA,NA,NA,NA,NA,NA,NA,NA,NA,NA,NA,NA,NA,NA,NA,NA,NA,NA,NA,NA
NA,NA,NA,NA,NA,NA,NA,NA,NA,NA,NA,NA,NA,NA,NA,NA,NA,NA,NA,NA,NA,NA,NA,NA,NA,NA,NA,NA,NA,NA,NA,NA,NA,NA,NA,NA,NA,NA,NA,NA,NA,NA,NA,NA,NA,NA,NA,NA,NA,NA,NA,NA,NA,NA,NA
NA,NA,NA,NA,NA,NA,NA,NA,NA,NA,NA,NA,NA,NA,NA,NA,NA,NA,NA,NA,NA,NA,NA,NA,NA,NA,NA,NA,NA,NA,NA,NA,NA,NA,NA,NA,NA,NA,NA,NA,NA,NA,NA,NA,NA,NA,NA,NA,NA,NA,NA,NA,NA,NA,NA
NA,NA,NA,NA,NA,NA,NA,NA,NA,NA,NA,NA,NA,NA,NA,NA,NA,NA,NA,NA,NA,NA,NA,NA,NA,NA,NA,NA,NA,NA,NA,NA,NA,NA,NA,NA,NA,NA,NA,NA,NA,NA,NA,NA,NA,NA,NA,NA,NA,NA,NA,NA,NA,NA,NA
NA,NA,NA,NA,NA,NA,NA,NA,NA,NA,NA,NA,NA,NA,NA,NA,NA,NA,NA,NA,NA,NA,NA,NA,NA,NA,NA,NA,NA,NA,NA,NA,NA,NA,NA,NA,NA,NA,NA,NA,NA,NA,NA,NA,NA,NA,NA,NA,NA,NA,NA,NA,NA,NA,NA
NA,NA,NA,NA,NA,NA,NA,NA,NA,NA,NA,NA,NA,NA,NA,NA,NA,NA,NA,NA,NA,NA,NA,NA,NA,NA,NA,NA,NA,NA,NA,NA,NA,NA,NA,NA,NA,NA,NA,NA,NA,NA,NA,NA,NA,NA,NA,NA,NA,NA,NA,NA,NA,NA,NA
NA,NA,NA,NA,NA,NA,NA,NA,NA,NA,NA,NA,NA,NA,NA,NA,NA,NA,NA,NA,NA,NA,NA,NA,NA,NA,NA,NA,NA,NA,NA,NA,NA,NA,NA,NA,NA,NA,NA,NA,NA,NA,NA,NA,NA,NA,NA,NA,NA,NA,NA,NA,NA,NA,NA
NA,NA,NA,NA,NA,NA,NA,NA,NA,NA,NA,NA,NA,NA,NA,NA,NA,NA,NA,NA,NA,NA,NA,NA,NA,NA,NA,NA,NA,NA,NA,NA,NA,NA,NA,NA,NA,NA,NA,NA,NA,NA,NA,NA,NA,NA,NA,NA,NA,NA,NA,NA,NA,NA,NA
NA,NA,NA,NA,NA,NA,NA,NA,NA,NA,NA,NA,NA,NA,NA,NA,NA,NA,NA,NA,NA,NA,NA,NA,NA,NA,NA,NA,NA,NA,NA,NA,NA,NA,NA,NA,NA,NA,NA,NA,NA,NA,NA,NA,NA,NA,NA,NA,NA,NA,NA,NA,NA,NA,NA
NA,NA,NA,NA,NA,NA,NA,NA,NA,NA,NA,NA,NA,NA,NA,NA,NA,NA,NA,NA,NA,NA,NA,NA,NA,NA,NA,NA,NA,NA,NA,NA,NA,NA,NA,NA,NA,NA,NA,NA,NA,NA,NA,NA,NA,NA,NA,NA,NA,NA,NA,NA,NA,NA,NA
NA,NA,NA,NA,NA,NA,NA,NA,NA,NA,NA,NA,NA,NA,NA,NA,NA,NA,NA,NA,NA,NA,NA,NA,NA,NA,NA,NA,NA,NA,NA,NA,NA,NA,NA,NA,NA,NA,NA,NA,NA,NA,NA,NA,NA,NA,NA,NA,NA,NA,NA,NA,NA,NA,NA
NA,NA,NA,NA,NA,NA,NA,NA,NA,NA,NA,NA,NA,NA,NA,NA,NA,NA,NA,NA,NA,NA,NA,NA,NA,NA,NA,NA,NA,NA,NA,NA,NA,NA,NA,NA,NA,NA,NA,NA,NA,NA,NA,NA,NA,NA,NA,NA,NA,NA,NA,NA,NA,NA,NA
NA,NA,NA,NA,NA,NA,NA,NA,NA,NA,NA,NA,NA,NA,NA,NA,NA,NA,NA,NA,NA,NA,NA,NA,NA,NA,NA,NA,NA,NA,NA,NA,NA,NA,NA,NA,NA,NA,NA,NA,NA,NA,NA,NA,NA,NA,NA,NA,NA,NA,NA,NA,NA,NA,NA
NA,NA,NA,NA,NA,NA,NA,NA,NA,NA,NA,NA,NA,NA,NA,NA,NA,NA,NA,NA,NA,NA,NA,NA,NA,NA,NA,NA,NA,NA,NA,NA,NA,NA,NA,NA,NA,NA,NA,NA,NA,NA,NA,NA,NA,NA,NA,NA,NA,NA,NA,NA,NA,NA,NA
NA,NA,NA,NA,NA,NA,NA,NA,NA,NA,NA,NA,NA,NA,NA,NA,NA,NA,NA,NA,NA,NA,NA,NA,NA,NA,NA,NA,NA,NA,NA,NA,NA,NA,NA,NA,NA,NA,NA,NA,NA,NA,NA,NA,NA,NA,NA,NA,NA,NA,NA,NA,NA,NA,NA
NA,NA,NA,NA,NA,NA,NA,NA,NA,NA,NA,NA,NA,NA,NA,NA,NA,NA,NA,NA,NA,NA,NA,NA,NA,NA,NA,NA,NA,NA,NA,NA,NA,NA,NA,NA,NA,NA,NA,NA,NA,NA,NA,NA,NA,NA,NA,NA,NA,NA,NA,NA,NA,NA,NA
NA,NA,NA,NA,NA,NA,NA,NA,NA,NA,NA,NA,NA,NA,NA,NA,NA,NA,NA,NA,NA,NA,NA,NA,NA,NA,NA,NA,NA,NA,NA,NA,NA,NA,NA,NA,NA,NA,NA,NA,NA,NA,NA,NA,NA,NA,NA,NA,NA,NA,NA,NA,NA,NA,NA
NA,NA,NA,NA,NA,NA,NA,NA,NA,NA,NA,NA,NA,NA,NA,NA,NA,NA,NA,NA,NA,NA,NA,NA,NA,NA,NA,NA,NA,NA,NA,NA,NA,NA,NA,NA,NA,NA,NA,NA,NA,NA,NA,NA,NA,NA,NA,NA,NA,NA,NA,NA,NA,NA,NA
NA,NA,NA,NA,NA,NA,NA,NA,NA,NA,NA,NA,NA,NA,NA,NA,NA,NA,NA,NA,NA,NA,NA,NA,NA,NA,NA,NA,NA,NA,NA,NA,NA,NA,NA,NA,NA,NA,NA,NA,NA,NA,NA,NA,NA,NA,NA,NA,NA,NA,NA,NA,NA,NA,NA
NA,NA,NA,NA,NA,NA,NA,NA,NA,NA,NA,NA,NA,NA,NA,NA,NA,NA,NA,NA,NA,NA,NA,NA,NA,NA,NA,NA,NA,NA,NA,NA,NA,NA,NA,NA,NA,NA,NA,NA,NA,NA,NA,NA,NA,NA,NA,NA,NA,NA,NA,NA,NA,NA,NA
NA,NA,NA,NA,NA,NA,NA,NA,NA,NA,NA,NA,NA,NA,NA,NA,NA,NA,NA,NA,NA,NA,NA,NA,NA,NA,NA,NA,NA,NA,NA,NA,NA,NA,NA,NA,NA,NA,NA,NA,NA,NA,NA,NA,NA,NA,NA,NA,NA,NA,NA,NA,NA,NA,NA
NA,NA,NA,NA,NA,NA,NA,NA,NA,NA,NA,NA,NA,NA,NA,NA,NA,NA,NA,NA,NA,NA,NA,NA,NA,NA,NA,NA,NA,NA,NA,NA,NA,NA,NA,NA,NA,NA,NA,NA,NA,NA,NA,NA,NA,NA,NA,NA,NA,NA,NA,NA,NA,NA,NA
NA,NA,NA,NA,NA,NA,NA,NA,NA,NA,NA,NA,NA,NA,NA,NA,NA,NA,NA,NA,NA,NA,NA,NA,NA,NA,NA,NA,NA,NA,NA,NA,NA,NA,NA,NA,NA,NA,NA,NA,NA,NA,NA,NA,NA,NA,NA,NA,NA,NA,NA,NA,NA,NA,NA
NA,NA,NA,NA,NA,NA,NA,NA,NA,NA,NA,NA,NA,NA,NA,NA,NA,NA,NA,NA,NA,NA,NA,NA,NA,NA,NA,NA,NA,NA,NA,NA,NA,NA,NA,NA,NA,NA,NA,NA,NA,NA,NA,NA,NA,NA,NA,NA,NA,NA,NA,NA,NA,NA,NA
NA,NA,NA,NA,NA,NA,NA,NA,NA,NA,NA,NA,NA,NA,NA,NA,NA,NA,NA,NA,NA,NA,NA,NA,NA,NA,NA,NA,NA,NA,NA,NA,NA,NA,NA,NA,NA,NA,NA,NA,NA,NA,NA,NA,NA,NA,NA,NA,NA,NA,NA,NA,NA,NA,NA
NA,NA,NA,NA,NA,NA,NA,NA,NA,NA,NA,NA,NA,NA,NA,NA,NA,NA,NA,NA,NA,NA,NA,NA,NA,NA,NA,NA,NA,NA,NA,NA,NA,NA,NA,NA,NA,NA,NA,NA,NA,NA,NA,NA,NA,NA,NA,NA,NA,NA,NA,NA,NA,NA,NA
NA,NA,NA,NA,NA,NA,NA,NA,NA,NA,NA,NA,NA,NA,NA,NA,NA,NA,NA,NA,NA,NA,NA,NA,NA,NA,NA,NA,NA,NA,NA,NA,NA,NA,NA,NA,NA,NA,NA,NA,NA,NA,NA,NA,NA,NA,NA,NA,NA,NA,NA,NA,NA,NA,NA
NA,NA,NA,NA,NA,NA,NA,NA,NA,NA,NA,NA,NA,NA,NA,NA,NA,NA,NA,NA,NA,NA,NA,NA,NA,NA,NA,NA,NA,NA,NA,NA,NA,NA,NA,NA,NA,NA,NA,NA,NA,NA,NA,NA,NA,NA,NA,NA,NA,NA,NA,NA,NA,NA,NA
NA,NA,NA,NA,NA,NA,NA,NA,NA,NA,NA,NA,NA,NA,NA,NA,NA,NA,NA,NA,NA,NA,NA,NA,NA,NA,NA,NA,NA,NA,NA,NA,NA,NA,NA,NA,NA,NA,NA,NA,NA,NA,NA,NA,NA,NA,NA,NA,NA,NA,NA,NA,NA,NA,NA
NA,NA,NA,NA,NA,NA,NA,NA,NA,NA,NA,NA,NA,NA,NA,NA,NA,NA,NA,NA,NA,NA,NA,NA,NA,NA,NA,NA,NA,NA,NA,NA,NA,NA,NA,NA,NA,NA,NA,NA,NA,NA,NA,NA,NA,NA,NA,NA,NA,NA,NA,NA,NA,NA,NA
NA,NA,NA,NA,NA,NA,NA,NA,NA,NA,NA,NA,NA,NA,NA,NA,NA,NA,NA,NA,NA,NA,NA,NA,NA,NA,NA,NA,NA,NA,NA,NA,NA,NA,NA,NA,NA,NA,NA,NA,NA,NA,NA,NA,NA,NA,NA,NA,NA,NA,NA,NA,NA,NA,NA
NA,NA,NA,NA,NA,NA,NA,NA,NA,NA,NA,NA,NA,NA,NA,NA,NA,NA,NA,NA,NA,NA,NA,NA,NA,NA,NA,NA,NA,NA,NA,NA,NA,NA,NA,NA,NA,NA,NA,NA,NA,NA,NA,NA,NA,NA,NA,NA,NA,NA,NA,NA,NA,NA,NA
NA,NA,NA,NA,NA,NA,NA,NA,NA,NA,NA,NA,NA,NA,NA,NA,NA,NA,NA,NA,NA,NA,NA,NA,NA,NA,NA,NA,NA,NA,NA,NA,NA,NA,NA,NA,NA,NA,NA,NA,NA,NA,NA,NA,NA,NA,NA,NA,NA,NA,NA,NA,NA,NA,NA
NA,NA,NA,NA,NA,NA,NA,NA,NA,NA,NA,NA,NA,NA,NA,NA,NA,NA,NA,NA,NA,NA,NA,NA,NA,NA,NA,NA,NA,NA,NA,NA,NA,NA,NA,NA,NA,NA,NA,NA,NA,NA,NA,NA,NA,NA,NA,NA,NA,NA,NA,NA,NA,NA,NA
NA,NA,NA,NA,NA,NA,NA,NA,NA,NA,NA,NA,NA,NA,NA,NA,NA,NA,NA,NA,NA,NA,NA,NA,NA,NA,NA,NA,NA,NA,NA,NA,NA,NA,NA,NA,NA,NA,NA,NA,NA,NA,NA,NA,NA,NA,NA,NA,NA,NA,NA,NA,NA,NA,NA
NA,NA,NA,NA,NA,NA,NA,NA,NA,NA,NA,NA,NA,NA,NA,NA,NA,NA,NA,NA,NA,NA,NA,NA,NA,NA,NA,NA,NA,NA,NA,NA,NA,NA,NA,NA,NA,NA,NA,NA,NA,NA,NA,NA,NA,NA,NA,NA,NA,NA,NA,NA,NA,NA,NA
NA,NA,NA,NA,NA,NA,NA,NA,NA,NA,NA,NA,NA,NA,NA,NA,NA,NA,NA,NA,NA,NA,NA,NA,NA,NA,NA,NA,NA,NA,NA,NA,NA,NA,NA,NA,NA,NA,NA,NA,NA,NA,NA,NA,NA,NA,NA,NA,NA,NA,NA,NA,NA,NA,NA
NA,NA,NA,NA,NA,NA,NA,NA,NA,NA,NA,NA,NA,NA,NA,NA,NA,NA,NA,NA,NA,NA,NA,NA,NA,NA,NA,NA,NA,NA,NA,NA,NA,NA,NA,NA,NA,NA,NA,NA,NA,NA,NA,NA,NA,NA,NA,NA,NA,NA,NA,NA,NA,NA,NA
NA,NA,NA,NA,NA,NA,NA,NA,NA,NA,NA,NA,NA,NA,NA,NA,NA,NA,NA,NA,NA,NA,NA,NA,NA,NA,NA,NA,NA,NA,NA,NA,NA,NA,NA,NA,NA,NA,NA,NA,NA,NA,NA,NA,NA,NA,NA,NA,NA,NA,NA,NA,NA,NA,NA
NA,NA,NA,NA,NA,NA,NA,NA,NA,NA,NA,NA,NA,NA,NA,NA,NA,NA,NA,NA,NA,NA,NA,NA,NA,NA,NA,NA,NA,NA,NA,NA,NA,NA,NA,NA,NA,NA,NA,NA,NA,NA,NA,NA,NA,NA,NA,NA,NA,NA,NA,NA,NA,NA,NA
NA,NA,NA,NA,NA,NA,NA,NA,NA,NA,NA,NA,NA,NA,NA,NA,NA,NA,NA,NA,NA,NA,NA,NA,NA,NA,NA,NA,NA,NA,NA,NA,NA,NA,NA,NA,NA,NA,NA,NA,NA,NA,NA,NA,NA,NA,NA,NA,NA,NA,NA,NA,NA,NA,NA
NA,NA,NA,NA,NA,NA,NA,NA,NA,NA,NA,NA,NA,NA,NA,NA,NA,NA,NA,NA,NA,NA,NA,NA,NA,NA,NA,NA,NA,NA,NA,NA,NA,NA,NA,NA,NA,NA,NA,NA,NA,NA,NA,NA,NA,NA,NA,NA,NA,NA,NA,NA,NA,NA,NA
NA,NA,NA,NA,NA,NA,NA,NA,NA,NA,NA,NA,NA,NA,NA,NA,NA,NA,NA,NA,NA,NA,NA,NA,NA,NA,NA,NA,NA,NA,NA,NA,NA,NA,NA,NA,NA,NA,NA,NA,NA,NA,NA,NA,NA,NA,NA,NA,NA,NA,NA,NA,NA,NA,NA
NA,NA,NA,NA,NA,NA,NA,NA,NA,NA,NA,NA,NA,NA,NA,NA,NA,NA,NA,NA,NA,NA,NA,NA,NA,NA,NA,NA,NA,NA,NA,NA,NA,NA,NA,NA,NA,NA,NA,NA,NA,NA,NA,NA,NA,NA,NA,NA,NA,NA,NA,NA,NA,NA,NA
NA,NA,NA,NA,NA,NA,NA,NA,NA,NA,NA,NA,NA,NA,NA,NA,NA,NA,NA,NA,NA,NA,NA,NA,NA,NA,NA,NA,NA,NA,NA,NA,NA,NA,NA,NA,NA,NA,NA,NA,NA,NA,NA,NA,NA,NA,NA,NA,NA,NA,NA,NA,NA,NA,NA
NA,NA,NA,NA,NA,NA,NA,NA,NA,NA,NA,NA,NA,NA,NA,NA,NA,NA,NA,NA,NA,NA,NA,NA,NA,NA,NA,NA,NA,NA,NA,NA,NA,NA,NA,NA,NA,NA,NA,NA,NA,NA,NA,NA,NA,NA,NA,NA,NA,NA,NA,NA,NA,NA,NA
NA,NA,NA,NA,NA,NA,NA,NA,NA,NA,NA,NA,NA,NA,NA,NA,NA,NA,NA,NA,NA,NA,NA,NA,NA,NA,NA,NA,NA,NA,NA,NA,NA,NA,NA,NA,NA,NA,NA,NA,NA,NA,NA,NA,NA,NA,NA,NA,NA,NA,NA,NA,NA,NA,NA
NA,NA,NA,NA,NA,NA,NA,NA,NA,NA,NA,NA,NA,NA,NA,NA,NA,NA,NA,NA,NA,NA,NA,NA,NA,NA,NA,NA,NA,NA,NA,NA,NA,NA,NA,NA,NA,NA,NA,NA,NA,NA,NA,NA,NA,NA,NA,NA,NA,NA,NA,NA,NA,NA,NA
NA,NA,NA,NA,NA,NA,NA,NA,NA,NA,NA,NA,NA,NA,NA,NA,NA,NA,NA,NA,NA,NA,NA,NA,NA,NA,NA,NA,NA,NA,NA,NA,NA,NA,NA,NA,NA,NA,NA,NA,NA,NA,NA,NA,NA,NA,NA,NA,NA,NA,NA,NA,NA,NA,NA
NA,NA,NA,NA,NA,NA,NA,NA,NA,NA,NA,NA,NA,NA,NA,NA,NA,NA,NA,NA,NA,NA,NA,NA,NA,NA,NA,NA,NA,NA,NA,NA,NA,NA,NA,NA,NA,NA,NA,NA,NA,NA,NA,NA,NA,NA,NA,NA,NA,NA,NA,NA,NA,NA,NA
NA,NA,NA,NA,NA,NA,NA,NA,NA,NA,NA,NA,NA,NA,NA,NA,NA,NA,NA,NA,NA,NA,NA,NA,NA,NA,NA,NA,NA,NA,NA,NA,NA,NA,NA,NA,NA,NA,NA,NA,NA,NA,NA,NA,NA,NA,NA,NA,NA,NA,NA,NA,NA,NA,NA
NA,NA,NA,NA,NA,NA,NA,NA,NA,NA,NA,NA,NA,NA,NA,NA,NA,NA,NA,NA,NA,NA,NA,NA,NA,NA,NA,NA,NA,NA,NA,NA,NA,NA,NA,NA,NA,NA,NA,NA,NA,NA,NA,NA,NA,NA,NA,NA,NA,NA,NA,NA,NA,NA,NA
NA,NA,NA,NA,NA,NA,NA,NA,NA,NA,NA,NA,NA,NA,NA,NA,NA,NA,NA,NA,NA,NA,NA,NA,NA,NA,NA,NA,NA,NA,NA,NA,NA,NA,NA,NA,NA,NA,NA,NA,NA,NA,NA,NA,NA,NA,NA,NA,NA,NA,NA,NA,NA,NA,NA
NA,NA,NA,NA,NA,NA,NA,NA,NA,NA,NA,NA,NA,NA,NA,NA,NA,NA,NA,NA,NA,NA,NA,NA,NA,NA,NA,NA,NA,NA,NA,NA,NA,NA,NA,NA,NA,NA,NA,NA,NA,NA,NA,NA,NA,NA,NA,NA,NA,NA,NA,NA,NA,NA,NA
NA,NA,NA,NA,NA,NA,NA,NA,NA,NA,NA,NA,NA,NA,NA,NA,NA,NA,NA,NA,NA,NA,NA,NA,NA,NA,NA,NA,NA,NA,NA,NA,NA,NA,NA,NA,NA,NA,NA,NA,NA,NA,NA,NA,NA,NA,NA,NA,NA,NA,NA,NA,NA,NA,NA
NA,NA,NA,NA,NA,NA,NA,NA,NA,NA,NA,NA,NA,NA,NA,NA,NA,NA,NA,NA,NA,NA,NA,NA,NA,NA,NA,NA,NA,NA,NA,NA,NA,NA,NA,NA,NA,NA,NA,NA,NA,NA,NA,NA,NA,NA,NA,NA,NA,NA,NA,NA,NA,NA,NA
NA,NA,NA,NA,NA,NA,NA,NA,NA,NA,NA,NA,NA,NA,NA,NA,NA,NA,NA,NA,NA,NA,NA,NA,NA,NA,NA,NA,NA,NA,NA,NA,NA,NA,NA,NA,NA,NA,NA,NA,NA,NA,NA,NA,NA,NA,NA,NA,NA,NA,NA,NA,NA,NA,NA
NA,NA,NA,NA,NA,NA,NA,NA,NA,NA,NA,NA,NA,NA,NA,NA,NA,NA,NA,NA,NA,NA,NA,NA,NA,NA,NA,NA,NA,NA,NA,NA,NA,NA,NA,NA,NA,NA,NA,NA,NA,NA,NA,NA,NA,NA,NA,NA,NA,NA,NA,NA,NA,NA,NA
NA,NA,NA,NA,NA,NA,NA,NA,NA,NA,NA,NA,NA,NA,NA,NA,NA,NA,NA,NA,NA,NA,NA,NA,NA,NA,NA,NA,NA,NA,NA,NA,NA,NA,NA,NA,NA,NA,NA,NA,NA,NA,NA,NA,NA,NA,NA,NA,NA,NA,NA,NA,NA,NA,NA
NA,NA,NA,NA,NA,NA,NA,NA,NA,NA,NA,NA,NA,NA,NA,NA,NA,NA,NA,NA,NA,NA,NA,NA,NA,NA,NA,NA,NA,NA,NA,NA,NA,NA,NA,NA,NA,NA,NA,NA,NA,NA,NA,NA,NA,NA,NA,NA,NA,NA,NA,NA,NA,NA,NA
NA,NA,NA,NA,NA,NA,NA,NA,NA,NA,NA,NA,NA,NA,NA,NA,NA,NA,NA,NA,NA,NA,NA,NA,NA,NA,NA,NA,NA,NA,NA,NA,NA,NA,NA,NA,NA,NA,NA,NA,NA,NA,NA,NA,NA,NA,NA,NA,NA,NA,NA,NA,NA,NA,NA
NA,NA,NA,NA,NA,NA,NA,NA,NA,NA,NA,NA,NA,NA,NA,NA,NA,NA,NA,NA,NA,NA,NA,NA,NA,NA,NA,NA,NA,NA,NA,NA,NA,NA,NA,NA,NA,NA,NA,NA,NA,NA,NA,NA,NA,NA,NA,NA,NA,NA,NA,NA,NA,NA,NA
NA,NA,NA,NA,NA,NA,NA,NA,NA,NA,NA,NA,NA,NA,NA,NA,NA,NA,NA,NA,NA,NA,NA,NA,NA,NA,NA,NA,NA,NA,NA,NA,NA,NA,NA,NA,NA,NA,NA,NA,NA,NA,NA,NA,NA,NA,NA,NA,NA,NA,NA,NA,NA,NA,NA
NA,NA,NA,NA,NA,NA,NA,NA,NA,NA,NA,NA,NA,NA,NA,NA,NA,NA,NA,NA,NA,NA,NA,NA,NA,NA,NA,NA,NA,NA,NA,NA,NA,NA,NA,NA,NA,NA,NA,NA,NA,NA,NA,NA,NA,NA,NA,NA,NA,NA,NA,NA,NA,NA,NA
NA,NA,NA,NA,NA,NA,NA,NA,NA,NA,NA,NA,NA,NA,NA,NA,NA,NA,NA,NA,NA,NA,NA,NA,NA,NA,NA,NA,NA,NA,NA,NA,NA,NA,NA,NA,NA,NA,NA,NA,NA,NA,NA,NA,NA,NA,NA,NA,NA,NA,NA,NA,NA,NA,NA
NA,NA,NA,NA,NA,NA,NA,NA,NA,NA,NA,NA,NA,NA,NA,NA,NA,NA,NA,NA,NA,NA,NA,NA,NA,NA,NA,NA,NA,NA,NA,NA,NA,NA,NA,NA,NA,NA,NA,NA,NA,NA,NA,NA,NA,NA,NA,NA,NA,NA,NA,NA,NA,NA,NA
NA,NA,NA,NA,NA,NA,NA,NA,NA,NA,NA,NA,NA,NA,NA,NA,NA,NA,NA,NA,NA,NA,NA,NA,NA,NA,NA,NA,NA,NA,NA,NA,NA,NA,NA,NA,NA,NA,NA,NA,NA,NA,NA,NA,NA,NA,NA,NA,NA,NA,NA,NA,NA,NA,NA
NA,NA,NA,NA,NA,NA,NA,NA,NA,NA,NA,NA,NA,NA,NA,NA,NA,NA,NA,NA,NA,NA,NA,NA,NA,NA,NA,NA,NA,NA,NA,NA,NA,NA,NA,NA,NA,NA,NA,NA,NA,NA,NA,NA,NA,NA,NA,NA,NA,NA,NA,NA,NA,NA,NA
NA,NA,NA,NA,NA,NA,NA,NA,NA,NA,NA,NA,NA,NA,NA,NA,NA,NA,NA,NA,NA,NA,NA,NA,NA,NA,NA,NA,NA,NA,NA,NA,NA,NA,NA,NA,NA,NA,NA,NA,NA,NA,NA,NA,NA,NA,NA,NA,NA,NA,NA,NA,NA,NA,NA
NA,NA,NA,NA,NA,NA,NA,NA,NA,NA,NA,NA,NA,NA,NA,NA,NA,NA,NA,NA,NA,NA,NA,NA,NA,NA,NA,NA,NA,NA,NA,NA,NA,NA,NA,NA,NA,NA,NA,NA,NA,NA,NA,NA,NA,NA,NA,NA,NA,NA,NA,NA,NA,NA,NA
NA,NA,NA,NA,NA,NA,NA,NA,NA,NA,NA,NA,NA,NA,NA,NA,NA,NA,NA,NA,NA,NA,NA,NA,NA,NA,NA,NA,NA,NA,NA,NA,NA,NA,NA,NA,NA,NA,NA,NA,NA,NA,NA,NA,NA,NA,NA,NA,NA,NA,NA,NA,NA,NA,NA
NA,NA,NA,NA,NA,NA,NA,NA,NA,NA,NA,NA,NA,NA,NA,NA,NA,NA,NA,NA,NA,NA,NA,NA,NA,NA,NA,NA,NA,NA,NA,NA,NA,NA,NA,NA,NA,NA,NA,NA,NA,NA,NA,NA,NA,NA,NA,NA,NA,NA,NA,NA,NA,NA,NA
NA,NA,NA,NA,NA,NA,NA,NA,NA,NA,NA,NA,NA,NA,NA,NA,NA,NA,NA,NA,NA,NA,NA,NA,NA,NA,NA,NA,NA,NA,NA,NA,NA,NA,NA,NA,NA,NA,NA,NA,NA,NA,NA,NA,NA,NA,NA,NA,NA,NA,NA,NA,NA,NA,NA
NA,NA,NA,NA,NA,NA,NA,NA,NA,NA,NA,NA,NA,NA,NA,NA,NA,NA,NA,NA,NA,NA,NA,NA,NA,NA,NA,NA,NA,NA,NA,NA,NA,NA,NA,NA,NA,NA,NA,NA,NA,NA,NA,NA,NA,NA,NA,NA,NA,NA,NA,NA,NA,NA,NA
NA,NA,NA,NA,NA,NA,NA,NA,NA,NA,NA,NA,NA,NA,NA,NA,NA,NA,NA,NA,NA,NA,NA,NA,NA,NA,NA,NA,NA,NA,NA,NA,NA,NA,NA,NA,NA,NA,NA,NA,NA,NA,NA,NA,NA,NA,NA,NA,NA,NA,NA,NA,NA,NA,NA
NA,NA,NA,NA,NA,NA,NA,NA,NA,NA,NA,NA,NA,NA,NA,NA,NA,NA,NA,NA,NA,NA,NA,NA,NA,NA,NA,NA,NA,NA,NA,NA,NA,NA,NA,NA,NA,NA,NA,NA,NA,NA,NA,NA,NA,NA,NA,NA,NA,NA,NA,NA,NA,NA,NA
NA,NA,NA,NA,NA,NA,NA,NA,NA,NA,NA,NA,NA,NA,NA,NA,NA,NA,NA,NA,NA,NA,NA,NA,NA,NA,NA,NA,NA,NA,NA,NA,NA,NA,NA,NA,NA,NA,NA,NA,NA,NA,NA,NA,NA,NA,NA,NA,NA,NA,NA,NA,NA,NA,NA
NA,NA,NA,NA,NA,NA,NA,NA,NA,NA,NA,NA,NA,NA,NA,NA,NA,NA,NA,NA,NA,NA,NA,NA,NA,NA,NA,NA,NA,NA,NA,NA,NA,NA,NA,NA,NA,NA,NA,NA,NA,NA,NA,NA,NA,NA,NA,NA,NA,NA,NA,NA,NA,NA,NA
NA,NA,NA,NA,NA,NA,NA,NA,NA,NA,NA,NA,NA,NA,NA,NA,NA,NA,NA,NA,NA,NA,NA,NA,NA,NA,NA,NA,NA,NA,NA,NA,NA,NA,NA,NA,NA,NA,NA,NA,NA,NA,NA,NA,NA,NA,NA,NA,NA,NA,NA,NA,NA,NA,NA
NA,NA,NA,NA,NA,NA,NA,NA,NA,NA,NA,NA,NA,NA,NA,NA,NA,NA,NA,NA,NA,NA,NA,NA,NA,NA,NA,NA,NA,NA,NA,NA,NA,NA,NA,NA,NA,NA,NA,NA,NA,NA,NA,NA,NA,NA,NA,NA,NA,NA,NA,NA,NA,NA,NA
NA,NA,NA,NA,NA,NA,NA,NA,NA,NA,NA,NA,NA,NA,NA,NA,NA,NA,NA,NA,NA,NA,NA,NA,NA,NA,NA,NA,NA,NA,NA,NA,NA,NA,NA,NA,NA,NA,NA,NA,NA,NA,NA,NA,NA,NA,NA,NA,NA,NA,NA,NA,NA,NA,NA
NA,NA,NA,NA,NA,NA,NA,NA,NA,NA,NA,NA,NA,NA,NA,NA,NA,NA,NA,NA,NA,NA,NA,NA,NA,NA,NA,NA,NA,NA,NA,NA,NA,NA,NA,NA,NA,NA,NA,NA,NA,NA,NA,NA,NA,NA,NA,NA,NA,NA,NA,NA,NA,NA,NA
NA,NA,NA,NA,NA,NA,NA,NA,NA,NA,NA,NA,NA,NA,NA,NA,NA,NA,NA,NA,NA,NA,NA,NA,NA,NA,NA,NA,NA,NA,NA,NA,NA,NA,NA,NA,NA,NA,NA,NA,NA,NA,NA,NA,NA,NA,NA,NA,NA,NA,NA,NA,NA,NA,NA
NA,NA,NA,NA,NA,NA,NA,NA,NA,NA,NA,NA,NA,NA,NA,NA,NA,NA,NA,NA,NA,NA,NA,NA,NA,NA,NA,NA,NA,NA,NA,NA,NA,NA,NA,NA,NA,NA,NA,NA,NA,NA,NA,NA,NA,NA,NA,NA,NA,NA,NA,NA,NA,NA,NA
NA,NA,NA,NA,NA,NA,NA,NA,NA,NA,NA,NA,NA,NA,NA,NA,NA,NA,NA,NA,NA,NA,NA,NA,NA,NA,NA,NA,NA,NA,NA,NA,NA,NA,NA,NA,NA,NA,NA,NA,NA,NA,NA,NA,NA,NA,NA,NA,NA,NA,NA,NA,NA,NA,NA
NA,NA,NA,NA,NA,NA,NA,NA,NA,NA,NA,NA,NA,NA,NA,NA,NA,NA,NA,NA,NA,NA,NA,NA,NA,NA,NA,NA,NA,NA,NA,NA,NA,NA,NA,NA,NA,NA,NA,NA,NA,NA,NA,NA,NA,NA,NA,NA,NA,NA,NA,NA,NA,NA,NA
NA,NA,NA,NA,NA,NA,NA,NA,NA,NA,NA,NA,NA,NA,NA,NA,NA,NA,NA,NA,NA,NA,NA,NA,NA,NA,NA,NA,NA,NA,NA,NA,NA,NA,NA,NA,NA,NA,NA,NA,NA,NA,NA,NA,NA,NA,NA,NA,NA,NA,NA,NA,NA,NA,NA
NA,NA,NA,NA,NA,NA,NA,NA,NA,NA,NA,NA,NA,NA,NA,NA,NA,NA,NA,NA,NA,NA,NA,NA,NA,NA,NA,NA,NA,NA,NA,NA,NA,NA,NA,NA,NA,NA,NA,NA,NA,NA,NA,NA,NA,NA,NA,NA,NA,NA,NA,NA,NA,NA,NA
NA,NA,NA,NA,NA,NA,NA,NA,NA,NA,NA,NA,NA,NA,NA,NA,NA,NA,NA,NA,NA,NA,NA,NA,NA,NA,NA,NA,NA,NA,NA,NA,NA,NA,NA,NA,NA,NA,NA,NA,NA,NA,NA,NA,NA,NA,NA,NA,NA,NA,NA,NA,NA,NA,NA
NA,NA,NA,NA,NA,NA,NA,NA,NA,NA,NA,NA,NA,NA,NA,NA,NA,NA,NA,NA,NA,NA,NA,NA,NA,NA,NA,NA,NA,NA,NA,NA,NA,NA,NA,NA,NA,NA,NA,NA,NA,NA,NA,NA,NA,NA,NA,NA,NA,NA,NA,NA,NA,NA,NA
NA,NA,NA,NA,NA,NA,NA,NA,NA,NA,NA,NA,NA,NA,NA,NA,NA,NA,NA,NA,NA,NA,NA,NA,NA,NA,NA,NA,NA,NA,NA,NA,NA,NA,NA,NA,NA,NA,NA,NA,NA,NA,NA,NA,NA,NA,NA,NA,NA,NA,NA,NA,NA,NA,NA
NA,NA,NA,NA,NA,NA,NA,NA,NA,NA,NA,NA,NA,NA,NA,NA,NA,NA,NA,NA,NA,NA,NA,NA,NA,NA,NA,NA,NA,NA,NA,NA,NA,NA,NA,NA,NA,NA,NA,NA,NA,NA,NA,NA,NA,NA,NA,NA,NA,NA,NA,NA,NA,NA,NA
NA,NA,NA,NA,NA,NA,NA,NA,NA,NA,NA,NA,NA,NA,NA,NA,NA,NA,NA,NA,NA,NA,NA,NA,NA,NA,NA,NA,NA,NA,NA,NA,NA,NA,NA,NA,NA,NA,NA,NA,NA,NA,NA,NA,NA,NA,NA,NA,NA,NA,NA,NA,NA,NA,NA
NA,NA,NA,NA,NA,NA,NA,NA,NA,NA,NA,NA,NA,NA,NA,NA,NA,NA,NA,NA,NA,NA,NA,NA,NA,NA,NA,NA,NA,NA,NA,NA,NA,NA,NA,NA,NA,NA,NA,NA,NA,NA,NA,NA,NA,NA,NA,NA,NA,NA,NA,NA,NA,NA,NA
NA,NA,NA,NA,NA,NA,NA,NA,NA,NA,NA,NA,NA,NA,NA,NA,NA,NA,NA,NA,NA,NA,NA,NA,NA,NA,NA,NA,NA,NA,NA,NA,NA,NA,NA,NA,NA,NA,NA,NA,NA,NA,NA,NA,NA,NA,NA,NA,NA,NA,NA,NA,NA,NA,NA
NA,NA,NA,NA,NA,NA,NA,NA,NA,NA,NA,NA,NA,NA,NA,NA,NA,NA,NA,NA,NA,NA,NA,NA,NA,NA,NA,NA,NA,NA,NA,NA,NA,NA,NA,NA,NA,NA,NA,NA,NA,NA,NA,NA,NA,NA,NA,NA,NA,NA,NA,NA,NA,NA,NA
NA,NA,NA,NA,NA,NA,NA,NA,NA,NA,NA,NA,NA,NA,NA,NA,NA,NA,NA,NA,NA,NA,NA,NA,NA,NA,NA,NA,NA,NA,NA,NA,NA,NA,NA,NA,NA,NA,NA,NA,NA,NA,NA,NA,NA,NA,NA,NA,NA,NA,NA,NA,NA,NA,NA
NA,NA,NA,NA,NA,NA,NA,NA,NA,NA,NA,NA,NA,NA,NA,NA,NA,NA,NA,NA,NA,NA,NA,NA,NA,NA,NA,NA,NA,NA,NA,NA,NA,NA,NA,NA,NA,NA,NA,NA,NA,NA,NA,NA,NA,NA,NA,NA,NA,NA,NA,NA,NA,NA,NA
NA,NA,NA,NA,NA,NA,NA,NA,NA,NA,NA,NA,NA,NA,NA,NA,NA,NA,NA,NA,NA,NA,NA,NA,NA,NA,NA,NA,NA,NA,NA,NA,NA,NA,NA,NA,NA,NA,NA,NA,NA,NA,NA,NA,NA,NA,NA,NA,NA,NA,NA,NA,NA,NA,NA
NA,NA,NA,NA,NA,NA,NA,NA,NA,NA,NA,NA,NA,NA,NA,NA,NA,NA,NA,NA,NA,NA,NA,NA,NA,NA,NA,NA,NA,NA,NA,NA,NA,NA,NA,NA,NA,NA,NA,NA,NA,NA,NA,NA,NA,NA,NA,NA,NA,NA,NA,NA,NA,NA,NA
NA,NA,NA,NA,NA,NA,NA,NA,NA,NA,NA,NA,NA,NA,NA,NA,NA,NA,NA,NA,NA,NA,NA,NA,NA,NA,NA,NA,NA,NA,NA,NA,NA,NA,NA,NA,NA,NA,NA,NA,NA,NA,NA,NA,NA,NA,NA,NA,NA,NA,NA,NA,NA,NA,NA
NA,NA,NA,NA,NA,NA,NA,NA,NA,NA,NA,NA,NA,NA,NA,NA,NA,NA,NA,NA,NA,NA,NA,NA,NA,NA,NA,NA,NA,NA,NA,NA,NA,NA,NA,NA,NA,NA,NA,NA,NA,NA,NA,NA,NA,NA,NA,NA,NA,NA,NA,NA,NA,NA,NA
NA,NA,NA,NA,NA,NA,NA,NA,NA,NA,NA,NA,NA,NA,NA,NA,NA,NA,NA,NA,NA,NA,NA,NA,NA,NA,NA,NA,NA,NA,NA,NA,NA,NA,NA,NA,NA,NA,NA,NA,NA,NA,NA,NA,NA,NA,NA,NA,NA,NA,NA,NA,NA,NA,NA
NA,NA,NA,NA,NA,NA,NA,NA,NA,NA,NA,NA,NA,NA,NA,NA,NA,NA,NA,NA,NA,NA,NA,NA,NA,NA,NA,NA,NA,NA,NA,NA,NA,NA,NA,NA,NA,NA,NA,NA,NA,NA,NA,NA,NA,NA,NA,NA,NA,NA,NA,NA,NA,NA,NA
NA,NA,NA,NA,NA,NA,NA,NA,NA,NA,NA,NA,NA,NA,NA,NA,NA,NA,NA,NA,NA,NA,NA,NA,NA,NA,NA,NA,NA,NA,NA,NA,NA,NA,NA,NA,NA,NA,NA,NA,NA,NA,NA,NA,NA,NA,NA,NA,NA,NA,NA,NA,NA,NA,NA
NA,NA,NA,NA,NA,NA,NA,NA,NA,NA,NA,NA,NA,NA,NA,NA,NA,NA,NA,NA,NA,NA,NA,NA,NA,NA,NA,NA,NA,NA,NA,NA,NA,NA,NA,NA,NA,NA,NA,NA,NA,NA,NA,NA,NA,NA,NA,NA,NA,NA,NA,NA,NA,NA,NA
NA,NA,NA,NA,NA,NA,NA,NA,NA,NA,NA,NA,NA,NA,NA,NA,NA,NA,NA,NA,NA,NA,NA,NA,NA,NA,NA,NA,NA,NA,NA,NA,NA,NA,NA,NA,NA,NA,NA,NA,NA,NA,NA,NA,NA,NA,NA,NA,NA,NA,NA,NA,NA,NA,NA
NA,NA,NA,NA,NA,NA,NA,NA,NA,NA,NA,NA,NA,NA,NA,NA,NA,NA,NA,NA,NA,NA,NA,NA,NA,NA,NA,NA,NA,NA,NA,NA,NA,NA,NA,NA,NA,NA,NA,NA,NA,NA,NA,NA,NA,NA,NA,NA,NA,NA,NA,NA,NA,NA,NA
NA,NA,NA,NA,NA,NA,NA,NA,NA,NA,NA,NA,NA,NA,NA,NA,NA,NA,NA,NA,NA,NA,NA,NA,NA,NA,NA,NA,NA,NA,NA,NA,NA,NA,NA,NA,NA,NA,NA,NA,NA,NA,NA,NA,NA,NA,NA,NA,NA,NA,NA,NA,NA,NA,NA
NA,NA,NA,NA,NA,NA,NA,NA,NA,NA,NA,NA,NA,NA,NA,NA,NA,NA,NA,NA,NA,NA,NA,NA,NA,NA,NA,NA,NA,NA,NA,NA,NA,NA,NA,NA,NA,NA,NA,NA,NA,NA,NA,NA,NA,NA,NA,NA,NA,NA,NA,NA,NA,NA,NA
NA,NA,NA,NA,NA,NA,NA,NA,NA,NA,NA,NA,NA,NA,NA,NA,NA,NA,NA,NA,NA,NA,NA,NA,NA,NA,NA,NA,NA,NA,NA,NA,NA,NA,NA,NA,NA,NA,NA,NA,NA,NA,NA,NA,NA,NA,NA,NA,NA,NA,NA,NA,NA,NA,NA
NA,NA,NA,NA,NA,NA,NA,NA,NA,NA,NA,NA,NA,NA,NA,NA,NA,NA,NA,NA,NA,NA,NA,NA,NA,NA,NA,NA,NA,NA,NA,NA,NA,NA,NA,NA,NA,NA,NA,NA,NA,NA,NA,NA,NA,NA,NA,NA,NA,NA,NA,NA,NA,NA,NA
NA,NA,NA,NA,NA,NA,NA,NA,NA,NA,NA,NA,NA,NA,NA,NA,NA,NA,NA,NA,NA,NA,NA,NA,NA,NA,NA,NA,NA,NA,NA,NA,NA,NA,NA,NA,NA,NA,NA,NA,NA,NA,NA,NA,NA,NA,NA,NA,NA,NA,NA,NA,NA,NA,NA
NA,NA,NA,NA,NA,NA,NA,NA,NA,NA,NA,NA,NA,NA,NA,NA,NA,NA,NA,NA,NA,NA,NA,NA,NA,NA,NA,NA,NA,NA,NA,NA,NA,NA,NA,NA,NA,NA,NA,NA,NA,NA,NA,NA,NA,NA,NA,NA,NA,NA,NA,NA,NA,NA,NA
NA,NA,NA,NA,NA,NA,NA,NA,NA,NA,NA,NA,NA,NA,NA,NA,NA,NA,NA,NA,NA,NA,NA,NA,NA,NA,NA,NA,NA,NA,NA,NA,NA,NA,NA,NA,NA,NA,NA,NA,NA,NA,NA,NA,NA,NA,NA,NA,NA,NA,NA,NA,NA,NA,NA
NA,NA,NA,NA,NA,NA,NA,NA,NA,NA,NA,NA,NA,NA,NA,NA,NA,NA,NA,NA,NA,NA,NA,NA,NA,NA,NA,NA,NA,NA,NA,NA,NA,NA,NA,NA,NA,NA,NA,NA,NA,NA,NA,NA,NA,NA,NA,NA,NA,NA,NA,NA,NA,NA,NA
NA,NA,NA,NA,NA,NA,NA,NA,NA,NA,NA,NA,NA,NA,NA,NA,NA,NA,NA,NA,NA,NA,NA,NA,NA,NA,NA,NA,NA,NA,NA,NA,NA,NA,NA,NA,NA,NA,NA,NA,NA,NA,NA,NA,NA,NA,NA,NA,NA,NA,NA,NA,NA,NA,NA
NA,NA,NA,NA,NA,NA,NA,NA,NA,NA,NA,NA,NA,NA,NA,NA,NA,NA,NA,NA,NA,NA,NA,NA,NA,NA,NA,NA,NA,NA,NA,NA,NA,NA,NA,NA,NA,NA,NA,NA,NA,NA,NA,NA,NA,NA,NA,NA,NA,NA,NA,NA,NA,NA,NA
NA,NA,NA,NA,NA,NA,NA,NA,NA,NA,NA,NA,NA,NA,NA,NA,NA,NA,NA,NA,NA,NA,NA,NA,NA,NA,NA,NA,NA,NA,NA,NA,NA,NA,NA,NA,NA,NA,NA,NA,NA,NA,NA,NA,NA,NA,NA,NA,NA,NA,NA,NA,NA,NA,NA
NA,NA,NA,NA,NA,NA,NA,NA,NA,NA,NA,NA,NA,NA,NA,NA,NA,NA,NA,NA,NA,NA,NA,NA,NA,NA,NA,NA,NA,NA,NA,NA,NA,NA,NA,NA,NA,NA,NA,NA,NA,NA,NA,NA,NA,NA,NA,NA,NA,NA,NA,NA,NA,NA,NA
NA,NA,NA,NA,NA,NA,NA,NA,NA,NA,NA,NA,NA,NA,NA,NA,NA,NA,NA,NA,NA,NA,NA,NA,NA,NA,NA,NA,NA,NA,NA,NA,NA,NA,NA,NA,NA,NA,NA,NA,NA,NA,NA,NA,NA,NA,NA,NA,NA,NA,NA,NA,NA,NA,NA
NA,NA,NA,NA,NA,NA,NA,NA,NA,NA,NA,NA,NA,NA,NA,NA,NA,NA,NA,NA,NA,NA,NA,NA,NA,NA,NA,NA,NA,NA,NA,NA,NA,NA,NA,NA,NA,NA,NA,NA,NA,NA,NA,NA,NA,NA,NA,NA,NA,NA,NA,NA,NA,NA,NA
NA,NA,NA,NA,NA,NA,NA,NA,NA,NA,NA,NA,NA,NA,NA,NA,NA,NA,NA,NA,NA,NA,NA,NA,NA,NA,NA,NA,NA,NA,NA,NA,NA,NA,NA,NA,NA,NA,NA,NA,NA,NA,NA,NA,NA,NA,NA,NA,NA,NA,NA,NA,NA,NA,NA
NA,NA,NA,NA,NA,NA,NA,NA,NA,NA,NA,NA,NA,NA,NA,NA,NA,NA,NA,NA,NA,NA,NA,NA,NA,NA,NA,NA,NA,NA,NA,NA,NA,NA,NA,NA,NA,NA,NA,NA,NA,NA,NA,NA,NA,NA,NA,NA,NA,NA,NA,NA,NA,NA,NA
NA,NA,NA,NA,NA,NA,NA,NA,NA,NA,NA,NA,NA,NA,NA,NA,NA,NA,NA,NA,NA,NA,NA,NA,NA,NA,NA,NA,NA,NA,NA,NA,NA,NA,NA,NA,NA,NA,NA,NA,NA,NA,NA,NA,NA,NA,NA,NA,NA,NA,NA,NA,NA,NA,NA
NA,NA,NA,NA,NA,NA,NA,NA,NA,NA,NA,NA,NA,NA,NA,NA,NA,NA,NA,NA,NA,NA,NA,NA,NA,NA,NA,NA,NA,NA,NA,NA,NA,NA,NA,NA,NA,NA,NA,NA,NA,NA,NA,NA,NA,NA,NA,NA,NA,NA,NA,NA,NA,NA,NA
NA,NA,NA,NA,NA,NA,NA,NA,NA,NA,NA,NA,NA,NA,NA,NA,NA,NA,NA,NA,NA,NA,NA,NA,NA,NA,NA,NA,NA,NA,NA,NA,NA,NA,NA,NA,NA,NA,NA,NA,NA,NA,NA,NA,NA,NA,NA,NA,NA,NA,NA,NA,NA,NA,NA
NA,NA,NA,NA,NA,NA,NA,NA,NA,NA,NA,NA,NA,NA,NA,NA,NA,NA,NA,NA,NA,NA,NA,NA,NA,NA,NA,NA,NA,NA,NA,NA,NA,NA,NA,NA,NA,NA,NA,NA,NA,NA,NA,NA,NA,NA,NA,NA,NA,NA,NA,NA,NA,NA,NA
NA,NA,NA,NA,NA,NA,NA,NA,NA,NA,NA,NA,NA,NA,NA,NA,NA,NA,NA,NA,NA,NA,NA,NA,NA,NA,NA,NA,NA,NA,NA,NA,NA,NA,NA,NA,NA,NA,NA,NA,NA,NA,NA,NA,NA,NA,NA,NA,NA,NA,NA,NA,NA,NA,NA
NA,NA,NA,NA,NA,NA,NA,NA,NA,NA,NA,NA,NA,NA,NA,NA,NA,NA,NA,NA,NA,NA,NA,NA,NA,NA,NA,NA,NA,NA,NA,NA,NA,NA,NA,NA,NA,NA,NA,NA,NA,NA,NA,NA,NA,NA,NA,NA,NA,NA,NA,NA,NA,NA,NA
NA,NA,NA,NA,NA,NA,NA,NA,NA,NA,NA,NA,NA,NA,NA,NA,NA,NA,NA,NA,NA,NA,NA,NA,NA,NA,NA,NA,NA,NA,NA,NA,NA,NA,NA,NA,NA,NA,NA,NA,NA,NA,NA,NA,NA,NA,NA,NA,NA,NA,NA,NA,NA,NA,NA
NA,NA,NA,NA,NA,NA,NA,NA,NA,NA,NA,NA,NA,NA,NA,NA,NA,NA,NA,NA,NA,NA,NA,NA,NA,NA,NA,NA,NA,NA,NA,NA,NA,NA,NA,NA,NA,NA,NA,NA,NA,NA,NA,NA,NA,NA,NA,NA,NA,NA,NA,NA,NA,NA,NA
NA,NA,NA,NA,NA,NA,NA,NA,NA,NA,NA,NA,NA,NA,NA,NA,NA,NA,NA,NA,NA,NA,NA,NA,NA,NA,NA,NA,NA,NA,NA,NA,NA,NA,NA,NA,NA,NA,NA,NA,NA,NA,NA,NA,NA,NA,NA,NA,NA,NA,NA,NA,NA,NA,NA
NA,NA,NA,NA,NA,NA,NA,NA,NA,NA,NA,NA,NA,NA,NA,NA,NA,NA,NA,NA,NA,NA,NA,NA,NA,NA,NA,NA,NA,NA,NA,NA,NA,NA,NA,NA,NA,NA,NA,NA,NA,NA,NA,NA,NA,NA,NA,NA,NA,NA,NA,NA,NA,NA,NA
NA,NA,NA,NA,NA,NA,NA,NA,NA,NA,NA,NA,NA,NA,NA,NA,NA,NA,NA,NA,NA,NA,NA,NA,NA,NA,NA,NA,NA,NA,NA,NA,NA,NA,NA,NA,NA,NA,NA,NA,NA,NA,NA,NA,NA,NA,NA,NA,NA,NA,NA,NA,NA,NA,NA
NA,NA,NA,NA,NA,NA,NA,NA,NA,NA,NA,NA,NA,NA,NA,NA,NA,NA,NA,NA,NA,NA,NA,NA,NA,NA,NA,NA,NA,NA,NA,NA,NA,NA,NA,NA,NA,NA,NA,NA,NA,NA,NA,NA,NA,NA,NA,NA,NA,NA,NA,NA,NA,NA,NA
NA,NA,NA,NA,NA,NA,NA,NA,NA,NA,NA,NA,NA,NA,NA,NA,NA,NA,NA,NA,NA,NA,NA,NA,NA,NA,NA,NA,NA,NA,NA,NA,NA,NA,NA,NA,NA,NA,NA,NA,NA,NA,NA,NA,NA,NA,NA,NA,NA,NA,NA,NA,NA,NA,NA
NA,NA,NA,NA,NA,NA,NA,NA,NA,NA,NA,NA,NA,NA,NA,NA,NA,NA,NA,NA,NA,NA,NA,NA,NA,NA,NA,NA,NA,NA,NA,NA,NA,NA,NA,NA,NA,NA,NA,NA,NA,NA,NA,NA,NA,NA,NA,NA,NA,NA,NA,NA,NA,NA,NA
NA,NA,NA,NA,NA,NA,NA,NA,NA,NA,NA,NA,NA,NA,NA,NA,NA,NA,NA,NA,NA,NA,NA,NA,NA,NA,NA,NA,NA,NA,NA,NA,NA,NA,NA,NA,NA,NA,NA,NA,NA,NA,NA,NA,NA,NA,NA,NA,NA,NA,NA,NA,NA,NA,NA
NA,NA,NA,NA,NA,NA,NA,NA,NA,NA,NA,NA,NA,NA,NA,NA,NA,NA,NA,NA,NA,NA,NA,NA,NA,NA,NA,NA,NA,NA,NA,NA,NA,NA,NA,NA,NA,NA,NA,NA,NA,NA,NA,NA,NA,NA,NA,NA,NA,NA,NA,NA,NA,NA,NA
NA,NA,NA,NA,NA,NA,NA,NA,NA,NA,NA,NA,NA,NA,NA,NA,NA,NA,NA,NA,NA,NA,NA,NA,NA,NA,NA,NA,NA,NA,NA,NA,NA,NA,NA,NA,NA,NA,NA,NA,NA,NA,NA,NA,NA,NA,NA,NA,NA,NA,NA,NA,NA,NA,NA
NA,NA,NA,NA,NA,NA,NA,NA,NA,NA,NA,NA,NA,NA,NA,NA,NA,NA,NA,NA,NA,NA,NA,NA,NA,NA,NA,NA,NA,NA,NA,NA,NA,NA,NA,NA,NA,NA,NA,NA,NA,NA,NA,NA,NA,NA,NA,NA,NA,NA,NA,NA,NA,NA,NA
NA,NA,NA,NA,NA,NA,NA,NA,NA,NA,NA,NA,NA,NA,NA,NA,NA,NA,NA,NA,NA,NA,NA,NA,NA,NA,NA,NA,NA,NA,NA,NA,NA,NA,NA,NA,NA,NA,NA,NA,NA,NA,NA,NA,NA,NA,NA,NA,NA,NA,NA,NA,NA,NA,NA
NA,NA,NA,NA,NA,NA,NA,NA,NA,NA,NA,NA,NA,NA,NA,NA,NA,NA,NA,NA,NA,NA,NA,NA,NA,NA,NA,NA,NA,NA,NA,NA,NA,NA,NA,NA,NA,NA,NA,NA,NA,NA,NA,NA,NA,NA,NA,NA,NA,NA,NA,NA,NA,NA,NA
NA,NA,NA,NA,NA,NA,NA,NA,NA,NA,NA,NA,NA,NA,NA,NA,NA,NA,NA,NA,NA,NA,NA,NA,NA,NA,NA,NA,NA,NA,NA,NA,NA,NA,NA,NA,NA,NA,NA,NA,NA,NA,NA,NA,NA,NA,NA,NA,NA,NA,NA,NA,NA,NA,NA
NA,NA,NA,NA,NA,NA,NA,NA,NA,NA,NA,NA,NA,NA,NA,NA,NA,NA,NA,NA,NA,NA,NA,NA,NA,NA,NA,NA,NA,NA,NA,NA,NA,NA,NA,NA,NA,NA,NA,NA,NA,NA,NA,NA,NA,NA,NA,NA,NA,NA,NA,NA,NA,NA,NA
NA,NA,NA,NA,NA,NA,NA,NA,NA,NA,NA,NA,NA,NA,NA,NA,NA,NA,NA,NA,NA,NA,NA,NA,NA,NA,NA,NA,NA,NA,NA,NA,NA,NA,NA,NA,NA,NA,NA,NA,NA,NA,NA,NA,NA,NA,NA,NA,NA,NA,NA,NA,NA,NA,NA
NA,NA,NA,NA,NA,NA,NA,NA,NA,NA,NA,NA,NA,NA,NA,NA,NA,NA,NA,NA,NA,NA,NA,NA,NA,NA,NA,NA,NA,NA,NA,NA,NA,NA,NA,NA,NA,NA,NA,NA,NA,NA,NA,NA,NA,NA,NA,NA,NA,NA,NA,NA,NA,NA,NA
NA,NA,NA,NA,NA,NA,NA,NA,NA,NA,NA,NA,NA,NA,NA,NA,NA,NA,NA,NA,NA,NA,NA,NA,NA,NA,NA,NA,NA,NA,NA,NA,NA,NA,NA,NA,NA,NA,NA,NA,NA,NA,NA,NA,NA,NA,NA,NA,NA,NA,NA,NA,NA,NA,NA
NA,NA,NA,NA,NA,NA,NA,NA,NA,NA,NA,NA,NA,NA,NA,NA,NA,NA,NA,NA,NA,NA,NA,NA,NA,NA,NA,NA,NA,NA,NA,NA,NA,NA,NA,NA,NA,NA,NA,NA,NA,NA,NA,NA,NA,NA,NA,NA,NA,NA,NA,NA,NA,NA,NA
NA,NA,NA,NA,NA,NA,NA,NA,NA,NA,NA,NA,NA,NA,NA,NA,NA,NA,NA,NA,NA,NA,NA,NA,NA,NA,NA,NA,NA,NA,NA,NA,NA,NA,NA,NA,NA,NA,NA,NA,NA,NA,NA,NA,NA,NA,NA,NA,NA,NA,NA,NA,NA,NA,NA
NA,NA,NA,NA,NA,NA,NA,NA,NA,NA,NA,NA,NA,NA,NA,NA,NA,NA,NA,NA,NA,NA,NA,NA,NA,NA,NA,NA,NA,NA,NA,NA,NA,NA,NA,NA,NA,NA,NA,NA,NA,NA,NA,NA,NA,NA,NA,NA,NA,NA,NA,NA,NA,NA,NA
NA,NA,NA,NA,NA,NA,NA,NA,NA,NA,NA,NA,NA,NA,NA,NA,NA,NA,NA,NA,NA,NA,NA,NA,NA,NA,NA,NA,NA,NA,NA,NA,NA,NA,NA,NA,NA,NA,NA,NA,NA,NA,NA,NA,NA,NA,NA,NA,NA,NA,NA,NA,NA,NA,NA
NA,NA,NA,NA,NA,NA,NA,NA,NA,NA,NA,NA,NA,NA,NA,NA,NA,NA,NA,NA,NA,NA,NA,NA,NA,NA,NA,NA,NA,NA,NA,NA,NA,NA,NA,NA,NA,NA,NA,NA,NA,NA,NA,NA,NA,NA,NA,NA,NA,NA,NA,NA,NA,NA,NA
NA,NA,NA,NA,NA,NA,NA,NA,NA,NA,NA,NA,NA,NA,NA,NA,NA,NA,NA,NA,NA,NA,NA,NA,NA,NA,NA,NA,NA,NA,NA,NA,NA,NA,NA,NA,NA,NA,NA,NA,NA,NA,NA,NA,NA,NA,NA,NA,NA,NA,NA,NA,NA,NA,NA
NA,NA,NA,NA,NA,NA,NA,NA,NA,NA,NA,NA,NA,NA,NA,NA,NA,NA,NA,NA,NA,NA,NA,NA,NA,NA,NA,NA,NA,NA,NA,NA,NA,NA,NA,NA,NA,NA,NA,NA,NA,NA,NA,NA,NA,NA,NA,NA,NA,NA,NA,NA,NA,NA,NA
NA,NA,NA,NA,NA,NA,NA,NA,NA,NA,NA,NA,NA,NA,NA,NA,NA,NA,NA,NA,NA,NA,NA,NA,NA,NA,NA,NA,NA,NA,NA,NA,NA,NA,NA,NA,NA,NA,NA,NA,NA,NA,NA,NA,NA,NA,NA,NA,NA,NA,NA,NA,NA,NA,NA
NA,NA,NA,NA,NA,NA,NA,NA,NA,NA,NA,NA,NA,NA,NA,NA,NA,NA,NA,NA,NA,NA,NA,NA,NA,NA,NA,NA,NA,NA,NA,NA,NA,NA,NA,NA,NA,NA,NA,NA,NA,NA,NA,NA,NA,NA,NA,NA,NA,NA,NA,NA,NA,NA,NA
NA,NA,NA,NA,NA,NA,NA,NA,NA,NA,NA,NA,NA,NA,NA,NA,NA,NA,NA,NA,NA,NA,NA,NA,NA,NA,NA,NA,NA,NA,NA,NA,NA,NA,NA,NA,NA,NA,NA,NA,NA,NA,NA,NA,NA,NA,NA,NA,NA,NA,NA,NA,NA,NA,NA
NA,NA,NA,NA,NA,NA,NA,NA,NA,NA,NA,NA,NA,NA,NA,NA,NA,NA,NA,NA,NA,NA,NA,NA,NA,NA,NA,NA,NA,NA,NA,NA,NA,NA,NA,NA,NA,NA,NA,NA,NA,NA,NA,NA,NA,NA,NA,NA,NA,NA,NA,NA,NA,NA,NA
NA,NA,NA,NA,NA,NA,NA,NA,NA,NA,NA,NA,NA,NA,NA,NA,NA,NA,NA,NA,NA,NA,NA,NA,NA,NA,NA,NA,NA,NA,NA,NA,NA,NA,NA,NA,NA,NA,NA,NA,NA,NA,NA,NA,NA,NA,NA,NA,NA,NA,NA,NA,NA,NA,NA
NA,NA,NA,NA,NA,NA,NA,NA,NA,NA,NA,NA,NA,NA,NA,NA,NA,NA,NA,NA,NA,NA,NA,NA,NA,NA,NA,NA,NA,NA,NA,NA,NA,NA,NA,NA,NA,NA,NA,NA,NA,NA,NA,NA,NA,NA,NA,NA,NA,NA,NA,NA,NA,NA,NA
NA,NA,NA,NA,NA,NA,NA,NA,NA,NA,NA,NA,NA,NA,NA,NA,NA,NA,NA,NA,NA,NA,NA,NA,NA,NA,NA,NA,NA,NA,NA,NA,NA,NA,NA,NA,NA,NA,NA,NA,NA,NA,NA,NA,NA,NA,NA,NA,NA,NA,NA,NA,NA,NA,NA
NA,NA,NA,NA,NA,NA,NA,NA,NA,NA,NA,NA,NA,NA,NA,NA,NA,NA,NA,NA,NA,NA,NA,NA,NA,NA,NA,NA,NA,NA,NA,NA,NA,NA,NA,NA,NA,NA,NA,NA,NA,NA,NA,NA,NA,NA,NA,NA,NA,NA,NA,NA,NA,NA,NA
NA,NA,NA,NA,NA,NA,NA,NA,NA,NA,NA,NA,NA,NA,NA,NA,NA,NA,NA,NA,NA,NA,NA,NA,NA,NA,NA,NA,NA,NA,NA,NA,NA,NA,NA,NA,NA,NA,NA,NA,NA,NA,NA,NA,NA,NA,NA,NA,NA,NA,NA,NA,NA,NA,NA
NA,NA,NA,NA,NA,NA,NA,NA,NA,NA,NA,NA,NA,NA,NA,NA,NA,NA,NA,NA,NA,NA,NA,NA,NA,NA,NA,NA,NA,NA,NA,NA,NA,NA,NA,NA,NA,NA,NA,NA,NA,NA,NA,NA,NA,NA,NA,NA,NA,NA,NA,NA,NA,NA,NA
NA,NA,NA,NA,NA,NA,NA,NA,NA,NA,NA,NA,NA,NA,NA,NA,NA,NA,NA,NA,NA,NA,NA,NA,NA,NA,NA,NA,NA,NA,NA,NA,NA,NA,NA,NA,NA,NA,NA,NA,NA,NA,NA,NA,NA,NA,NA,NA,NA,NA,NA,NA,NA,NA,NA
NA,NA,NA,NA,NA,NA,NA,NA,NA,NA,NA,NA,NA,NA,NA,NA,NA,NA,NA,NA,NA,NA,NA,NA,NA,NA,NA,NA,NA,NA,NA,NA,NA,NA,NA,NA,NA,NA,NA,NA,NA,NA,NA,NA,NA,NA,NA,NA,NA,NA,NA,NA,NA,NA,NA
NA,NA,NA,NA,NA,NA,NA,NA,NA,NA,NA,NA,NA,NA,NA,NA,NA,NA,NA,NA,NA,NA,NA,NA,NA,NA,NA,NA,NA,NA,NA,NA,NA,NA,NA,NA,NA,NA,NA,NA,NA,NA,NA,NA,NA,NA,NA,NA,NA,NA,NA,NA,NA,NA,NA
NA,NA,NA,NA,NA,NA,NA,NA,NA,NA,NA,NA,NA,NA,NA,NA,NA,NA,NA,NA,NA,NA,NA,NA,NA,NA,NA,NA,NA,NA,NA,NA,NA,NA,NA,NA,NA,NA,NA,NA,NA,NA,NA,NA,NA,NA,NA,NA,NA,NA,NA,NA,NA,NA,NA
NA,NA,NA,NA,NA,NA,NA,NA,NA,NA,NA,NA,NA,NA,NA,NA,NA,NA,NA,NA,NA,NA,NA,NA,NA,NA,NA,NA,NA,NA,NA,NA,NA,NA,NA,NA,NA,NA,NA,NA,NA,NA,NA,NA,NA,NA,NA,NA,NA,NA,NA,NA,NA,NA,NA
NA,NA,NA,NA,NA,NA,NA,NA,NA,NA,NA,NA,NA,NA,NA,NA,NA,NA,NA,NA,NA,NA,NA,NA,NA,NA,NA,NA,NA,NA,NA,NA,NA,NA,NA,NA,NA,NA,NA,NA,NA,NA,NA,NA,NA,NA,NA,NA,NA,NA,NA,NA,NA,NA,NA
NA,NA,NA,NA,NA,NA,NA,NA,NA,NA,NA,NA,NA,NA,NA,NA,NA,NA,NA,NA,NA,NA,NA,NA,NA,NA,NA,NA,NA,NA,NA,NA,NA,NA,NA,NA,NA,NA,NA,NA,NA,NA,NA,NA,NA,NA,NA,NA,NA,NA,NA,NA,NA,NA,NA
NA,NA,NA,NA,NA,NA,NA,NA,NA,NA,NA,NA,NA,NA,NA,NA,NA,NA,NA,NA,NA,NA,NA,NA,NA,NA,NA,NA,NA,NA,NA,NA,NA,NA,NA,NA,NA,NA,NA,NA,NA,NA,NA,NA,NA,NA,NA,NA,NA,NA,NA,NA,NA,NA,NA
NA,NA,NA,NA,NA,NA,NA,NA,NA,NA,NA,NA,NA,NA,NA,NA,NA,NA,NA,NA,NA,NA,NA,NA,NA,NA,NA,NA,NA,NA,NA,NA,NA,NA,NA,NA,NA,NA,NA,NA,NA,NA,NA,NA,NA,NA,NA,NA,NA,NA,NA,NA,NA,NA,NA
NA,NA,NA,NA,NA,NA,NA,NA,NA,NA,NA,NA,NA,NA,NA,NA,NA,NA,NA,NA,NA,NA,NA,NA,NA,NA,NA,NA,NA,NA,NA,NA,NA,NA,NA,NA,NA,NA,NA,NA,NA,NA,NA,NA,NA,NA,NA,NA,NA,NA,NA,NA,NA,NA,NA
NA,NA,NA,NA,NA,NA,NA,NA,NA,NA,NA,NA,NA,NA,NA,NA,NA,NA,NA,NA,NA,NA,NA,NA,NA,NA,NA,NA,NA,NA,NA,NA,NA,NA,NA,NA,NA,NA,NA,NA,NA,NA,NA,NA,NA,NA,NA,NA,NA,NA,NA,NA,NA,NA,NA
NA,NA,NA,NA,NA,NA,NA,NA,NA,NA,NA,NA,NA,NA,NA,NA,NA,NA,NA,NA,NA,NA,NA,NA,NA,NA,NA,NA,NA,NA,NA,NA,NA,NA,NA,NA,NA,NA,NA,NA,NA,NA,NA,NA,NA,NA,NA,NA,NA,NA,NA,NA,NA,NA,NA
NA,NA,NA,NA,NA,NA,NA,NA,NA,NA,NA,NA,NA,NA,NA,NA,NA,NA,NA,NA,NA,NA,NA,NA,NA,NA,NA,NA,NA,NA,NA,NA,NA,NA,NA,NA,NA,NA,NA,NA,NA,NA,NA,NA,NA,NA,NA,NA,NA,NA,NA,NA,NA,NA,NA
NA,NA,NA,NA,NA,NA,NA,NA,NA,NA,NA,NA,NA,NA,NA,NA,NA,NA,NA,NA,NA,NA,NA,NA,NA,NA,NA,NA,NA,NA,NA,NA,NA,NA,NA,NA,NA,NA,NA,NA,NA,NA,NA,NA,NA,NA,NA,NA,NA,NA,NA,NA,NA,NA,NA
NA,NA,NA,NA,NA,NA,NA,NA,NA,NA,NA,NA,NA,NA,NA,NA,NA,NA,NA,NA,NA,NA,NA,NA,NA,NA,NA,NA,NA,NA,NA,NA,NA,NA,NA,NA,NA,NA,NA,NA,NA,NA,NA,NA,NA,NA,NA,NA,NA,NA,NA,NA,NA,NA,NA
NA,NA,NA,NA,NA,NA,NA,NA,NA,NA,NA,NA,NA,NA,NA,NA,NA,NA,NA,NA,NA,NA,NA,NA,NA,NA,NA,NA,NA,NA,NA,NA,NA,NA,NA,NA,NA,NA,NA,NA,NA,NA,NA,NA,NA,NA,NA,NA,NA,NA,NA,NA,NA,NA,NA
NA,NA,NA,NA,NA,NA,NA,NA,NA,NA,NA,NA,NA,NA,NA,NA,NA,NA,NA,NA,NA,NA,NA,NA,NA,NA,NA,NA,NA,NA,NA,NA,NA,NA,NA,NA,NA,NA,NA,NA,NA,NA,NA,NA,NA,NA,NA,NA,NA,NA,NA,NA,NA,NA,NA
NA,NA,NA,NA,NA,NA,NA,NA,NA,NA,NA,NA,NA,NA,NA,NA,NA,NA,NA,NA,NA,NA,NA,NA,NA,NA,NA,NA,NA,NA,NA,NA,NA,NA,NA,NA,NA,NA,NA,NA,NA,NA,NA,NA,NA,NA,NA,NA,NA,NA,NA,NA,NA,NA,NA
NA,NA,NA,NA,NA,NA,NA,NA,NA,NA,NA,NA,NA,NA,NA,NA,NA,NA,NA,NA,NA,NA,NA,NA,NA,NA,NA,NA,NA,NA,NA,NA,NA,NA,NA,NA,NA,NA,NA,NA,NA,NA,NA,NA,NA,NA,NA,NA,NA,NA,NA,NA,NA,NA,NA
NA,NA,NA,NA,NA,NA,NA,NA,NA,NA,NA,NA,NA,NA,NA,NA,NA,NA,NA,NA,NA,NA,NA,NA,NA,NA,NA,NA,NA,NA,NA,NA,NA,NA,NA,NA,NA,NA,NA,NA,NA,NA,NA,NA,NA,NA,NA,NA,NA,NA,NA,NA,NA,NA,NA
NA,NA,NA,NA,NA,NA,NA,NA,NA,NA,NA,NA,NA,NA,NA,NA,NA,NA,NA,NA,NA,NA,NA,NA,NA,NA,NA,NA,NA,NA,NA,NA,NA,NA,NA,NA,NA,NA,NA,NA,NA,NA,NA,NA,NA,NA,NA,NA,NA,NA,NA,NA,NA,NA,NA
NA,NA,NA,NA,NA,NA,NA,NA,NA,NA,NA,NA,NA,NA,NA,NA,NA,NA,NA,NA,NA,NA,NA,NA,NA,NA,NA,NA,NA,NA,NA,NA,NA,NA,NA,NA,NA,NA,NA,NA,NA,NA,NA,NA,NA,NA,NA,NA,NA,NA,NA,NA,NA,NA,NA
NA,NA,NA,NA,NA,NA,NA,NA,NA,NA,NA,NA,NA,NA,NA,NA,NA,NA,NA,NA,NA,NA,NA,NA,NA,NA,NA,NA,NA,NA,NA,NA,NA,NA,NA,NA,NA,NA,NA,NA,NA,NA,NA,NA,NA,NA,NA,NA,NA,NA,NA,NA,NA,NA,NA
NA,NA,NA,NA,NA,NA,NA,NA,NA,NA,NA,NA,NA,NA,NA,NA,NA,NA,NA,NA,NA,NA,NA,NA,NA,NA,NA,NA,NA,NA,NA,NA,NA,NA,NA,NA,NA,NA,NA,NA,NA,NA,NA,NA,NA,NA,NA,NA,NA,NA,NA,NA,NA,NA,NA
NA,NA,NA,NA,NA,NA,NA,NA,NA,NA,NA,NA,NA,NA,NA,NA,NA,NA,NA,NA,NA,NA,NA,NA,NA,NA,NA,NA,NA,NA,NA,NA,NA,NA,NA,NA,NA,NA,NA,NA,NA,NA,NA,NA,NA,NA,NA,NA,NA,NA,NA,NA,NA,NA,NA
NA,NA,NA,NA,NA,NA,NA,NA,NA,NA,NA,NA,NA,NA,NA,NA,NA,NA,NA,NA,NA,NA,NA,NA,NA,NA,NA,NA,NA,NA,NA,NA,NA,NA,NA,NA,NA,NA,NA,NA,NA,NA,NA,NA,NA,NA,NA,NA,NA,NA,NA,NA,NA,NA,NA
NA,NA,NA,NA,NA,NA,NA,NA,NA,NA,NA,NA,NA,NA,NA,NA,NA,NA,NA,NA,NA,NA,NA,NA,NA,NA,NA,NA,NA,NA,NA,NA,NA,NA,NA,NA,NA,NA,NA,NA,NA,NA,NA,NA,NA,NA,NA,NA,NA,NA,NA,NA,NA,NA,NA
NA,NA,NA,NA,NA,NA,NA,NA,NA,NA,NA,NA,NA,NA,NA,NA,NA,NA,NA,NA,NA,NA,NA,NA,NA,NA,NA,NA,NA,NA,NA,NA,NA,NA,NA,NA,NA,NA,NA,NA,NA,NA,NA,NA,NA,NA,NA,NA,NA,NA,NA,NA,NA,NA,NA
NA,NA,NA,NA,NA,NA,NA,NA,NA,NA,NA,NA,NA,NA,NA,NA,NA,NA,NA,NA,NA,NA,NA,NA,NA,NA,NA,NA,NA,NA,NA,NA,NA,NA,NA,NA,NA,NA,NA,NA,NA,NA,NA,NA,NA,NA,NA,NA,NA,NA,NA,NA,NA,NA,NA
NA,NA,NA,NA,NA,NA,NA,NA,NA,NA,NA,NA,NA,NA,NA,NA,NA,NA,NA,NA,NA,NA,NA,NA,NA,NA,NA,NA,NA,NA,NA,NA,NA,NA,NA,NA,NA,NA,NA,NA,NA,NA,NA,NA,NA,NA,NA,NA,NA,NA,NA,NA,NA,NA,NA
NA,NA,NA,NA,NA,NA,NA,NA,NA,NA,NA,NA,NA,NA,NA,NA,NA,NA,NA,NA,NA,NA,NA,NA,NA,NA,NA,NA,NA,NA,NA,NA,NA,NA,NA,NA,NA,NA,NA,NA,NA,NA,NA,NA,NA,NA,NA,NA,NA,NA,NA,NA,NA,NA,NA
NA,NA,NA,NA,NA,NA,NA,NA,NA,NA,NA,NA,NA,NA,NA,NA,NA,NA,NA,NA,NA,NA,NA,NA,NA,NA,NA,NA,NA,NA,NA,NA,NA,NA,NA,NA,NA,NA,NA,NA,NA,NA,NA,NA,NA,NA,NA,NA,NA,NA,NA,NA,NA,NA,NA
NA,NA,NA,NA,NA,NA,NA,NA,NA,NA,NA,NA,NA,NA,NA,NA,NA,NA,NA,NA,NA,NA,NA,NA,NA,NA,NA,NA,NA,NA,NA,NA,NA,NA,NA,NA,NA,NA,NA,NA,NA,NA,NA,NA,NA,NA,NA,NA,NA,NA,NA,NA,NA,NA,NA
NA,NA,NA,NA,NA,NA,NA,NA,NA,NA,NA,NA,NA,NA,NA,NA,NA,NA,NA,NA,NA,NA,NA,NA,NA,NA,NA,NA,NA,NA,NA,NA,NA,NA,NA,NA,NA,NA,NA,NA,NA,NA,NA,NA,NA,NA,NA,NA,NA,NA,NA,NA,NA,NA,NA
NA,NA,NA,NA,NA,NA,NA,NA,NA,NA,NA,NA,NA,NA,NA,NA,NA,NA,NA,NA,NA,NA,NA,NA,NA,NA,NA,NA,NA,NA,NA,NA,NA,NA,NA,NA,NA,NA,NA,NA,NA,NA,NA,NA,NA,NA,NA,NA,NA,NA,NA,NA,NA,NA,NA
NA,NA,NA,NA,NA,NA,NA,NA,NA,NA,NA,NA,NA,NA,NA,NA,NA,NA,NA,NA,NA,NA,NA,NA,NA,NA,NA,NA,NA,NA,NA,NA,NA,NA,NA,NA,NA,NA,NA,NA,NA,NA,NA,NA,NA,NA,NA,NA,NA,NA,NA,NA,NA,NA,NA
NA,NA,NA,NA,NA,NA,NA,NA,NA,NA,NA,NA,NA,NA,NA,NA,NA,NA,NA,NA,NA,NA,NA,NA,NA,NA,NA,NA,NA,NA,NA,NA,NA,NA,NA,NA,NA,NA,NA,NA,NA,NA,NA,NA,NA,NA,NA,NA,NA,NA,NA,NA,NA,NA,NA
NA,NA,NA,NA,NA,NA,NA,NA,NA,NA,NA,NA,NA,NA,NA,NA,NA,NA,NA,NA,NA,NA,NA,NA,NA,NA,NA,NA,NA,NA,NA,NA,NA,NA,NA,NA,NA,NA,NA,NA,NA,NA,NA,NA,NA,NA,NA,NA,NA,NA,NA,NA,NA,NA,NA
NA,NA,NA,NA,NA,NA,NA,NA,NA,NA,NA,NA,NA,NA,NA,NA,NA,NA,NA,NA,NA,NA,NA,NA,NA,NA,NA,NA,NA,NA,NA,NA,NA,NA,NA,NA,NA,NA,NA,NA,NA,NA,NA,NA,NA,NA,NA,NA,NA,NA,NA,NA,NA,NA,NA
NA,NA,NA,NA,NA,NA,NA,NA,NA,NA,NA,NA,NA,NA,NA,NA,NA,NA,NA,NA,NA,NA,NA,NA,NA,NA,NA,NA,NA,NA,NA,NA,NA,NA,NA,NA,NA,NA,NA,NA,NA,NA,NA,NA,NA,NA,NA,NA,NA,NA,NA,NA,NA,NA,NA
NA,NA,NA,NA,NA,NA,NA,NA,NA,NA,NA,NA,NA,NA,NA,NA,NA,NA,NA,NA,NA,NA,NA,NA,NA,NA,NA,NA,NA,NA,NA,NA,NA,NA,NA,NA,NA,NA,NA,NA,NA,NA,NA,NA,NA,NA,NA,NA,NA,NA,NA,NA,NA,NA,NA
NA,NA,NA,NA,NA,NA,NA,NA,NA,NA,NA,NA,NA,NA,NA,NA,NA,NA,NA,NA,NA,NA,NA,NA,NA,NA,NA,NA,NA,NA,NA,NA,NA,NA,NA,NA,NA,NA,NA,NA,NA,NA,NA,NA,NA,NA,NA,NA,NA,NA,NA,NA,NA,NA,NA
NA,NA,NA,NA,NA,NA,NA,NA,NA,NA,NA,NA,NA,NA,NA,NA,NA,NA,NA,NA,NA,NA,NA,NA,NA,NA,NA,NA,NA,NA,NA,NA,NA,NA,NA,NA,NA,NA,NA,NA,NA,NA,NA,NA,NA,NA,NA,NA,NA,NA,NA,NA,NA,NA,NA
NA,NA,NA,NA,NA,NA,NA,NA,NA,NA,NA,NA,NA,NA,NA,NA,NA,NA,NA,NA,NA,NA,NA,NA,NA,NA,NA,NA,NA,NA,NA,NA,NA,NA,NA,NA,NA,NA,NA,NA,NA,NA,NA,NA,NA,NA,NA,NA,NA,NA,NA,NA,NA,NA,NA
NA,NA,NA,NA,NA,NA,NA,NA,NA,NA,NA,NA,NA,NA,NA,NA,NA,NA,NA,NA,NA,NA,NA,NA,NA,NA,NA,NA,NA,NA,NA,NA,NA,NA,NA,NA,NA,NA,NA,NA,NA,NA,NA,NA,NA,NA,NA,NA,NA,NA,NA,NA,NA,NA,NA
NA,NA,NA,NA,NA,NA,NA,NA,NA,NA,NA,NA,NA,NA,NA,NA,NA,NA,NA,NA,NA,NA,NA,NA,NA,NA,NA,NA,NA,NA,NA,NA,NA,NA,NA,NA,NA,NA,NA,NA,NA,NA,NA,NA,NA,NA,NA,NA,NA,NA,NA,NA,NA,NA,NA
NA,NA,NA,NA,NA,NA,NA,NA,NA,NA,NA,NA,NA,NA,NA,NA,NA,NA,NA,NA,NA,NA,NA,NA,NA,NA,NA,NA,NA,NA,NA,NA,NA,NA,NA,NA,NA,NA,NA,NA,NA,NA,NA,NA,NA,NA,NA,NA,NA,NA,NA,NA,NA,NA,NA
NA,NA,NA,NA,NA,NA,NA,NA,NA,NA,NA,NA,NA,NA,NA,NA,NA,NA,NA,NA,NA,NA,NA,NA,NA,NA,NA,NA,NA,NA,NA,NA,NA,NA,NA,NA,NA,NA,NA,NA,NA,NA,NA,NA,NA,NA,NA,NA,NA,NA,NA,NA,NA,NA,NA
NA,NA,NA,NA,NA,NA,NA,NA,NA,NA,NA,NA,NA,NA,NA,NA,NA,NA,NA,NA,NA,NA,NA,NA,NA,NA,NA,NA,NA,NA,NA,NA,NA,NA,NA,NA,NA,NA,NA,NA,NA,NA,NA,NA,NA,NA,NA,NA,NA,NA,NA,NA,NA,NA,NA
NA,NA,NA,NA,NA,NA,NA,NA,NA,NA,NA,NA,NA,NA,NA,NA,NA,NA,NA,NA,NA,NA,NA,NA,NA,NA,NA,NA,NA,NA,NA,NA,NA,NA,NA,NA,NA,NA,NA,NA,NA,NA,NA,NA,NA,NA,NA,NA,NA,NA,NA,NA,NA,NA,NA
NA,NA,NA,NA,NA,NA,NA,NA,NA,NA,NA,NA,NA,NA,NA,NA,NA,NA,NA,NA,NA,NA,NA,NA,NA,NA,NA,NA,NA,NA,NA,NA,NA,NA,NA,NA,NA,NA,NA,NA,NA,NA,NA,NA,NA,NA,NA,NA,NA,NA,NA,NA,NA,NA,NA
NA,NA,NA,NA,NA,NA,NA,NA,NA,NA,NA,NA,NA,NA,NA,NA,NA,NA,NA,NA,NA,NA,NA,NA,NA,NA,NA,NA,NA,NA,NA,NA,NA,NA,NA,NA,NA,NA,NA,NA,NA,NA,NA,NA,NA,NA,NA,NA,NA,NA,NA,NA,NA,NA,NA
NA,NA,NA,NA,NA,NA,NA,NA,NA,NA,NA,NA,NA,NA,NA,NA,NA,NA,NA,NA,NA,NA,NA,NA,NA,NA,NA,NA,NA,NA,NA,NA,NA,NA,NA,NA,NA,NA,NA,NA,NA,NA,NA,NA,NA,NA,NA,NA,NA,NA,NA,NA,NA,NA,NA
NA,NA,NA,NA,NA,NA,NA,NA,NA,NA,NA,NA,NA,NA,NA,NA,NA,NA,NA,NA,NA,NA,NA,NA,NA,NA,NA,NA,NA,NA,NA,NA,NA,NA,NA,NA,NA,NA,NA,NA,NA,NA,NA,NA,NA,NA,NA,NA,NA,NA,NA,NA,NA,NA,NA
NA,NA,NA,NA,NA,NA,NA,NA,NA,NA,NA,NA,NA,NA,NA,NA,NA,NA,NA,NA,NA,NA,NA,NA,NA,NA,NA,NA,NA,NA,NA,NA,NA,NA,NA,NA,NA,NA,NA,NA,NA,NA,NA,NA,NA,NA,NA,NA,NA,NA,NA,NA,NA,NA,NA
NA,NA,NA,NA,NA,NA,NA,NA,NA,NA,NA,NA,NA,NA,NA,NA,NA,NA,NA,NA,NA,NA,NA,NA,NA,NA,NA,NA,NA,NA,NA,NA,NA,NA,NA,NA,NA,NA,NA,NA,NA,NA,NA,NA,NA,NA,NA,NA,NA,NA,NA,NA,NA,NA,NA
NA,NA,NA,NA,NA,NA,NA,NA,NA,NA,NA,NA,NA,NA,NA,NA,NA,NA,NA,NA,NA,NA,NA,NA,NA,NA,NA,NA,NA,NA,NA,NA,NA,NA,NA,NA,NA,NA,NA,NA,NA,NA,NA,NA,NA,NA,NA,NA,NA,NA,NA,NA,NA,NA,NA
NA,NA,NA,NA,NA,NA,NA,NA,NA,NA,NA,NA,NA,NA,NA,NA,NA,NA,NA,NA,NA,NA,NA,NA,NA,NA,NA,NA,NA,NA,NA,NA,NA,NA,NA,NA,NA,NA,NA,NA,NA,NA,NA,NA,NA,NA,NA,NA,NA,NA,NA,NA,NA,NA,NA
NA,NA,NA,NA,NA,NA,NA,NA,NA,NA,NA,NA,NA,NA,NA,NA,NA,NA,NA,NA,NA,NA,NA,NA,NA,NA,NA,NA,NA,NA,NA,NA,NA,NA,NA,NA,NA,NA,NA,NA,NA,NA,NA,NA,NA,NA,NA,NA,NA,NA,NA,NA,NA,NA,NA
NA,NA,NA,NA,NA,NA,NA,NA,NA,NA,NA,NA,NA,NA,NA,NA,NA,NA,NA,NA,NA,NA,NA,NA,NA,NA,NA,NA,NA,NA,NA,NA,NA,NA,NA,NA,NA,NA,NA,NA,NA,NA,NA,NA,NA,NA,NA,NA,NA,NA,NA,NA,NA,NA,NA
NA,NA,NA,NA,NA,NA,NA,NA,NA,NA,NA,NA,NA,NA,NA,NA,NA,NA,NA,NA,NA,NA,NA,NA,NA,NA,NA,NA,NA,NA,NA,NA,NA,NA,NA,NA,NA,NA,NA,NA,NA,NA,NA,NA,NA,NA,NA,NA,NA,NA,NA,NA,NA,NA,NA
NA,NA,NA,NA,NA,NA,NA,NA,NA,NA,NA,NA,NA,NA,NA,NA,NA,NA,NA,NA,NA,NA,NA,NA,NA,NA,NA,NA,NA,NA,NA,NA,NA,NA,NA,NA,NA,NA,NA,NA,NA,NA,NA,NA,NA,NA,NA,NA,NA,NA,NA,NA,NA,NA,NA
NA,NA,NA,NA,NA,NA,NA,NA,NA,NA,NA,NA,NA,NA,NA,NA,NA,NA,NA,NA,NA,NA,NA,NA,NA,NA,NA,NA,NA,NA,NA,NA,NA,NA,NA,NA,NA,NA,NA,NA,NA,NA,NA,NA,NA,NA,NA,NA,NA,NA,NA,NA,NA,NA,NA
NA,NA,NA,NA,NA,NA,NA,NA,NA,NA,NA,NA,NA,NA,NA,NA,NA,NA,NA,NA,NA,NA,NA,NA,NA,NA,NA,NA,NA,NA,NA,NA,NA,NA,NA,NA,NA,NA,NA,NA,NA,NA,NA,NA,NA,NA,NA,NA,NA,NA,NA,NA,NA,NA,NA
NA,NA,NA,NA,NA,NA,NA,NA,NA,NA,NA,NA,NA,NA,NA,NA,NA,NA,NA,NA,NA,NA,NA,NA,NA,NA,NA,NA,NA,NA,NA,NA,NA,NA,NA,NA,NA,NA,NA,NA,NA,NA,NA,NA,NA,NA,NA,NA,NA,NA,NA,NA,NA,NA,NA
NA,NA,NA,NA,NA,NA,NA,NA,NA,NA,NA,NA,NA,NA,NA,NA,NA,NA,NA,NA,NA,NA,NA,NA,NA,NA,NA,NA,NA,NA,NA,NA,NA,NA,NA,NA,NA,NA,NA,NA,NA,NA,NA,NA,NA,NA,NA,NA,NA,NA,NA,NA,NA,NA,NA
NA,NA,NA,NA,NA,NA,NA,NA,NA,NA,NA,NA,NA,NA,NA,NA,NA,NA,NA,NA,NA,NA,NA,NA,NA,NA,NA,NA,NA,NA,NA,NA,NA,NA,NA,NA,NA,NA,NA,NA,NA,NA,NA,NA,NA,NA,NA,NA,NA,NA,NA,NA,NA,NA,NA
NA,NA,NA,NA,NA,NA,NA,NA,NA,NA,NA,NA,NA,NA,NA,NA,NA,NA,NA,NA,NA,NA,NA,NA,NA,NA,NA,NA,NA,NA,NA,NA,NA,NA,NA,NA,NA,NA,NA,NA,NA,NA,NA,NA,NA,NA,NA,NA,NA,NA,NA,NA,NA,NA,NA
NA,NA,NA,NA,NA,NA,NA,NA,NA,NA,NA,NA,NA,NA,NA,NA,NA,NA,NA,NA,NA,NA,NA,NA,NA,NA,NA,NA,NA,NA,NA,NA,NA,NA,NA,NA,NA,NA,NA,NA,NA,NA,NA,NA,NA,NA,NA,NA,NA,NA,NA,NA,NA,NA,NA
NA,NA,NA,NA,NA,NA,NA,NA,NA,NA,NA,NA,NA,NA,NA,NA,NA,NA,NA,NA,NA,NA,NA,NA,NA,NA,NA,NA,NA,NA,NA,NA,NA,NA,NA,NA,NA,NA,NA,NA,NA,NA,NA,NA,NA,NA,NA,NA,NA,NA,NA,NA,NA,NA,NA
NA,NA,NA,NA,NA,NA,NA,NA,NA,NA,NA,NA,NA,NA,NA,NA,NA,NA,NA,NA,NA,NA,NA,NA,NA,NA,NA,NA,NA,NA,NA,NA,NA,NA,NA,NA,NA,NA,NA,NA,NA,NA,NA,NA,NA,NA,NA,NA,NA,NA,NA,NA,NA,NA,NA
NA,NA,NA,NA,NA,NA,NA,NA,NA,NA,NA,NA,NA,NA,NA,NA,NA,NA,NA,NA,NA,NA,NA,NA,NA,NA,NA,NA,NA,NA,NA,NA,NA,NA,NA,NA,NA,NA,NA,NA,NA,NA,NA,NA,NA,NA,NA,NA,NA,NA,NA,NA,NA,NA,NA
NA,NA,NA,NA,NA,NA,NA,NA,NA,NA,NA,NA,NA,NA,NA,NA,NA,NA,NA,NA,NA,NA,NA,NA,NA,NA,NA,NA,NA,NA,NA,NA,NA,NA,NA,NA,NA,NA,NA,NA,NA,NA,NA,NA,NA,NA,NA,NA,NA,NA,NA,NA,NA,NA,NA
NA,NA,NA,NA,NA,NA,NA,NA,NA,NA,NA,NA,NA,NA,NA,NA,NA,NA,NA,NA,NA,NA,NA,NA,NA,NA,NA,NA,NA,NA,NA,NA,NA,NA,NA,NA,NA,NA,NA,NA,NA,NA,NA,NA,NA,NA,NA,NA,NA,NA,NA,NA,NA,NA,NA
NA,NA,NA,NA,NA,NA,NA,NA,NA,NA,NA,NA,NA,NA,NA,NA,NA,NA,NA,NA,NA,NA,NA,NA,NA,NA,NA,NA,NA,NA,NA,NA,NA,NA,NA,NA,NA,NA,NA,NA,NA,NA,NA,NA,NA,NA,NA,NA,NA,NA,NA,NA,NA,NA,NA
NA,NA,NA,NA,NA,NA,NA,NA,NA,NA,NA,NA,NA,NA,NA,NA,NA,NA,NA,NA,NA,NA,NA,NA,NA,NA,NA,NA,NA,NA,NA,NA,NA,NA,NA,NA,NA,NA,NA,NA,NA,NA,NA,NA,NA,NA,NA,NA,NA,NA,NA,NA,NA,NA,NA
NA,NA,NA,NA,NA,NA,NA,NA,NA,NA,NA,NA,NA,NA,NA,NA,NA,NA,NA,NA,NA,NA,NA,NA,NA,NA,NA,NA,NA,NA,NA,NA,NA,NA,NA,NA,NA,NA,NA,NA,NA,NA,NA,NA,NA,NA,NA,NA,NA,NA,NA,NA,NA,NA,NA
NA,NA,NA,NA,NA,NA,NA,NA,NA,NA,NA,NA,NA,NA,NA,NA,NA,NA,NA,NA,NA,NA,NA,NA,NA,NA,NA,NA,NA,NA,NA,NA,NA,NA,NA,NA,NA,NA,NA,NA,NA,NA,NA,NA,NA,NA,NA,NA,NA,NA,NA,NA,NA,NA,NA
NA,NA,NA,NA,NA,NA,NA,NA,NA,NA,NA,NA,NA,NA,NA,NA,NA,NA,NA,NA,NA,NA,NA,NA,NA,NA,NA,NA,NA,NA,NA,NA,NA,NA,NA,NA,NA,NA,NA,NA,NA,NA,NA,NA,NA,NA,NA,NA,NA,NA,NA,NA,NA,NA,NA
NA,NA,NA,NA,NA,NA,NA,NA,NA,NA,NA,NA,NA,NA,NA,NA,NA,NA,NA,NA,NA,NA,NA,NA,NA,NA,NA,NA,NA,NA,NA,NA,NA,NA,NA,NA,NA,NA,NA,NA,NA,NA,NA,NA,NA,NA,NA,NA,NA,NA,NA,NA,NA,NA,NA
NA,NA,NA,NA,NA,NA,NA,NA,NA,NA,NA,NA,NA,NA,NA,NA,NA,NA,NA,NA,NA,NA,NA,NA,NA,NA,NA,NA,NA,NA,NA,NA,NA,NA,NA,NA,NA,NA,NA,NA,NA,NA,NA,NA,NA,NA,NA,NA,NA,NA,NA,NA,NA,NA,NA
NA,NA,NA,NA,NA,NA,NA,NA,NA,NA,NA,NA,NA,NA,NA,NA,NA,NA,NA,NA,NA,NA,NA,NA,NA,NA,NA,NA,NA,NA,NA,NA,NA,NA,NA,NA,NA,NA,NA,NA,NA,NA,NA,NA,NA,NA,NA,NA,NA,NA,NA,NA,NA,NA,NA
NA,NA,NA,NA,NA,NA,NA,NA,NA,NA,NA,NA,NA,NA,NA,NA,NA,NA,NA,NA,NA,NA,NA,NA,NA,NA,NA,NA,NA,NA,NA,NA,NA,NA,NA,NA,NA,NA,NA,NA,NA,NA,NA,NA,NA,NA,NA,NA,NA,NA,NA,NA,NA,NA,NA
NA,NA,NA,NA,NA,NA,NA,NA,NA,NA,NA,NA,NA,NA,NA,NA,NA,NA,NA,NA,NA,NA,NA,NA,NA,NA,NA,NA,NA,NA,NA,NA,NA,NA,NA,NA,NA,NA,NA,NA,NA,NA,NA,NA,NA,NA,NA,NA,NA,NA,NA,NA,NA,NA,NA
NA,NA,NA,NA,NA,NA,NA,NA,NA,NA,NA,NA,NA,NA,NA,NA,NA,NA,NA,NA,NA,NA,NA,NA,NA,NA,NA,NA,NA,NA,NA,NA,NA,NA,NA,NA,NA,NA,NA,NA,NA,NA,NA,NA,NA,NA,NA,NA,NA,NA,NA,NA,NA,NA,NA
NA,NA,NA,NA,NA,NA,NA,NA,NA,NA,NA,NA,NA,NA,NA,NA,NA,NA,NA,NA,NA,NA,NA,NA,NA,NA,NA,NA,NA,NA,NA,NA,NA,NA,NA,NA,NA,NA,NA,NA,NA,NA,NA,NA,NA,NA,NA,NA,NA,NA,NA,NA,NA,NA,NA
NA,NA,NA,NA,NA,NA,NA,NA,NA,NA,NA,NA,NA,NA,NA,NA,NA,NA,NA,NA,NA,NA,NA,NA,NA,NA,NA,NA,NA,NA,NA,NA,NA,NA,NA,NA,NA,NA,NA,NA,NA,NA,NA,NA,NA,NA,NA,NA,NA,NA,NA,NA,NA,NA,NA
NA,NA,NA,NA,NA,NA,NA,NA,NA,NA,NA,NA,NA,NA,NA,NA,NA,NA,NA,NA,NA,NA,NA,NA,NA,NA,NA,NA,NA,NA,NA,NA,NA,NA,NA,NA,NA,NA,NA,NA,NA,NA,NA,NA,NA,NA,NA,NA,NA,NA,NA,NA,NA,NA,NA
NA,NA,NA,NA,NA,NA,NA,NA,NA,NA,NA,NA,NA,NA,NA,NA,NA,NA,NA,NA,NA,NA,NA,NA,NA,NA,NA,NA,NA,NA,NA,NA,NA,NA,NA,NA,NA,NA,NA,NA,NA,NA,NA,NA,NA,NA,NA,NA,NA,NA,NA,NA,NA,NA,NA
NA,NA,NA,NA,NA,NA,NA,NA,NA,NA,NA,NA,NA,NA,NA,NA,NA,NA,NA,NA,NA,NA,NA,NA,NA,NA,NA,NA,NA,NA,NA,NA,NA,NA,NA,NA,NA,NA,NA,NA,NA,NA,NA,NA,NA,NA,NA,NA,NA,NA,NA,NA,NA,NA,NA
NA,NA,NA,NA,NA,NA,NA,NA,NA,NA,NA,NA,NA,NA,NA,NA,NA,NA,NA,NA,NA,NA,NA,NA,NA,NA,NA,NA,NA,NA,NA,NA,NA,NA,NA,NA,NA,NA,NA,NA,NA,NA,NA,NA,NA,NA,NA,NA,NA,NA,NA,NA,NA,NA,NA
NA,NA,NA,NA,NA,NA,NA,NA,NA,NA,NA,NA,NA,NA,NA,NA,NA,NA,NA,NA,NA,NA,NA,NA,NA,NA,NA,NA,NA,NA,NA,NA,NA,NA,NA,NA,NA,NA,NA,NA,NA,NA,NA,NA,NA,NA,NA,NA,NA,NA,NA,NA,NA,NA,NA
NA,NA,NA,NA,NA,NA,NA,NA,NA,NA,NA,NA,NA,NA,NA,NA,NA,NA,NA,NA,NA,NA,NA,NA,NA,NA,NA,NA,NA,NA,NA,NA,NA,NA,NA,NA,NA,NA,NA,NA,NA,NA,NA,NA,NA,NA,NA,NA,NA,NA,NA,NA,NA,NA,NA
NA,NA,NA,NA,NA,NA,NA,NA,NA,NA,NA,NA,NA,NA,NA,NA,NA,NA,NA,NA,NA,NA,NA,NA,NA,NA,NA,NA,NA,NA,NA,NA,NA,NA,NA,NA,NA,NA,NA,NA,NA,NA,NA,NA,NA,NA,NA,NA,NA,NA,NA,NA,NA,NA,NA
NA,NA,NA,NA,NA,NA,NA,NA,NA,NA,NA,NA,NA,NA,NA,NA,NA,NA,NA,NA,NA,NA,NA,NA,NA,NA,NA,NA,NA,NA,NA,NA,NA,NA,NA,NA,NA,NA,NA,NA,NA,NA,NA,NA,NA,NA,NA,NA,NA,NA,NA,NA,NA,NA,NA
NA,NA,NA,NA,NA,NA,NA,NA,NA,NA,NA,NA,NA,NA,NA,NA,NA,NA,NA,NA,NA,NA,NA,NA,NA,NA,NA,NA,NA,NA,NA,NA,NA,NA,NA,NA,NA,NA,NA,NA,NA,NA,NA,NA,NA,NA,NA,NA,NA,NA,NA,NA,NA,NA,NA
NA,NA,NA,NA,NA,NA,NA,NA,NA,NA,NA,NA,NA,NA,NA,NA,NA,NA,NA,NA,NA,NA,NA,NA,NA,NA,NA,NA,NA,NA,NA,NA,NA,NA,NA,NA,NA,NA,NA,NA,NA,NA,NA,NA,NA,NA,NA,NA,NA,NA,NA,NA,NA,NA,NA
NA,NA,NA,NA,NA,NA,NA,NA,NA,NA,NA,NA,NA,NA,NA,NA,NA,NA,NA,NA,NA,NA,NA,NA,NA,NA,NA,NA,NA,NA,NA,NA,NA,NA,NA,NA,NA,NA,NA,NA,NA,NA,NA,NA,NA,NA,NA,NA,NA,NA,NA,NA,NA,NA,NA
NA,NA,NA,NA,NA,NA,NA,NA,NA,NA,NA,NA,NA,NA,NA,NA,NA,NA,NA,NA,NA,NA,NA,NA,NA,NA,NA,NA,NA,NA,NA,NA,NA,NA,NA,NA,NA,NA,NA,NA,NA,NA,NA,NA,NA,NA,NA,NA,NA,NA,NA,NA,NA,NA,NA
